name	shop_location	shopee_verified	discount	is_adult	options	show_official_shop_label_in_title	rating_star	rating_count	flash_sale	upcoming_flash_sale	price_min	price_min_before_discoun	price_max	price_max_before_discount	price	price_before_discount	coin_earn_label	liked_count	view_count	cmt_count	is_preferred_plus_seller	show_free_shipping	images	video_info_list	sold	historical_sold
Quần Short Thể Thao Dây Rút Trẻ Trung Thời Trang Nam	Nước ngoài	False	50%	False	4	False	0.0	[0, 0, 0, 0, 0, 0]	None	None	6100000000	12000000000	8200000000	12400000000	6100000000	12000000000	None	0	0	0	False	False	6	0	0	0
Quần Jeans Dài Phối Vết Rách Cá Tính Thời Trang Nam	Nước ngoài	False	None	False	5	False	0.0	[0, 0, 0, 0, 0, 0]	None	None	45540000000	-1	45540000000	-1	45540000000	0	None	0	0	0	False	False	9	0	0	0
HOT 12.12 . ⭐ ⚡ | .s | | 10-10 |_ Quần Bò thời trang nam- quần bò DSQ cao cấp -- Siêu Đẹp .. . 2020 . . Xịn . . 👈 ⇤ :	Ninh Bình	False	None	False	5	False	0.0	[0, 0, 0, 0, 0, 0]	None	None	15827000000	-1	15827000000	-1	15827000000	0	None	0	0	0	False	False	1	0	0	0
Quần tây nam hàn quốc (màu đen) ống côn dáng body, phong cách thời trang nam cao cấp	Hà Nội	False	None	False	7	False	0.0	[0, 0, 0, 0, 0, 0]	None	None	68000000000	-1	68000000000	-1	68000000000	0	None	0	0	0	False	False	9	0	0	0
Quần Jeans Dài Phối Vết Rách Cá Tính Thời Trang Nam	Nước ngoài	False	12%	False	8	False	0.0	[0, 0, 0, 0, 0, 0]	None	None	46630000000	53250000000	46630000000	53250000000	46630000000	53250000000	None	0	0	0	False	False	8	0	0	0
[ Hot Trend ] QUẦN JEAN NGỐ THỜI TRANG NAM CAO CẤP CHẤT ĐẸP [ Bản Mới 2021 ]	Hà Nội	False	25%	False	7	False	0.0	[0, 0, 0, 0, 0, 0]	None	None	55181300000	73575000000	55181300000	73575000000	55181300000	73575000000	None	0	0	0	False	False	9	0	0	0
Quần Dài Ống Bo Kẻ Sọc Trẻ Trung Thời Trang Nam	Nước ngoài	False	35%	False	6	False	0.0	[0, 0, 0, 0, 0, 0]	None	None	17894200000	27529500000	17894200000	27529500000	17894200000	27529500000	None	0	0	0	False	False	7	0	0	0
QUẦN BAGGY ĐŨI NAM Thời Trang Nam Cao Cấp Thương Hiệu Raacus (4 màu)	Hải Phòng	False	None	False	7	False	0.0	[0, 0, 0, 0, 0, 0]	None	None	35000000000	-1	35000000000	-1	35000000000	0	None	1	0	0	False	False	5	1	0	0
Quần Jeans Xé Ống Dài Hình Chuột Mickey Thời Trang Nam Cá Tính	Nước ngoài	False	None	False	8	False	0.0	[0, 0, 0, 0, 0, 0]	None	None	20180000000	-1	27490000000	-1	20180000000	0	None	0	1	0	False	False	7	0	0	0
Quần Thể Thao Plus Size Ống Suông Rộng Thời Trang Nam Năng Động	Nước ngoài	False	39%	False	7	False	0.0	[0, 0, 0, 0, 0, 0]	None	None	39340000000	64100000000	39340000000	64100000000	39340000000	64100000000	None	0	0	0	False	False	9	0	0	0
Quần lót cotton thời trang nam	Nước ngoài	False	None	False	6	False	0.0	[0, 0, 0, 0, 0, 0]	None	None	14840000000	-1	18910000000	-1	14840000000	0	None	0	0	0	False	False	3	0	0	0
Quần Dài Ống Đứng Thời Trang Nam	Nước ngoài	False	None	False	8	False	0.0	[0, 0, 0, 0, 0, 0]	None	None	25130000000	-1	27420000000	-1	25130000000	0	None	0	0	0	False	False	5	0	0	0
Quần Jean Rách Thời Trang Nam	Nước ngoài	False	43%	False	9	False	0.0	[0, 0, 0, 0, 0, 0]	None	None	35790000000	62340000000	40160000000	69880000000	35790000000	62340000000	None	0	0	0	False	False	4	0	0	0
QUẦN LÓT COTTON THỜI TRANG NAM CO GIÃN	Hà Nội	False	50%	False	1	False	0.0	[0, 0, 0, 0, 0, 0]	None	None	7500000000	15000000000	7500000000	15000000000	7500000000	15000000000	None	162	166	0	False	True	5	0	0	0
Quần Short Lưng Thun Thời Trang Nam	Nước ngoài	False	50%	False	4	False	0.0	[0, 0, 0, 0, 0, 0]	None	None	40760000000	80850000000	40760000000	80850000000	40760000000	80850000000	None	0	0	0	False	False	9	0	0	0
🥑ｓốｃ | ĐẲNG CẤP |_ Quần Bò thời trang nam- quần bò DSQ cao cấp -- Siêu Đẹp M09 🥑 ⚡ : *	TP. Hồ Chí Minh	False	None	False	5	False	0.0	[0, 0, 0, 0, 0, 0]	None	None	23933500000	-1	23933500000	-1	23933500000	0	None	0	0	0	False	False	1	0	0	0
Quần Short Jean Rách Thời Trang Nam	Nước ngoài	False	None	False	2	False	0.0	[0, 0, 0, 0, 0, 0]	None	None	73710000000	-1	73710000000	-1	73710000000	0	None	0	0	0	False	False	5	0	0	0
Quần Dài Thời Trang Nam Phong Cách Hip Hop	Nước ngoài	False	None	False	6	False	0.0	[0, 0, 0, 0, 0, 0]	None	None	23925000000	-1	23925000000	-1	23925000000	0	None	0	0	0	False	True	9	0	0	0
11.11 👆 Sale | NGON BỔ RẺ | | ĐẲNG CẤP |_ Quần Jean nam.quần bò thời trang nam SPF new __ Siêu Đẹp .. . 👆	TP. Hồ Chí Minh	False	None	False	7	False	0.0	[0, 0, 0, 0, 0, 0]	None	None	26192000000	-1	26192000000	-1	26192000000	0	None	0	0	0	False	False	5	0	0	0
Quần Jean Rách Thời Trang Nam	Nước ngoài	False	None	False	10	False	0.0	[0, 0, 0, 0, 0, 0]	None	None	31390000000	-1	31390000000	-1	31390000000	0	None	0	0	0	False	False	8	0	0	0
🌺 ⭐ SALE Quần Bò thời trang nam- quần bò DSQ cao cấp 🌟 . : ⭐ . :	TP. Hồ Chí Minh	False	None	False	5	False	0.0	[0, 0, 0, 0, 0, 0]	None	None	18336400000	-1	18336400000	-1	18336400000	0	None	0	0	0	False	False	1	0	0	0
Quần Short Jeans Thời Trang Nam Phong Cách Năng Động	Nước ngoài	False	None	False	8	False	0.0	[0, 0, 0, 0, 0, 0]	None	None	29040000000	-1	44010000000	-1	29040000000	0	None	0	0	0	False	False	8	0	0	0
⭐ [ Mua Nhiều Giảm Giá ] QUẦN JEAN THỜI TRANG NAM CAO CẤP CHẤT ĐẸP [ Mẫu Mới Cực Chất ] ⭐	Hải Dương	False	30%	False	7	False	0.0	[0, 0, 0, 0, 0, 0]	None	None	51922900000	74175500000	51922900000	74175500000	51922900000	74175500000	None	0	0	0	False	False	9	0	0	0
Quần Jean Rách Thời Trang Nam	Nước ngoài	False	None	False	5	False	0.0	[0, 0, 0, 0, 0, 0]	None	None	53130000000	-1	53130000000	-1	53130000000	0	None	0	0	0	False	False	9	0	0	0
Quần Jeans Dài Phối Vết Rách Cá Tính Thời Trang Nam	Nước ngoài	False	40%	False	6	False	0.0	[0, 0, 0, 0, 0, 0]	None	None	19739100000	32898500000	19739100000	32898500000	19739100000	32898500000	None	0	0	0	False	False	6	0	0	0
Quần Dài Ống Đứng Thời Trang Nam	Nước ngoài	False	None	False	9	False	0.0	[0, 0, 0, 0, 0, 0]	None	None	66380000000	-1	66380000000	-1	66380000000	0	None	0	0	0	False	False	9	0	0	0
Quần Dài Ống Đứng Thời Trang Nam	Nước ngoài	False	None	False	3	False	0.0	[0, 0, 0, 0, 0, 0]	None	None	46520000000	-1	46520000000	-1	46520000000	0	None	0	0	0	False	False	9	0	0	0
Quần Jean Rách Thời Trang Nam	Nước ngoài	False	18%	False	5	False	0.0	[0, 0, 0, 0, 0, 0]	None	None	30970000000	37640000000	30970000000	37640000000	30970000000	37640000000	None	0	0	0	False	False	4	0	0	0
Quần Lót Boxer Vải Lụa Lạnh Màu Trơn Thời Trang Nam Cao Cấp	Nước ngoài	False	None	False	4	False	0.0	[0, 0, 0, 0, 0, 0]	None	None	12340000000	-1	12340000000	-1	12340000000	0	None	0	0	0	False	False	6	0	0	0
Quần Short Denim Phối Màu Trẻ Trung Thời Trang Nam	Nước ngoài	False	50%	False	8	False	0.0	[0, 0, 0, 0, 0, 0]	None	None	23550000000	46860000000	23550000000	46860000000	23550000000	46860000000	None	0	0	0	False	False	9	0	0	0
Quần Lửng 7 Màu Thời Trang Nam	Nước ngoài	False	20%	False	7	False	0.0	[0, 0, 0, 0, 0, 0]	None	None	66650000000	83730000000	66650000000	83730000000	66650000000	83730000000	None	0	0	0	False	False	9	0	0	0
Quần Dài Lưng Thun Thời Trang Nam	Nước ngoài	False	47%	False	8	False	0.0	[0, 0, 0, 0, 0, 0]	None	None	21390000000	40260000000	23440000000	44000000000	21390000000	40260000000	None	0	0	0	False	False	6	0	0	0
Quần Dài Ống Đứng Thời Trang Nam	Nước ngoài	False	None	False	6	False	0.0	[0, 0, 0, 0, 0, 0]	None	None	19540000000	-1	19540000000	-1	19540000000	0	None	0	0	0	False	False	3	0	0	0
[CHÍNH HÃNG]  Quần shorts nam bigsize, Quần đùi nam Bigsize, Thời trang nam bigsize Siêu mịn, siêu đẹp, Hàng Công Ty Chí	Hà Nội	False	None	False	3	False	0.0	[0, 0, 0, 0, 0, 0]	None	None	16900000000	-1	16900000000	-1	16900000000	0	None	0	0	0	False	False	9	0	0	0
[ Thời trang cao cấp ] QUẦN JEAN NGỐ THỜI TRANG NAM CAO CẤP CHẤT ĐẸP - Xả hàng	Hòa Bình	False	25%	False	7	False	0.0	[0, 0, 0, 0, 0, 0]	None	None	54500100000	72666700000	54500100000	72666700000	54500100000	72666700000	None	0	0	0	False	False	4	0	0	0
Quần Yếm Jeans Trẻ Trung Thời Trang Nam	Nước ngoài	False	5%	False	8	False	0.0	[0, 0, 0, 0, 0, 0]	None	None	58860000000	62050000000	58860000000	62050000000	58860000000	62050000000	None	0	0	0	False	False	9	0	0	0
Sale 🥑ｓốｃ ⭐ ⚡ | Sales | | 10-10 |_ Quần Bò thời trang nam- quần bò DSQ cao cấp -- Siêu Đẹp .. . 2020 . . . Xịn 🥑 ⚡ . '	Hải Dương	False	None	False	5	False	0.0	[0, 0, 0, 0, 0, 0]	None	None	15536400000	-1	15536400000	-1	15536400000	0	None	0	0	0	False	False	1	0	0	0
Quần dài ống túm thời trang nam năng động	Nước ngoài	False	None	False	7	False	0.0	[0, 0, 0, 0, 0, 0]	None	None	83700000000	-1	83700000000	-1	83700000000	0	None	0	0	0	False	False	9	0	0	0
🍎SALE 10.10 Sale | NGON BỔ RẺ | | ĐẲNG CẤP |_ Quần Jean nam.quần bò thời trang nam SPF new __ Siêu Đẹp .. . . 🍎	Hòa Bình	False	None	False	7	False	0.0	[0, 0, 0, 0, 0, 0]	None	None	20429600000	-1	20429600000	-1	20429600000	0	None	0	0	0	False	False	5	0	0	0
Quần Jeans Dài Phối Vết Rách Cá Tính Thời Trang Nam	Nước ngoài	False	49%	False	9	False	0.0	[0, 0, 0, 0, 0, 0]	None	None	17850000000	35280000000	17850000000	35280000000	17850000000	35280000000	None	0	0	0	False	False	4	0	0	0
[ Hàng mới 2021 ] QUẦN JEAN THỜI TRANG NAM CAO CẤP CHẤT ĐẸP [ Đặt Ngay FreeShip ]	Hà Nội	False	22%	False	7	False	0.0	[0, 0, 0, 0, 0, 0]	None	None	74500000000	95512800000	74500000000	95512800000	74500000000	95512800000	None	0	0	0	False	False	9	0	0	0
Quần denim ống dài rộng thời trang nam cá tính	Nước ngoài	False	27%	False	6	False	0.0	[0, 0, 0, 0, 0, 0]	None	None	24010000000	32820000000	24010000000	32820000000	24010000000	32820000000	None	1	0	0	False	False	9	0	0	0
Quần Jean Rách Thời Trang Nam	Nước ngoài	False	None	False	5	False	0.0	[0, 0, 0, 0, 0, 0]	None	None	20160000000	-1	20160000000	-1	20160000000	0	None	1	0	0	False	False	9	0	0	0
Quần jean ống đứng thiết kế đơn giản thời trang nam	Nước ngoài	False	46%	False	10	False	0.0	[0, 0, 0, 0, 0, 0]	None	None	20290000000	37750000000	20290000000	37750000000	20290000000	37750000000	None	0	3	0	False	False	9	0	0	0
Quần Thun Dài Thể Thao Thời Trang Nam Năng Động	Nước ngoài	False	None	False	4	False	0.0	[0, 0, 0, 0, 0, 0]	None	None	24010000000	-1	24010000000	-1	24010000000	0	None	0	0	0	False	False	7	0	0	0
Quần Dài Có Túi Thời Trang Nam Năng Động	Nước ngoài	False	None	False	5	False	0.0	[0, 0, 0, 0, 0, 0]	None	None	43500000000	-1	59600000000	-1	43500000000	0	None	2	0	0	False	False	9	0	0	0
Quần short thời trang nam phong cách Hàn Quốc	Nước ngoài	False	50%	False	3	False	0.0	[0, 0, 0, 0, 0, 0]	None	None	28200000000	56110000000	28200000000	56110000000	28200000000	56110000000	None	0	0	0	False	False	8	0	0	0
QUẦN BAGGY ĐŨI NAM Thời Trang Nam Cao Cấp Thương Hiệu Raacus (4 màu) -Hàng nhập khẩu	Hà Nội	False	None	False	20	False	0.0	[0, 0, 0, 0, 0, 0]	None	None	53900000000	-1	53900000000	-1	53900000000	0	None	0	2	0	False	False	9	0	0	0
Quần Short Jean Rách Thời Trang Nam	Nước ngoài	False	None	False	7	False	0.0	[0, 0, 0, 0, 0, 0]	None	None	10590000000	-1	15790000000	-1	10590000000	0	None	0	1	0	False	False	7	0	0	0
Quần jeans dài phối vết rách cá tính thời trang nam	Nước ngoài	False	50%	False	7	False	0.0	[0, 0, 0, 0, 0, 0]	None	None	22350000000	44700000000	22350000000	44700000000	22350000000	44700000000	None	0	0	0	False	False	9	0	0	0
Quần Dài Ống Đứng Thời Trang Nam	Nước ngoài	False	None	False	7	False	0.0	[0, 0, 0, 0, 0, 0]	None	None	79980000000	-1	79980000000	-1	79980000000	0	None	0	0	0	False	False	9	0	0	0
Quần Short Jean Rách Thời Trang Nam	Nước ngoài	False	None	False	10	False	0.0	[0, 0, 0, 0, 0, 0]	None	None	10970000000	-1	10970000000	-1	10970000000	0	None	0	0	0	False	False	9	0	0	0
Quần dài ống suông khóa zipper thời trang nam dáng ôm	Nước ngoài	False	40%	False	0	False	0.0	[0, 0, 0, 0, 0, 0]	None	None	22020000000	36700000000	22020000000	36700000000	22020000000	36700000000	None	0	0	0	False	True	9	0	0	0
Quần Short Mỏng Ống Rộng Size Lớn Thời Trang Nam Năng Động	Nước ngoài	False	49%	False	7	False	0.0	[0, 0, 0, 0, 0, 0]	None	None	15700000000	31030000000	15700000000	31030000000	15700000000	31030000000	None	0	0	0	False	False	4	0	0	0
Quần short lưng thun thoải mái thời trang nam	Nước ngoài	False	None	False	7	False	0.0	[0, 0, 0, 0, 0, 0]	None	None	14000000000	-1	14000000000	-1	14000000000	0	None	3	0	0	False	False	9	0	0	5
[Freeship] QUẦN JEAN NGỐ THỜI TRANG NAM CAO CẤP CHẤT ĐẸP :	Hải Dương	False	None	False	7	False	0.0	[0, 0, 0, 0, 0, 0]	None	None	54354500000	-1	54354500000	-1	54354500000	0	None	0	0	0	False	False	9	0	0	0
SALE 🥑ｓốｃ | ĐẲNG CẤP |_ Quần Bò thời trang nam- quần bò DSQ cao cấp -- Siêu Đẹp M09 🥑 ⚡ : * ..	TP. Hồ Chí Minh	False	20%	False	5	False	0.0	[0, 0, 0, 0, 0, 0]	None	None	18905200000	23631500000	18905200000	23631500000	18905200000	23631500000	None	0	0	0	False	False	1	0	0	0
[ Kiểm tra Hàng ] QUẦN JEAN THỜI TRANG NAM CAO CẤP CHẤT ĐẸP [ Chuẩn QC ]	Hà Nội	False	18%	False	7	False	0.0	[0, 0, 0, 0, 0, 0]	None	None	74500100000	90853700000	74500100000	90853700000	74500100000	90853700000	None	0	0	0	False	False	9	0	0	0
Xả 🥑ｓốｃ ⭐ ⚡ | Sales | | 10-10 |_ Quần Bò thời trang nam- quần bò DSQ cao cấp -- Siêu Đẹp .. . 2020 . . . Xịn 🥑 ⚡ : * :	TP. Hồ Chí Minh	False	None	False	5	False	0.0	[0, 0, 0, 0, 0, 0]	None	None	15789400000	-1	15789400000	-1	15789400000	0	None	0	0	0	False	False	1	0	0	0
Quần Dài Thể Thao Dây Rút Trẻ Trung Thời Trang Nam	Nước ngoài	False	40%	False	4	False	0.0	[0, 0, 0, 0, 0, 0]	None	None	15164200000	25273600000	15164200000	25273600000	15164200000	25273600000	None	0	3	0	False	False	9	0	0	0
Hp Quần Jean Rách Thời Trang Nam	Nước ngoài	False	None	False	6	False	0.0	[0, 0, 0, 0, 0, 0]	None	None	72710000000	-1	72710000000	-1	72710000000	0	None	0	0	0	False	False	5	0	0	0
Quần Short Thể Thao Dây Rút Trẻ Trung Thời Trang Nam	Nước ngoài	False	50%	False	7	False	0.0	[0, 0, 0, 0, 0, 0]	None	None	32101100000	64202200000	32101100000	64202200000	32101100000	64202200000	None	0	0	0	False	False	6	0	0	0
[ Hàng New 2021 ] QUẦN JEAN NGỐ THỜI TRANG NAM CAO CẤP CHẤT ĐẸP [ Sẵn Đủ Size ]	Hà Nội	False	15%	False	7	False	0.0	[0, 0, 0, 0, 0, 0]	None	None	54500000000	64117600000	54500000000	64117600000	54500000000	64117600000	None	0	0	0	False	False	9	0	0	0
Quần Jean Rách Thời Trang Nam	Nước ngoài	False	None	False	6	False	0.0	[0, 0, 0, 0, 0, 0]	None	None	45900000000	-1	45900000000	-1	45900000000	0	None	0	0	0	False	False	9	0	0	0
[Shop thời trang] QUẦN JEAN NGỐ THỜI TRANG NAM CAO CẤP CHẤT ĐẸP	Hà Nội	False	27%	False	7	False	0.0	[0, 0, 0, 0, 0, 0]	None	None	41774300000	57225000000	41774300000	57225000000	41774300000	57225000000	None	0	0	0	False	False	9	0	0	0
( Chất siêu đẹp ) QUẦN JEAN THỜI TRANG NAM CAO CẤP CHẤT ĐẸP ( Hàng chuẩn )	Hà Nội	False	40%	False	7	False	0.0	[0, 0, 0, 0, 0, 0]	None	None	80460000000	134100000000	80460000000	134100000000	80460000000	134100000000	None	0	0	0	False	False	9	0	0	0
Quần Jean Rách Thời Trang Nam	Nước ngoài	False	None	False	9	False	0.0	[0, 0, 0, 0, 0, 0]	None	None	55980000000	-1	55980000000	-1	55980000000	0	None	0	0	0	False	False	9	0	0	0
Quần Ngắn Lưng Thun Thời Trang Nam	Nước ngoài	False	50%	False	7	False	0.0	[0, 0, 0, 0, 0, 0]	None	None	14700000000	29400000000	14700000000	29400000000	14700000000	29400000000	None	0	0	0	False	False	9	0	0	0
Quần Dài Ống Đứng Thời Trang Nam	Nước ngoài	False	40%	False	9	False	0.0	[0, 0, 0, 0, 0, 0]	None	None	32920000000	54850000000	32920000000	54850000000	32920000000	54850000000	None	0	0	0	False	False	9	0	0	0
[ Hàng mới 2021 ] QUẦN JEAN NGỐ THỜI TRANG NAM CAO CẤP CHẤT ĐẸP [ Đặt Ngay FreeShip ]	Hà Nội	False	22%	False	7	False	0.0	[0, 0, 0, 0, 0, 0]	None	None	54500100000	69871800000	54500100000	69871800000	54500100000	69871800000	None	0	0	0	False	False	9	0	0	0
Quần Ngắn Lưng Thun Thời Trang Nam	Nước ngoài	False	50%	False	5	False	0.0	[0, 0, 0, 0, 0, 0]	None	None	10150000000	20300000000	11550000000	23100000000	10150000000	20300000000	None	0	0	0	False	False	9	0	0	0
[LN12337]  (Hàng sịn ) Quần Âu Nam Đẹp KOREA vải mịn co dãn màu ghi nhạt, ghi đậm, đen, xanh đen [Thời trang nam]	Hà Nội	False	None	False	7	False	0.0	[0, 0, 0, 0, 0, 0]	None	None	140300000000	-1	140300000000	-1	140300000000	0	None	0	0	0	False	False	6	0	0	0
Quần Dài Có Túi Thời Trang Nam Năng Động	Nước ngoài	False	29%	False	4	False	0.0	[0, 0, 0, 0, 0, 0]	None	None	27400000000	38520000000	27400000000	38520000000	27400000000	38520000000	None	0	0	0	False	False	6	0	0	0
Quần Jean Dài Thời Trang Nam	Nước ngoài	False	31%	False	5	False	0.0	[0, 0, 0, 0, 0, 0]	None	None	67780000000	97560000000	67780000000	97560000000	67780000000	97560000000	None	0	0	0	False	False	9	0	0	0
⭐ [ Siêu sale -  Free Ship ] QUẦN JEAN THỜI TRANG NAM CAO CẤP CHẤT ĐẸP [ Hàng cao cấp ] ⭐	TP. Hồ Chí Minh	False	30%	False	7	False	0.0	[0, 0, 0, 0, 0, 0]	None	None	44361100000	63373000000	44361100000	63373000000	44361100000	63373000000	None	0	0	0	False	False	9	0	0	0
Quần Jeans Đen Thời Trang Nam Cao Cấp - QJ39444  - vippermark	Hà Nội	False	None	False	5	False	0.0	[0, 0, 0, 0, 0, 0]	None	None	35500000000	-1	35500000000	-1	35500000000	0	None	0	8	0	False	False	2	0	0	0
Thắt lưng da thời trang nam công sở lịch lãm	Nước ngoài	False	29%	False	6	False	0.0	[0, 0, 0, 0, 0, 0]	None	None	17860000000	24990000000	17860000000	24990000000	17860000000	24990000000	None	0	0	0	False	False	9	0	0	0
Quần Jeans Dài Phối Vết Rách Cá Tính Thời Trang Nam	Nước ngoài	False	34%	False	9	False	0.0	[0, 0, 0, 0, 0, 0]	None	None	29000000000	43980000000	40900000000	62220000000	29000000000	43980000000	None	0	0	0	False	False	3	0	0	0
Quần Dài Lưng Thun Ống Đứng Thời Trang Nam	Nước ngoài	False	34%	False	9	False	0.0	[0, 0, 0, 0, 0, 0]	None	None	46870000000	71360000000	46870000000	71360000000	46870000000	71360000000	None	0	0	0	False	False	9	0	0	0
QUẦN JEANS NAM PHONG CÁCH THỜI TRANG NĂM 2018 CAO CẤP MS349	TP. Hồ Chí Minh	False	50%	False	5	False	0.0	[0, 0, 0, 0, 0, 0]	None	None	14950000000	29900000000	14950000000	29900000000	14950000000	29900000000	None	1	0	0	False	True	9	0	0	1
Set Đồ Bộ Ngắn In Hình 3d Thời Trang Nam	Nước ngoài	False	None	False	1	False	0.0	[0, 0, 0, 0, 0, 0]	None	None	92750000000	-1	92750000000	-1	92750000000	0	None	0	1	0	False	False	1	0	0	0
( Chất siêu đẹp ) QUẦN JEAN NGỐ THỜI TRANG NAM CAO CẤP CHẤT ĐẸP ( Hàng chuẩn )	Hà Nội	False	40%	False	7	False	0.0	[0, 0, 0, 0, 0, 0]	None	None	58860000000	98100000000	58860000000	98100000000	58860000000	98100000000	None	0	0	0	False	False	9	0	0	0
Quần tây dài ống đứng thời trang nam công sở Hàn Quốc	Nước ngoài	False	None	False	15	False	0.0	[0, 0, 0, 0, 0, 0]	None	None	39930000000	-1	39930000000	-1	39930000000	0	None	0	0	0	False	False	7	0	0	0
Quần dài thể thao kẻ sọc thời trang nam	Nước ngoài	True	42%	False	6	False	4.428571	[7, 0, 0, 2, 0, 5]	None	None	13300000000	23000000000	13300000000	23000000000	13300000000	23000000000	None	27	176	7	False	False	9	0	4	15
HOT 🌺 ⭐ SALE Quần Bò thời trang nam- quần bò DSQ cao cấp 🌟 . : ⭐ . :	Ninh Bình	False	None	False	5	False	0.0	[0, 0, 0, 0, 0, 0]	None	None	18436400000	-1	18436400000	-1	18436400000	0	None	0	1	0	False	False	1	0	0	0
[HÀNG HOT 2020] Quần Jogger kaki co giãn trẻ trung thời trang nam cao cấp CEFFYLO	Hà Nội	False	35%	False	5	False	5.0	[1, 0, 0, 0, 0, 1]	None	None	29250000000	45000000000	29250000000	45000000000	29250000000	45000000000	None	0	61	1	False	False	9	0	29	169
🌸 [ Mua Nhiều Giảm Giá ] QUẦN JEAN THỜI TRANG NAM CAO CẤP CHẤT ĐẸP [ Mẫu Mới Cực Chất ] 🌸	Ninh Bình	False	30%	False	7	False	0.0	[0, 0, 0, 0, 0, 0]	None	None	51817900000	74025500000	51817900000	74025500000	51817900000	74025500000	None	0	0	0	False	False	9	0	0	0
Quần tây nam vải co giãn ống côn ĐẲNG CẤP thời trang nam	Hà Nội	True	44%	False	7	False	4.884615	[26, 0, 0, 1, 1, 24]	None	None	8900000000	16000000000	8900000000	16000000000	8900000000	16000000000	None	2277	64	26	False	True	8	1	1	70
combo 2 Quần lửng nam có túi kaki - thời trang nam - Quần kaki	TP. Hồ Chí Minh	True	None	False	5	False	4.875	[8, 0, 0, 0, 1, 7]	None	None	29900000000	-1	29900000000	-1	29900000000	0	None	5	7	8	False	True	8	0	0	16
Quần Kaki Nam Chất Đẹp Thời Trang Nam Xuất Khẩu	Hà Nội	False	None	False	20	False	3.5	[6, 2, 0, 0, 1, 3]	None	None	15900000000	-1	15900000000	-1	15900000000	0	None	159	45	6	False	False	9	0	0	1036
Đơn thời trang nam 340k	TP. Hồ Chí Minh	False	None	False	1	False	5.0	[5, 0, 0, 0, 0, 5]	None	None	34000000000	-1	34000000000	-1	34000000000	0	None	0	4	5	False	False	1	0	0	7
QUẦN JEAN NGỐ THỜI TRANG NAM CAO CẤP CHẤT ĐẸP	Hà Nội	False	None	False	7	False	0.0	[0, 0, 0, 0, 0, 0]	None	None	54500000000	-1	54500000000	-1	54500000000	0	None	0	0	0	False	False	9	0	0	0
Quần short ngắn Kaki thời trang nam giá rẻ kiểu dáng mới năm 2018 - NDNJ-ShortKK-048 (nhiều màu)	TP. Hồ Chí Minh	True	35%	False	0	False	4.428571	[7, 0, 1, 0, 1, 5]	None	None	10985000000	16900000000	10985000000	16900000000	10985000000	16900000000	None	8	22	7	False	True	9	0	1	18
QUẦN BAGGY XÁM TRO THỜI TRANG NAM RAACUS ĐẸP CHUẨN LÊN FORM CHUẨN	Hà Nội	True	50%	False	5	False	4.727273	[11, 0, 0, 0, 3, 8]	None	None	16250000000	32500000000	16250000000	32500000000	16250000000	32500000000	None	2202	96	11	False	True	6	1	1	22
Quần jocger nam ,quần thời trang nam ,quần giá rẻ ,quần kaki bó chân, quần jocger bo chân Q65 NAM	TP. Hồ Chí Minh	True	49%	False	6	False	4.6	[5, 0, 0, 0, 2, 3]	None	None	8300000000	8300000000	8500000000	16600000000	8300000000	8300000000	None	8	63	5	False	False	9	0	0	27
Quần jean ống rộng MAN DO kiểu dáng năng động thời trang nam phong cách Hàn Quốc - QJN037	Hà Nội	True	8%	False	5	False	5.0	[5, 0, 0, 0, 0, 5]	None	None	35000000000	38000000000	35000000000	38000000000	35000000000	38000000000	None	9	179	5	False	False	7	1	2	22
Đơn thời trang nam 150k	TP. Hồ Chí Minh	False	None	False	1	False	5.0	[4, 0, 0, 0, 0, 4]	None	None	15000000000	-1	15000000000	-1	15000000000	0	None	0	4	4	False	True	1	0	0	9
Quần dài (DEALSHOCK) nam jogger nỉ dày dặn dây kéo túi - Thời trang nam SIIBE	TP. Hồ Chí Minh	False	50%	False	3	False	5.0	[3, 0, 0, 0, 0, 3]	None	None	17500000000	35000000000	17500000000	35000000000	17500000000	35000000000	None	964	44	3	False	True	4	0	0	4
Sale 🥑ｓốｃ | ĐẲNG CẤP |_ Quần Bò thời trang nam- quần bò DSQ cao cấp -- Siêu Đẹp M09 🥑 ⚡ .	Hà Nội	False	20%	False	5	False	0.0	[0, 0, 0, 0, 0, 0]	None	None	18864400000	23580500000	18864400000	23580500000	18864400000	23580500000	None	0	0	0	False	False	1	0	0	0
Quần kaki 1 khóa gối nữ,quần dài kaki nam,quần kaki bo gấu,Quần thời trang nam	TP. Hồ Chí Minh	True	50%	False	1	False	4.285714	[7, 1, 0, 0, 1, 5]	None	None	8000000000	16000000000	8000000000	16000000000	8000000000	16000000000	None	25	34	7	False	True	4	1	0	28
Đơn thời trang nam 240k	TP. Hồ Chí Minh	False	None	False	1	False	5.0	[4, 0, 0, 0, 0, 4]	None	None	24000000000	-1	24000000000	-1	24000000000	0	None	0	0	4	False	False	1	0	0	10
Quần tây thời trang nam, dáng côn vải tuyết mưa cao cấp (BAO TEST 30 ngày sử dụng)	Hà Nội	True	45%	False	7	False	5.0	[5, 0, 0, 0, 0, 5]	None	None	9900000000	18000000000	9900000000	18000000000	9900000000	18000000000	None	4	37	5	False	True	9	1	0	21
Quần Dài Có Túi Thời Trang Nam Năng Động	Nước ngoài	False	48%	False	6	False	0.0	[0, 0, 0, 0, 0, 0]	None	None	25860000000	49470000000	25860000000	49470000000	25860000000	49470000000	None	0	0	0	False	False	6	0	0	0
Quần Âu Thời Trang Nam Cao Cấp Bateno Siêu Hot QA01	Hà Nội	True	41%	False	6	False	5.0	[3, 0, 0, 0, 0, 3]	None	None	9900000000	16700000000	9900000000	16700000000	9900000000	16700000000	None	825	17	3	False	True	9	1	1	4
[ROUTINE] quần jean nam rách gối xanh nhạt chính hãng thời trang nam Routine	Hà Nội	False	None	False	6	True	5.0	[4, 0, 0, 0, 0, 4]	None	None	49900000000	-1	49900000000	-1	49900000000	0	None	102	62	4	False	True	6	1	0	8
Đơn thời trang nam 230k	TP. Hồ Chí Minh	False	None	False	1	False	4.428571	[7, 1, 0, 0, 0, 6]	None	None	23000000000	-1	23000000000	-1	23000000000	0	None	2	10	7	False	False	8	0	0	11
Free ship 50 _Quần tây Hàn Quốc vải cotton mềm mịn [Thời Trang Nam]	Hà Nội	True	47%	False	7	False	4.6	[5, 0, 0, 1, 0, 4]	None	None	9500000000	17800000000	9500000000	17800000000	9500000000	17800000000	None	5	27	5	False	True	6	1	0	10
Quần Thể Thao Ống Dài Size Lớn Thời Trang Nam Năng Động M-2xl	Nước ngoài	False	48%	False	4	False	5.0	[2, 0, 0, 0, 0, 2]	None	None	12570000000	24160000000	12570000000	24160000000	12570000000	24160000000	None	6	70	2	False	False	6	0	1	6
Kaki Thời Trang Nam, Quần Dáng Slim, trẻ trung, lịch sự, giá rẻ, chất vải mềm, mặc thoải mái	Hà Nội	False	45%	False	11	False	5.0	[2, 0, 0, 0, 0, 2]	None	None	21900000000	40000000000	23900000000	40000000000	21900000000	40000000000	None	0	7	2	False	True	9	1	0	50
