name	shop_location	shopee_verified	discount	is_adult	options	show_official_shop_label_in_title	rating_star	rating_count	flash_sale	upcoming_flash_sale	price_min	price_min_before_discoun	price_max	price_max_before_discount	price	price_before_discount	coin_earn_label	liked_count	view_count	cmt_count	is_preferred_plus_seller	show_free_shipping	images	video_info_list	sold	historical_sold
Quần tây nam cao cấp dáng slimfit, chuẩn thiết kế hàn quốc, cực tôn dáng, lịch sự, trẻ trung	Hà Nội	True	45%	False	7	False	5.0	[5, 0, 0, 0, 0, 5]	None	None	9900000000	18000000000	9900000000	18000000000	9900000000	18000000000	None	0	234	5	False	False	9	0	905	905
Quần Sịp Nam Munafie - co giãn 4 chiều Mỗi Quần 1 Túi Zip Sang Trọng	Hà Nội	True	44%	False	6	False	4.951168	[471, 2, 0, 2, 11, 456]	None	None	1680000000	3000000000	1890000000	3400000000	1680000000	3000000000	None	77	544	471	False	True	9	1	150	2157
QUẦN SHORT KAKI NAM LƯNG THUN THỜI TRANG 2020 TP	TP. Hồ Chí Minh	False	24%	False	6	False	4.460674	[89, 6, 2, 5, 8, 68]	None	None	6764000000	8900000000	6764000000	8900000000	6764000000	8900000000	None	95	1419	89	False	True	9	1	31	1621
QUẦN KẺ CA RÔ NAM DÀI, ỐNG SUÔNG -THỜI TRANG HÀN QUỐC.	Ninh Bình	False	None	False	4	False	4.666667	[12, 0, 1, 0, 1, 10]	None	None	23800000000	-1	23800000000	-1	23800000000	0	None	2796	1236	12	False	False	1	0	12	58
[ Free Ship ] Combo 3 Quần sịp xì đùi nam cao cấp quần lót nam đùi co giãn 4 chiều 5D 55-73kg alex	Hà Nội	True	26%	False	1	False	4.944444	[18, 0, 0, 0, 1, 17]	None	None	8900000000	12000000000	8900000000	12000000000	8900000000	12000000000	None	3	644	18	True	False	9	1	64	65
Quần Âu Nam Đẹp KOREA vải mịn co dãn màu ghi nhạt, ghi đậm, đen, xanh đen	Hà Nội	True	47%	False	8	False	4.566308	[592, 22, 16, 32, 46, 476]	None	None	6900000000	13000000000	7400000000	13000000000	6900000000	13000000000	None	252	20552	592	False	True	9	1	1186	11841
COMBO 5 Chiếc Quần Lót Boxer Nam QN244 (Đai ngẫu nhiên)	TP. Hồ Chí Minh	True	45%	False	5	False	4.860904	[2812, 20, 10, 60, 165, 2557]	None	None	11900000000	21800000000	11900000000	21800000000	11900000000	21800000000	None	696	7417	2812	True	True	8	1	403	6851
(Hàng Xuất Xịn) Quần đùi nam, Quần Đũi Nam ( Mát - Nhẹ Như Không)	Hà Nội	True	50%	False	5	False	4.802637	[5235, 69, 41, 132, 370, 4623]	None	None	5000000000	6500000000	6500000000	13000000000	5000000000	6500000000	None	2176	18627	5234	False	True	9	0	1243	22084
Sịp đùi nam thun lạnh dạng lỗ thoáng khi CK06	Hà Nội	True	45%	False	4	False	5.0	[64, 0, 0, 0, 0, 64]	None	None	6325000000	11500000000	6325000000	11500000000	6325000000	11500000000	None	25	1731	64	True	False	8	0	160	265
Quần dù nam chất liệu vải 3D thời trang nam Mã KQ25 phom 40-75kg kynn shop	Hà Nội	True	47%	False	3	False	5.0	[5, 0, 0, 0, 0, 5]	None	None	6900000000	12900000000	6900000000	12900000000	6900000000	12900000000	None	6	74	5	True	False	9	0	3	23
[Quần nam] _ Quần dài thời trang nam, Mã Q51	Hà Nội	True	30%	False	3	False	5.0	[1, 0, 0, 0, 0, 1]	None	None	13900000000	19900000000	13900000000	19900000000	13900000000	19900000000	None	1	7	1	False	False	4	0	1	3
Quần short jeans nam thiết kế thời trang cao cấp nam , quần sọt jean thời trang nam S40	TP. Hồ Chí Minh	True	37%	False	6	False	5.0	[2, 0, 0, 0, 0, 2]	None	None	13900000000	22000000000	13900000000	22000000000	13900000000	22000000000	None	0	15	2	False	False	5	0	2	2
Quần Jeans Mỏng Ống Suông Rộng Thời Trang Nam Cá Tính	Nước ngoài	False	19%	False	10	False	0.0	[0, 0, 0, 0, 0, 0]	None	None	42610000000	52740000000	42610000000	52740000000	42610000000	52740000000	None	0	1	0	False	False	8	0	0	0
Ma79s QUẦN BAGGY ĐŨI NAM Thời Trang Nam Cao Cấp Thương Hiệu Raacus (4 màu) -  Ma7979s	Hà Nội	False	None	False	1	False	0.0	[0, 0, 0, 0, 0, 0]	None	None	34000000000	-1	51000000000	-1	34000000000	0	None	0	2	0	False	False	7	0	0	0
[FREESHIP_99K] QUẦN jogger THỜI TRANG NAM	Bình Dương	False	None	False	3	False	5.0	[1, 0, 0, 0, 0, 1]	None	None	9900000000	-1	9900000000	-1	9900000000	0	None	343	8	1	False	True	3	0	0	3
Quần Dài Lưng Thun Thời Trang Nam	Nước ngoài	False	40%	False	4	False	0.0	[0, 0, 0, 0, 0, 0]	None	None	16152600000	26921000000	16152600000	26921000000	16152600000	26921000000	None	0	0	0	False	False	8	0	0	0
Quần Ngắn Lưng Thun Thời Trang Nam 2020	Nước ngoài	False	50%	False	5	False	0.0	[0, 0, 0, 0, 0, 0]	None	None	21300000000	42600000000	21300000000	42600000000	21300000000	42600000000	None	0	1	0	False	False	9	0	0	0
(Hàng sịn ) Quần Âu Nam Đẹp KOREA vải mịn dáng slimfit phong cách Hàn Quốc đẳng cấp Thời trang nam	Hà Nội	True	40%	False	8	False	0.0	[0, 0, 0, 0, 0, 0]	None	None	9500000000	15900000000	9500000000	15900000000	9500000000	15900000000	None	0	9	0	False	False	9	0	0	0
🌸 Real | ĐẲNG CẤP |_ Quần Bò thời trang nam- quần bò DSQ cao cấp -- Siêu Đẹp M09 🥑 ⚡ : * : New 🌸 >	TP. Hồ Chí Minh	False	None	False	5	False	0.0	[0, 0, 0, 0, 0, 0]	None	None	18476200000	-1	18476200000	-1	18476200000	0	None	0	2	0	False	False	1	0	0	0
Quần short phong cách hiphop thời trang nam	Nước ngoài	False	11%	False	4	False	0.0	[0, 0, 0, 0, 0, 0]	None	None	17730000000	19850000000	17730000000	19850000000	17730000000	19850000000	None	1	7	0	False	False	9	1	0	0
Quần Jeans 100 Tấc Thời Trang Nam Năng Động	Nước ngoài	False	None	False	10	False	0.0	[0, 0, 0, 0, 0, 0]	None	None	54730000000	-1	54730000000	-1	54730000000	0	None	0	1	0	False	False	9	0	0	0
Quần Lót Lụa Lạnh Size Lớn X Thời Trang Nam Cao Cấp	Nước ngoài	False	None	False	9	False	0.0	[0, 0, 0, 0, 0, 0]	None	None	20090000000	-1	20090000000	-1	20090000000	0	None	0	1	0	False	False	8	0	0	0
Quần Dài Lưng Thun Thời Trang Nam Size Lớn Saiz Besar L-9xl	Nước ngoài	False	40%	False	10	False	0.0	[0, 0, 0, 0, 0, 0]	None	None	16970000000	28200000000	16970000000	28200000000	16970000000	28200000000	None	0	5	0	False	False	9	0	0	0
Quần công sở bó chân thời trang mới 2020 quần nam dáng suông phong cách mùa thu thương hiệu thời trang nam 9 điểm	Nước ngoài	False	50%	False	6	False	0.0	[0, 0, 0, 0, 0, 0]	None	None	28000000000	56000000000	28000000000	56000000000	28000000000	56000000000	None	1	50	0	False	False	9	0	0	0
5 Quần tây nam vải co giãn ống côn thời trang nam	Thái Bình	False	None	False	8	False	0.0	[0, 0, 0, 0, 0, 0]	None	None	68000000000	-1	68000000000	-1	68000000000	0	None	0	0	0	False	False	7	0	0	0
Quần Bò - Quần Jean Nam Ống Đứng , Thời Trang Nam Phong Cách Trẻ Trung Năng Động.	Hà Nội	False	None	False	7	False	0.0	[0, 0, 0, 0, 0, 0]	None	None	65000000000	-1	65000000000	-1	65000000000	0	None	0	14	0	False	False	9	0	0	0
QUẦN bagy ống côn NAM Thời Trang Nam Cao Cấp Thương Hiệu CORAL (1 màu)	Hà Nội	False	None	False	6	False	0.0	[0, 0, 0, 0, 0, 0]	None	None	46500000000	-1	46500000000	-1	46500000000	0	None	0	77	0	False	False	4	0	0	1
[ Hàng Chuẩn ] QUẦN JEAN THỜI TRANG NAM CAO CẤP CHẤT ĐẸP [ Siêu Cấp Đủ Size ]	Hà Nội	False	15%	False	7	False	0.0	[0, 0, 0, 0, 0, 0]	None	None	75387000000	88690500000	75387000000	88690500000	75387000000	88690500000	None	0	1	0	False	False	9	0	0	0
Quần dài ống đứng phong cách năng động thời trang nam Hàn Quốc	Nước ngoài	False	43%	False	6	False	4.0	[1, 0, 0, 0, 1, 0]	None	None	21100000000	36450000000	26170000000	45670000000	21100000000	36450000000	None	2	68	1	False	False	9	0	1	2
Quần Short Thun Dây Rút Trẻ Trung Thời Trang Nam	Nước ngoài	False	50%	False	3	False	0.0	[0, 0, 0, 0, 0, 0]	None	None	42480000000	84520000000	42480000000	84520000000	42480000000	84520000000	None	0	2	0	False	False	7	0	0	0
Quần Dài Ống Đứng Thời Trang Nam	Nước ngoài	False	30%	False	7	False	0.0	[0, 0, 0, 0, 0, 0]	None	None	27204700000	38863900000	27204700000	38863900000	27204700000	38863900000	None	0	2	0	False	False	9	0	0	0
Quần Lót Tam Giác Vải Lụa Lạnh Mỏng Thời Trang Nam Cao Cấp	Nước ngoài	False	28%	False	4	False	0.0	[0, 0, 0, 0, 0, 0]	None	None	30650000000	42370000000	30650000000	42370000000	30650000000	42370000000	None	0	2	0	False	False	9	0	0	0
Quần tây nam vải co giãn ống côn ĐẲNG CẤP thời trang nam	Hà Nội	True	44%	False	7	False	5.0	[1, 0, 0, 0, 0, 1]	None	None	7900000000	14000000000	7900000000	14000000000	7900000000	14000000000	None	0	15	1	False	False	7	0	0	2
Quần tây nam sọc kẻ 3 màu ống côn dáng body thời trang nam mẫu mới đang hot 2020	TP. Hồ Chí Minh	False	None	False	5	False	0.0	[0, 0, 0, 0, 0, 0]	None	None	15000000000	-1	15000000000	-1	15000000000	0	None	1	7	0	False	False	5	0	0	0
Quần jeans ống ôm thời trang nam năng động	Nước ngoài	False	1%	False	4	False	0.0	[0, 0, 0, 0, 0, 0]	None	None	46660000000	47160000000	46660000000	47160000000	46660000000	47160000000	None	0	2	0	False	False	8	0	0	0
(Hàng sịn ) Quần Âu Nam Đẹp KOREA vải mịn co dãn màu ghi nhạt, ghi đậm, đen, xanh đen [Thời trang nam]	Hà Nội	True	50%	False	8	False	0.0	[0, 0, 0, 0, 0, 0]	None	None	7500000000	15000000000	8000000000	15000000000	7500000000	15000000000	None	0	21	0	False	False	9	0	1	1
Thời Trang Nam Quần jean nam cao cấp Quần jean nam ống suông quần nam quần dài Jeans Pant	Nước ngoài	False	None	False	6	False	0.0	[0, 0, 0, 0, 0, 0]	None	None	36800000000	-1	36800000000	-1	36800000000	0	None	0	3	0	False	False	9	0	0	0
Quần Tây Ống Suông Rộng Xẻ Tà Thời Trang Nam	Nước ngoài	False	30%	False	4	False	0.0	[0, 0, 0, 0, 0, 0]	None	None	20240000000	29020000000	20240000000	29020000000	20240000000	29020000000	None	0	4	0	False	False	9	0	0	0
Quần Jogger Thời Trang Nam Cao Cấp - Xanh Xám	Quảng Ninh	False	7%	False	4	False	5.0	[1, 0, 0, 0, 0, 1]	None	None	11067000000	11900000000	11067000000	11900000000	11067000000	11900000000	None	6	32	1	False	False	6	0	0	1
Quần jogger túi hộp thời trang nam , quần kaki thiết kế năng động cao cấp nam MT19	TP. Hồ Chí Minh	False	28%	False	3	False	0.0	[0, 0, 0, 0, 0, 0]	None	None	18000000000	25000000000	18000000000	25000000000	18000000000	25000000000	None	0	6	0	False	False	5	0	0	0
Quần Tây Nam Vải Co Giãn Ống Côn, Quần Âu Nam Phong Cách Thời Trang Nam Cao Cấp	Hà Nội	False	None	False	7	False	0.0	[0, 0, 0, 0, 0, 0]	None	None	11900000000	-1	11900000000	-1	11900000000	0	None	0	0	0	False	False	6	0	0	0
QUẦN JEAN NAM XANH ĐEN ỐNG TÚM HJ351 THỜI TRANG NAM CAO CẤP	TP. Hồ Chí Minh	False	None	False	5	False	0.0	[0, 0, 0, 0, 0, 0]	None	None	25000000000	-1	25000000000	-1	25000000000	0	None	2	5	0	False	True	1	0	0	4
Quần Dài Thể Thao Thời Trang Nam Năng Động	Nước ngoài	True	50%	False	5	False	0.0	[0, 0, 0, 0, 0, 0]	None	None	14700000000	29400000000	14700000000	29400000000	14700000000	29400000000	None	0	21	0	False	False	9	0	0	0
Quần bò Phillip đính đá đầu lâu cực chất - Quần Jean Phillip đính đá - Quần bò đính đá thời trang nam	Hà Nội	True	None	False	7	False	0.0	[0, 0, 0, 0, 0, 0]	None	None	30000000000	-1	30000000000	-1	30000000000	0	None	3	70	0	False	False	2	0	0	0
Quần Jogger,quần nỉ,quần thời trang nam,quần nam cao cấp	Hà Nội	False	32%	False	3	False	0.0	[0, 0, 0, 0, 0, 0]	None	None	17000000000	25000000000	17000000000	25000000000	17000000000	25000000000	None	3	19	0	False	False	7	1	0	0
New Fashion Men Pant Casual Pant elastic waist Pant Trouser Thời Trang Nam Quần Quần thể thao Quần nam quần tây thường	Nước ngoài	False	None	False	5	False	0.0	[0, 0, 0, 0, 0, 0]	None	None	32900000000	-1	32900000000	-1	32900000000	0	None	4	18	0	False	False	9	0	0	1
Quần tây thời trang nam ống ôm suông màu giản dị lịch lãm	Nước ngoài	False	None	False	10	False	0.0	[0, 0, 0, 0, 0, 0]	None	None	19500000000	-1	19500000000	-1	19500000000	0	None	2	0	0	False	False	8	0	0	2
Quần short jean họa tiết kết hợp rách gối tăng vẻ đẹp chiếc quần, quần sọt jean thời trang nam S39	TP. Hồ Chí Minh	True	37%	False	6	False	5.0	[2, 0, 0, 0, 0, 2]	None	None	13900000000	22000000000	13900000000	22000000000	13900000000	22000000000	None	0	6	2	False	False	5	0	2	2
Quần Thun Dài Thời Trang Nam Năng Động	Nước ngoài	False	50%	False	4	False	0.0	[0, 0, 0, 0, 0, 0]	None	None	44500000000	89000000000	44500000000	89000000000	44500000000	89000000000	None	3	17	0	False	False	9	0	0	0
Quần Tây Nam Kojiba Kiểu Dáng Công Sở Hàn Quốc	TP. Hồ Chí Minh	False	49%	False	7	True	4.832924	[407, 4, 2, 10, 26, 365]	None	None	8700000000	17000000000	8700000000	17000000000	8700000000	17000000000	None	218	6184	407	False	True	9	1	338	2293
Quần lót nam, QUẦN sịp tam giác⚡ARISTINO⚡Cotton Chitosan CHẤT LIỆU TUYỆT PHẨM CỦA MÙA HÈ VỚI PHÁI MẠNH-ABF01807	Hà Nội	True	30%	False	5	False	5.0	[12, 0, 0, 0, 0, 12]	None	None	7350000000	10500000000	7350000000	10500000000	7350000000	10500000000	None	3664	64	12	False	True	9	1	15	91
Quần Jogger Nam Phong Cách Hip Hop Năng Động	Nước ngoài	False	40%	False	10	False	0.0	[0, 0, 0, 0, 0, 0]	None	None	34800000000	58000000000	34800000000	58000000000	34800000000	58000000000	None	4	742	0	False	False	9	0	0	0
Quần kaki dài nam chất vải cotton có giãn siêu đẹp LADOS 4032	TP. Hồ Chí Minh	False	44%	False	6	True	4.958333	[72, 0, 0, 1, 1, 70]	None	None	19900000000	35800000000	19900000000	35800000000	19900000000	35800000000	None	43	4620	72	False	False	9	0	168	180
Quần Sịp Nam 🍁FREESHIP🍁 Quần Lót Nam Cotton - Quần Sịp Nam Tam Giác 4 Size L XL 2XL 3XL	Nam Định	False	34%	False	4	False	0.0	[0, 0, 0, 0, 0, 0]	None	None	2300000000	3500000000	2300000000	3500000000	2300000000	3500000000	None	0	143	0	False	False	3	0	0	0
Quần sooc nam hàn quốc, vải âu chính phẩm (HOTTREND 2020) quần ngắn, dáng âu sang trọng	Hà Nội	True	47%	False	5	False	5.0	[12, 0, 0, 0, 0, 12]	None	None	8500000000	16000000000	8500000000	16000000000	8500000000	16000000000	None	4	224	12	False	False	9	0	247	1171
Quần đũi dài thời trang nam	Hà Nội	False	41%	False	4	False	4.625	[32, 2, 1, 0, 1, 28]	None	None	9900000000	16900000000	9900000000	16900000000	9900000000	16900000000	None	355	1295	32	False	False	5	0	16	146
(6 MÀU )Quần âu nam KOREAN chất vải tuyết mưa dáng ôm body ,co giãn 4 chiều dáng ôm body chống nhăn ,chống xù tuyệt đối	Hà Nội	True	45%	False	7	False	4.898693	[306, 3, 0, 1, 17, 285]	None	None	9900000000	18000000000	9900000000	18000000000	9900000000	18000000000	None	4200	7225	306	False	True	9	1	2236	9296
Quần tây nam (đen) ống côn dáng body, quần âu nam phong cách thời trang nam cao cấp OKU	TP. Hồ Chí Minh	True	42%	False	7	False	4.55	[100, 3, 3, 7, 10, 77]	None	None	9900000000	17000000000	9900000000	17000000000	9900000000	17000000000	None	57	5949	100	False	False	9	1	523	1299
Quần Short Cotton Lanh Màu Trơn Thời Trang Đi Biển Cho Nam	Nước ngoài	True	40%	False	7	False	4.071429	[14, 3, 0, 0, 1, 10]	None	None	8900000000	14899900000	8900000000	14899900000	8900000000	14899900000	None	23	1067	14	False	False	9	0	6	82
Quần Dài Dây Rút Trẻ Trung Thời Trang Nam	Nước ngoài	False	10%	False	8	False	0.0	[0, 0, 0, 0, 0, 0]	None	None	37120100000	41244500000	37120100000	41244500000	37120100000	41244500000	None	0	1	0	False	False	9	0	0	0
Quần Jeans Dài Ống Đứng Thời Trang Nam Cá Tính	Nước ngoài	False	None	False	3	False	0.0	[0, 0, 0, 0, 0, 0]	None	None	45860000000	-1	45860000000	-1	45860000000	0	None	0	5	0	False	False	6	0	0	0
Quần Thun Dài Thời Trang Nam Sọc Thể Thao Năng Động	Nước ngoài	False	27%	False	5	False	3.0	[1, 0, 0, 1, 0, 0]	None	None	18128400000	24833400000	18128400000	24833400000	18128400000	24833400000	None	4	84	1	False	False	9	0	0	1
[Ảnh thật ở sau] Quần jeans nam trơn gấu rách đồ unisex thời trang nam đồ nam chất lượng	TP. Hồ Chí Minh	False	None	False	5	False	0.0	[0, 0, 0, 0, 0, 0]	None	None	20900000000	-1	20900000000	-1	20900000000	0	None	1	19	0	False	True	9	0	0	0
[ Hot Nhất ] Quần vải tây âu nam ống côn form chuẩn thanh lịch thời trang nam	Vĩnh Phúc	False	None	False	13	False	0.0	[0, 0, 0, 0, 0, 0]	None	None	22500000000	-1	22500000000	-1	22500000000	0	None	0	1	0	False	False	3	0	0	0
Quần dài nam ống rộng phong cách thời trang nam năng động	Nước ngoài	True	38%	False	6	False	4.703704	[27, 0, 0, 3, 2, 22]	None	None	12500000000	20000000000	12500000000	20000000000	12500000000	20000000000	None	74	1131	27	False	False	9	0	17	66
[Ảnh thật ở sau] Quần jeans nam rách hai bên phối gấu rách đồ unisex thời trang nam đồ nam chất lượng	TP. Hồ Chí Minh	False	None	False	7	False	0.0	[0, 0, 0, 0, 0, 0]	None	None	24900000000	-1	24900000000	-1	24900000000	0	None	1	11	0	False	True	5	0	0	0
Quần đũi dài thời trang nam	Hà Nội	False	41%	False	4	False	4.625	[32, 2, 1, 0, 1, 28]	None	None	9900000000	16900000000	9900000000	16900000000	9900000000	16900000000	None	355	1295	32	False	False	5	0	16	146
Quần short jean  , quần sọt jeans thời trang nam MuradFashion mẫu MS8903	TP. Hồ Chí Minh	True	25%	False	9	False	5.0	[4, 0, 0, 0, 0, 4]	None	None	4900000000	6000000000	15000000000	20000000000	4900000000	6000000000	None	4	209	4	False	False	5	0	3	7
Quần Jean Nam Cao Cấp Thời Trang Nam Chất Vải Co Dãn	TP. Hồ Chí Minh	True	37%	False	5	False	0.0	[0, 0, 0, 0, 0, 0]	None	None	11900000000	19000000000	11900000000	19000000000	11900000000	19000000000	None	5	38	0	False	False	2	0	0	7
FreeShip -  THỜI TRANG NAM QUẦN THỂ THAO CO GIÃN 4 CHIỀU ADIDAS, CÓ VIDEO QUAY SP - Fox Sport 247	Hà Nội	False	None	False	4	False	0.0	[0, 0, 0, 0, 0, 0]	None	None	26500000000	-1	26500000000	-1	26500000000	0	None	5483	8	0	False	False	9	0	0	0
[HÀNG MỚI VỀ] _ Quàn dài thời trang nam, Mã Q54	Hà Nội	True	39%	False	4	False	5.0	[1, 0, 0, 0, 0, 1]	None	None	10900000000	17900000000	10900000000	17900000000	10900000000	17900000000	None	2	22	1	False	False	9	0	0	3
(GIÁ SỐC) Quần Kaki Nam Chất Đẹp Thời Trang Nam Xuất Khẩu	Hà Nội	True	40%	False	7	False	5.0	[1, 0, 0, 0, 0, 1]	None	None	10200000000	17000000000	10200000000	17000000000	10200000000	17000000000	None	2884	32	1	False	False	6	0	1	11
Quần tây nam (GIÁ SHOCK) form suông trơn basic sang trọng, lịch lãm - Thời trang nam SIIBE	TP. Hồ Chí Minh	False	50%	False	5	False	0.0	[0, 0, 0, 0, 0, 0]	None	None	18500000000	37000000000	18500000000	37000000000	18500000000	37000000000	None	922	61	0	False	True	4	0	0	1
Men Shorts Men Jeans W Thời Trang Nam Quần Jean Quần jeans nam ngắn QUẦN SHORTS JEAN NAM Quần short nam co giãn Cao Cấp	Nước ngoài	False	None	False	10	False	5.0	[1, 0, 0, 0, 0, 1]	None	None	37000000000	-1	37000000000	-1	37000000000	0	None	0	22	1	False	False	6	0	0	1
QUẦN JEAN NAM PHONG CÁCH THỜI TRANG NĂM 2019 MS601	TP. Hồ Chí Minh	False	34%	False	5	False	0.0	[0, 0, 0, 0, 0, 0]	None	None	14500000000	21900000000	14500000000	21900000000	14500000000	21900000000	None	1	1	0	False	True	9	0	0	2
Chỉ có thời gian để giết quần jean mặc áo bó màu đen và xanh tùy chọn, quần hỏng, quần cắt dao, một lỗ chữ, quần bình thường, quần quần quần quần, thời trang nam, quần tây nam, quần jeans thon, Nhật và Hàn, quần ngắn chân	Nước ngoài	False	45%	False	20	False	0.0	[0, 0, 0, 0, 0, 0]	None	None	22000000000	40000000000	22000000000	40000000000	22000000000	40000000000	None	0	24	0	False	False	8	0	0	0
Quần Dài Thể Thao Phong Cách Hàn Quốc Thời Trang Nam Năng Động	Nước ngoài	True	50%	False	5	False	3.0	[1, 0, 0, 1, 0, 0]	None	None	17150000000	34300000000	17150000000	34300000000	17150000000	34300000000	None	0	33	1	False	False	9	0	1	2
Quần thể thao nam (DEALSHOCK) dây kéo túi hộp độc đáo phong cách - Thời trang nam SIIBE	TP. Hồ Chí Minh	False	50%	False	3	False	0.0	[0, 0, 0, 0, 0, 0]	None	None	18500000000	37000000000	18500000000	37000000000	18500000000	37000000000	None	892	42	0	False	True	5	0	0	0
Quần Thun Dài Thời Trang Nam Năng Động	Nước ngoài	False	50%	False	5	False	0.0	[0, 0, 0, 0, 0, 0]	None	None	45875000000	91750000000	45875000000	91750000000	45875000000	91750000000	None	3	2	0	False	False	9	0	0	1
Quần Jean Nam OLDSailor (MS 1752) thời trang nam ngoại cỡ, thời trang bigsize, quần bò nam	TP. Hồ Chí Minh	False	None	False	3	False	0.0	[0, 0, 0, 0, 0, 0]	None	None	35000000000	-1	35000000000	-1	35000000000	0	None	0	6	0	False	False	8	0	0	0
01 Quần sịp cao cấp thời trang nam, Mã m515	Hà Nội	False	25%	False	3	False	5.0	[2, 0, 0, 0, 0, 2]	None	None	14900000000	19900000000	14900000000	19900000000	14900000000	19900000000	None	3030	1	2	False	False	8	0	0	2
[FREESHIP_99K] quần ka ki khóa kéo  thời trang nam	Bình Dương	False	None	False	3	False	5.0	[1, 0, 0, 0, 0, 1]	None	None	9900000000	-1	9900000000	-1	9900000000	0	None	3	5	1	False	True	1	0	0	4
Set Áo Nỉ Dài Tay Cổ Tròn + Quần Dài Thời Trang Nam	Nước ngoài	False	None	False	6	False	0.0	[0, 0, 0, 0, 0, 0]	None	None	64710000000	-1	64710000000	-1	64710000000	0	None	1	3	0	False	False	9	0	0	0
Quần lỡ cao cấp thời trang nam KQ15	Hà Nội	True	31%	False	3	False	5.0	[2, 0, 0, 0, 0, 2]	None	None	15900000000	23000000000	15900000000	23000000000	15900000000	23000000000	None	0	39	2	True	True	9	0	0	10
[ HÀNG SỊN ] QUẦN ÂU NAM CHẤT ĐẸP THỜI TRANG KOREA VẢI MỊN, CO GIÃN 4 CHIỀU NHIỀU MÀU SẮC ĐỂ LỰA CHỌN [ THỜI TRANG NAM ]	Hà Nội	False	50%	False	7	False	3.5	[2, 0, 1, 0, 0, 1]	None	None	11500000000	23000000000	11500000000	23000000000	11500000000	23000000000	None	0	24	2	False	False	9	0	1	2
Quần xịt nam  quần lót thời trang nam( combo 3 quần)	Hà Nội	False	4%	False	4	False	0.0	[0, 0, 0, 0, 0, 0]	None	None	11500000000	12000000000	11500000000	12000000000	11500000000	12000000000	None	6	6	0	False	False	6	0	0	0
Quần Jean Ống Đứng Thời Trang Nam	Nước ngoài	False	None	False	6	False	0.0	[0, 0, 0, 0, 0, 0]	None	None	19986200000	-1	19986200000	-1	19986200000	0	None	0	1	0	False	False	5	0	0	0
Quần tây nam vải co giãn ống côn ĐẲNG CẤP thời trang nam	Hà Nội	True	50%	False	8	False	4.5	[2, 0, 0, 0, 1, 1]	None	None	8500000000	17000000000	8500000000	17000000000	8500000000	17000000000	None	1	94	2	False	False	7	0	2	6
Quần Jean Nam Đen Xám Xước wash.Quần Bò Nam Rách Thời trang Nam -Vuajean8615	TP. Hồ Chí Minh	False	None	False	5	False	5.0	[1, 0, 0, 0, 0, 1]	None	None	16200000000	-1	16200000000	-1	16200000000	0	None	36	11	1	False	False	2	0	0	1
Quần tây thời trang nam , kiểu dáng sang trọng , thanh lịch 94129	TP. Hồ Chí Minh	False	30%	False	16	False	0.0	[0, 0, 0, 0, 0, 0]	None	None	18900000000	27000000000	18900000000	27000000000	18900000000	27000000000	None	1	21	0	False	True	8	0	0	5
Quần jogger thời trang nam dạo phố du lịch - QJ03	Hà Nội	False	None	False	4	False	3.952381	[21, 2, 2, 3, 2, 12]	None	None	10900000000	-1	10900000000	-1	10900000000	0	None	17	490	21	False	False	4	0	17	137
(Hàng sịn ) Quần HAREM  Nam Đẹp KOREA vải mịn co giãn màu  đen [Thời trang nam]	Hà Nội	False	None	False	5	False	5.0	[1, 0, 0, 0, 0, 1]	None	None	13900000000	-1	13900000000	-1	13900000000	0	None	11	89	1	False	False	5	0	0	2
Quần Jogger Kẻ Sọc Trẻ Trung Thời Trang Nam	Nước ngoài	False	40%	False	4	False	0.0	[0, 0, 0, 0, 0, 0]	None	None	11703100000	19505200000	11703100000	19505200000	11703100000	19505200000	None	1	3	0	False	False	6	0	0	0
Quần Dài Ống Bo Kẻ Sọc Trẻ Trung Thời Trang Nam	Nước ngoài	False	35%	False	4	False	0.0	[0, 0, 0, 0, 0, 0]	None	None	20248700000	31151800000	20248700000	31151800000	20248700000	31151800000	None	0	0	0	False	False	7	0	0	0
Top bán chạy - QUẦN JEAN THỜI TRANG NAM CAO CẤP CHẤT ĐẸP - Cực đỉnh	Hà Nội	False	None	False	7	False	0.0	[0, 0, 0, 0, 0, 0]	None	None	99333300000	-1	99333300000	-1	99333300000	0	None	0	1	0	False	False	9	0	0	0
Quần dài thời trang nam chất liệu cotton màu trơn	Nước ngoài	False	40%	False	0	False	0.0	[0, 0, 0, 0, 0, 0]	None	None	15800000000	26333300000	15800000000	26333300000	15800000000	26333300000	None	3	8	0	False	False	9	0	0	2
Quần tây nam - quần âu nam vải co giãn ống côn ĐẲNG CẤP thời trang nam	Hà Nội	False	39%	False	7	False	5.0	[1, 0, 0, 0, 0, 1]	None	None	10900000000	18000000000	10900000000	18000000000	10900000000	18000000000	None	759	101	1	False	False	9	0	50	50
Quần Jeans Xé Ống Rộng Size Nhỏ Thời Trang Nam Cá Tính 2020	Nước ngoài	False	None	False	7	False	0.0	[0, 0, 0, 0, 0, 0]	None	None	24710000000	-1	24710000000	-1	24710000000	0	None	0	6	0	False	False	9	0	0	0
(Hàng sịn ) Quần Âu Nam Đẹp KOREA vải mịn co dãn màu ghi nhạt, ghi đậm, đen, xanh đen [Thời trang nam]	Hà Nội	True	14%	False	7	False	5.0	[1, 0, 0, 0, 0, 1]	None	None	15000000000	17500000000	15000000000	17500000000	15000000000	17500000000	None	0	29	1	False	False	7	0	1	1
[MUA 3 GIẢM 30K ] - QUẦN SHORT KAKI NAM CO GIÃN CAO CẤP BẢNG MÀU CỰC HOT	TP. Hồ Chí Minh	True	50%	False	5	False	4.888889	[9, 0, 0, 0, 1, 8]	None	None	9900000000	19800000000	9900000000	19800000000	9900000000	19800000000	None	7	1122	9	True	False	9	0	19	51
Quần Tây Nam Den Vải chéo đẹp, co giãn phong cách Hàn Quốc Pain Doré Store	TP. Hồ Chí Minh	True	45%	False	7	False	4.732558	[86, 2, 2, 1, 7, 74]	None	None	9900000000	18000000000	9900000000	18000000000	9900000000	18000000000	None	128	4017	86	False	False	9	1	359	1217
