name	shop_location	shopee_verified	discount	is_adult	options	show_official_shop_label_in_title	rating_star	rating_count	flash_sale	upcoming_flash_sale	price_min	price_min_before_discoun	price_max	price_max_before_discount	price	price_before_discount	coin_earn_label	liked_count	view_count	cmt_count	is_preferred_plus_seller	show_free_shipping	images	video_info_list	sold	historical_sold
Quần Jeans Mỏng Ống Suông Rộng Phối Rách Thời Trang Nam Cá Tính	Nước ngoài	False	None	False	5	False	0.0	[0, 0, 0, 0, 0, 0]	None	None	37850000000	-1	37850000000	-1	37850000000	0	None	0	0	0	False	False	8	0	0	0
Quần Short Thể Thao Đi Biển Thời Trang Nam Năng Động 011	Nước ngoài	False	28%	False	6	False	0.0	[0, 0, 0, 0, 0, 0]	None	None	30940000000	43190000000	30940000000	43190000000	30940000000	43190000000	None	0	0	0	False	False	6	0	0	0
Quần Jeans Mỏng Ống Suông Rộng Hình Hoa Cúc Nhỏ Thời Trang Nam Cá Tính	Nước ngoài	False	None	False	6	False	0.0	[0, 0, 0, 0, 0, 0]	None	None	36690000000	-1	36690000000	-1	36690000000	0	None	0	0	0	False	False	8	0	0	0
Ma79s QUẦN BAGGY ĐŨI NAM Thời Trang Nam Cao Cấp Thương Hiệu Raacus (4 màu) -  Ma7979s	Hà Nội	False	None	False	1	False	0.0	[0, 0, 0, 0, 0, 0]	None	None	34000000000	-1	51000000000	-1	34000000000	0	None	0	0	0	False	False	7	0	0	0
Quần Dài Ống Đứng Thời Trang Nam	Nước ngoài	False	25%	False	5	False	0.0	[0, 0, 0, 0, 0, 0]	None	None	16500000000	22000000000	16500000000	22000000000	16500000000	22000000000	None	0	0	0	False	False	5	0	0	0
Quần Sooc đùi Thời Trang Nam NK	TP. Hồ Chí Minh	False	None	False	2	False	0.0	[0, 0, 0, 0, 0, 0]	None	None	17000000000	-1	17000000000	-1	17000000000	0	None	2	0	0	False	False	3	0	0	0
Quần 3D thời trang nam 2020	Hà Nội	False	None	False	3	False	5.0	[1, 0, 0, 0, 0, 1]	None	None	6500000000	-1	6500000000	-1	6500000000	0	None	6034	0	1	False	False	9	0	0	3
Quần Jean Dài Thời Trang Nam	Nước ngoài	False	50%	False	7	False	0.0	[0, 0, 0, 0, 0, 0]	None	None	27440000000	54610000000	33090000000	65840000000	27440000000	54610000000	None	0	0	0	False	False	9	0	0	0
Quần Túi Hộp Ống Rộng Size Lớn Thời Trang Nam M-7xl	Nước ngoài	False	None	False	6	False	0.0	[0, 0, 0, 0, 0, 0]	None	None	99410000000	-1	99410000000	-1	99410000000	0	None	0	5	0	False	False	9	0	0	0
Quần Short Jean Rách Thời Trang Nam	Nước ngoài	False	50%	False	9	False	0.0	[0, 0, 0, 0, 0, 0]	None	None	24450000000	48900000000	32950000000	65900000000	24450000000	48900000000	None	0	0	0	False	False	9	0	0	0
Quần Túi Hộp Ống Rộng Size Lớn Thời Trang Nam M-7xl	Nước ngoài	False	None	False	7	False	0.0	[0, 0, 0, 0, 0, 0]	None	None	87670000000	-1	87670000000	-1	87670000000	0	None	0	1	0	False	False	9	0	0	0
Sale 🥑ｓốｃ ⭐ ⚡ | Sales | | 10-10 |_ Quần Bò thời trang nam- quần bò DSQ cao cấp -- Siêu Đẹp .. . 2020 . . Xịn 🥑 ⚡ . ˇ `	Hà Nội	False	None	False	5	False	0.0	[0, 0, 0, 0, 0, 0]	None	None	10472000000	-1	10472000000	-1	10472000000	0	None	0	0	0	False	False	1	0	0	0
QUẦN BAGGY ĐŨI NAM Thời Trang Nam Cao Cấp Thương Hiệu Raacus (4 màu) - ma7979s	None	False	None	False	1	False	0.0	[0, 0, 0, 0, 0, 0]	None	None	34000000000	-1	51000000000	-1	34000000000	0	None	0	0	0	False	False	7	0	0	0
Quần Short Jean Rách Thời Trang Nam	Nước ngoài	False	47%	False	8	False	0.0	[0, 0, 0, 0, 0, 0]	None	None	19880000000	36240000000	32960000000	62400000000	19880000000	36240000000	None	0	0	0	False	False	9	0	0	0
🚀 Sale | NGON BỔ RẺ | | ĐẲNG CẤP |_ Quần Bò thời trang nam- quần bò DSQ cao cấp -- Siêu Đẹp .. . 🔥 : ‣	Hà Nội	False	None	False	5	False	0.0	[0, 0, 0, 0, 0, 0]	None	None	13319700000	-1	13319700000	-1	13319700000	0	None	0	0	0	False	False	1	0	0	0
Quần Jeans Dài Phối Vết Rách Cá Tính Thời Trang Nam	Nước ngoài	False	50%	False	7	False	0.0	[0, 0, 0, 0, 0, 0]	None	None	49870000000	99230000000	49870000000	99230000000	49870000000	99230000000	None	0	0	0	False	True	9	0	0	0
Quần Ngắn Lưng Thun Thời Trang Nam 2020	Nước ngoài	False	50%	False	5	False	0.0	[0, 0, 0, 0, 0, 0]	None	None	23750000000	47500000000	23750000000	47500000000	23750000000	47500000000	None	0	0	0	False	False	9	0	0	0
Quần Lót Thời Trang Nam Quyến Rũ	Nước ngoài	False	None	False	1	False	0.0	[0, 0, 0, 0, 0, 0]	None	None	12780000000	-1	13490000000	-1	12780000000	0	None	0	0	0	False	False	7	0	0	0
🌸 [ Mua Nhiều Giảm Giá ] QUẦN JEAN NGỐ THỜI TRANG NAM CAO CẤP CHẤT ĐẸP [ Mẫu Mới Cực Chất ] 🌸 '	Hà Nội	False	None	False	7	False	0.0	[0, 0, 0, 0, 0, 0]	None	None	20429800000	-1	20429800000	-1	20429800000	0	None	0	0	0	False	False	9	0	0	0
Áo Khoác Giữ Ấm Dày Dặn Thời Trang Nam	Nước ngoài	False	None	False	11	False	0.0	[0, 0, 0, 0, 0, 0]	None	None	80148000000	-1	80148000000	-1	80148000000	0	None	0	0	0	False	False	9	0	0	0
Jean Nam Kiểu Rách Bigsize (Ms 1765) thời trang nam ngoại cỡ, quần bò	TP. Hồ Chí Minh	False	None	False	3	False	0.0	[0, 0, 0, 0, 0, 0]	None	None	35000000000	-1	35000000000	-1	35000000000	0	None	0	8	0	False	False	6	0	0	0
Quần short thời trang nam thể thao, kaki Amazing cao cấp, lưng bo, phong cách trẻ trung năng động cá tính	TP. Hồ Chí Minh	True	47%	False	10	False	0.0	[0, 0, 0, 0, 0, 0]	None	None	9500000000	17900000000	9500000000	17900000000	9500000000	17900000000	None	0	0	0	False	False	9	1	0	0
Tết🌺Sale Quần shorts nam BIGSIZE, Thời trang nam bigsize Siêu mịn, siêu đẹp, Chính hãng Fasvin (D209)	Hà Nội	False	None	False	3	False	0.0	[0, 0, 0, 0, 0, 0]	None	None	14366200000	-1	14366200000	-1	14366200000	0	None	0	0	0	False	False	9	0	0	0
Quần Cotton Mỏng Ống Suông Rộng Thời Trang Nam Năng Động	Nước ngoài	False	None	False	5	False	0.0	[0, 0, 0, 0, 0, 0]	None	None	56050000000	-1	56050000000	-1	56050000000	0	None	0	0	0	False	False	9	0	0	0
Quần Cotton Mỏng Ống Rộng Thời Trang Nam Cá Tính	Nước ngoài	False	1%	False	4	False	0.0	[0, 0, 0, 0, 0, 0]	None	None	13940000000	14130000000	25740000000	26030000000	13940000000	14130000000	None	0	0	0	False	False	9	0	0	0
Quần Quân Đội Nhiều Túi Chống Thấm Mồ Hôi Thời Trang Nam Năng Động	Nước ngoài	False	None	False	8	False	0.0	[0, 0, 0, 0, 0, 0]	None	None	40150000000	-1	67470000000	-1	40150000000	0	None	0	0	0	False	False	9	0	0	0
Quần short jeans nam thiết kế thời trang cao cấp nam , quần sọt jean thời trang nam S123	TP. Hồ Chí Minh	True	37%	False	6	False	0.0	[0, 0, 0, 0, 0, 0]	None	None	13900000000	22000000000	13900000000	22000000000	13900000000	22000000000	None	0	1	0	False	False	5	0	0	0
Sale 🥑ｓốｃ | ĐẲNG CẤP |_ Quần Bò thời trang nam- quần bò DSQ cao cấp	TP. Hồ Chí Minh	False	34%	False	5	False	0.0	[0, 0, 0, 0, 0, 0]	None	None	16560200000	25091200000	16560200000	25091200000	16560200000	25091200000	None	0	0	0	False	False	1	0	0	0
Jean Nam Kiểu Rách Bigsize (Ms 1765) thời trang nam ngoại cỡ, quần bò	TP. Hồ Chí Minh	False	None	False	3	False	0.0	[0, 0, 0, 0, 0, 0]	None	None	35000000000	-1	35000000000	-1	35000000000	0	None	0	1	0	False	False	6	0	0	0
Quần Dài Ống Đứng Thời Trang Nam	Nước ngoài	False	45%	False	4	False	0.0	[0, 0, 0, 0, 0, 0]	None	None	19025600000	34592000000	19025600000	34592000000	19025600000	34592000000	None	0	0	0	False	False	9	0	0	0
Quần Lót Boxer Vải Lụa Lạnh Thời Trang Nam Cao Cấp 2-4	Nước ngoài	False	48%	False	5	False	0.0	[0, 0, 0, 0, 0, 0]	None	None	14060000000	26350000000	24160000000	46560000000	14060000000	26350000000	None	0	0	0	False	False	9	0	0	0
Quần đùi thời trang nam phom 50-80kg, Mã Q42	Hà Nội	True	39%	False	3	False	0.0	[0, 0, 0, 0, 0, 0]	None	None	10900000000	17900000000	10900000000	17900000000	10900000000	17900000000	None	0	0	0	False	False	9	0	0	2
Quần Jogger Nỉ JG11 Thời Trang Nam	Hà Nội	True	37%	False	4	False	5.0	[1, 0, 0, 0, 0, 1]	None	None	6900000000	10900000000	6900000000	10900000000	6900000000	10900000000	None	2	2	1	False	False	9	1	0	6
Quần Jeans Dài Phối Vết Rách Cá Tính Thời Trang Nam	Nước ngoài	False	50%	False	7	False	0.0	[0, 0, 0, 0, 0, 0]	None	None	27701700000	55403400000	27701700000	55403400000	27701700000	55403400000	None	0	2	0	False	False	9	0	0	0
QUẦN BAGGY ĐŨI NAM Thời Trang Nam Cao Cấp Thương Hiệu Raacus (4 màu) - ma7979s	None	False	None	False	1	False	0.0	[0, 0, 0, 0, 0, 0]	None	None	34000000000	-1	51000000000	-1	34000000000	0	None	0	0	0	False	False	7	0	0	0
Quần short jean họa tiết kết hợp rách gối tăng vẻ đẹp chiếc quần, quần sọt jean thời trang nam S74	TP. Hồ Chí Minh	False	37%	False	6	False	0.0	[0, 0, 0, 0, 0, 0]	None	None	13900000000	22000000000	13900000000	22000000000	13900000000	22000000000	None	0	0	0	False	False	5	0	0	0
Mới Quần Jean Rách Thời Trang Nam	Nước ngoài	False	None	False	8	False	0.0	[0, 0, 0, 0, 0, 0]	None	None	51130000000	-1	51130000000	-1	51130000000	0	None	0	1	0	False	False	5	0	0	0
Quần Short Thể Thao Phối Dây Thắt Thời Trang Nam Cao Cấp C703	Nước ngoài	False	38%	False	4	False	0.0	[0, 0, 0, 0, 0, 0]	None	None	16280000000	26320000000	16280000000	26320000000	16280000000	26320000000	None	0	0	0	False	False	9	0	0	0
Quần Tây Ống Đứng Thời Trang Nam Lịch Lãm	Nước ngoài	False	50%	False	9	False	0.0	[0, 0, 0, 0, 0, 0]	None	None	42120000000	83810000000	42120000000	83810000000	42120000000	83810000000	None	0	1	0	False	False	8	0	0	0
Tết🌺Sale [ Siêu phẩm 2021 ] QUẦN JEAN NGỐ THỜI TRANG NAM CAO CẤP CHẤT ĐẸP [ Đặt FreeShip Ngay ]	Hà Nội	False	None	False	7	False	0.0	[0, 0, 0, 0, 0, 0]	None	None	53860000000	-1	53860000000	-1	53860000000	0	None	0	0	0	False	False	9	0	0	0
Quần Sooc ngắn Thời Trang Nam Nk	TP. Hồ Chí Minh	False	None	False	5	False	0.0	[0, 0, 0, 0, 0, 0]	None	None	15000000000	-1	15000000000	-1	15000000000	0	None	2	0	0	False	False	4	0	0	0
Quần Jean Rách Thời Trang Nam	Nước ngoài	False	13%	False	7	False	0.0	[0, 0, 0, 0, 0, 0]	None	None	24020000000	27530000000	24020000000	27530000000	24020000000	27530000000	None	0	0	0	False	False	5	0	0	0
Sale 🥑ｓốｃ ⭐ ⚡ | Sales | | 10-10 |_ Quần Bò thời trang nam- quần bò DSQ cao cấp -- Siêu Đẹp .. . 2020 . . Xịn 🥑 ⚡ . ˇ *	Hải Phòng	False	None	False	5	False	0.0	[0, 0, 0, 0, 0, 0]	None	None	11572000000	-1	11572000000	-1	11572000000	0	None	0	0	0	False	False	1	0	0	0
Quần short jeans nam thiết kế thời trang cao cấp nam , quần sọt jean thời trang nam S42	TP. Hồ Chí Minh	True	37%	False	6	False	0.0	[0, 0, 0, 0, 0, 0]	None	None	13900000000	22000000000	13900000000	22000000000	13900000000	22000000000	None	0	0	0	False	False	5	0	0	0
Quần short lưng thun dây rút màu trơn thời trang nam năng động trẻ trung	Nước ngoài	False	None	False	7	False	5.0	[1, 0, 0, 0, 0, 1]	None	None	14240400000	-1	14240400000	-1	14240400000	0	None	4	1	1	False	False	9	0	0	5
Jean Nam Màu Đen Bigsize (MS 1771) - Quần bò, quần jean, thời trang ngoại cỡ, thời trang nam	TP. Hồ Chí Minh	False	None	False	5	False	0.0	[0, 0, 0, 0, 0, 0]	None	None	39000000000	-1	39000000000	-1	39000000000	0	None	0	0	0	False	False	6	0	0	0
Jean Nam Màu Đen Bigsize (MS 1771) - Quần bò, quần jean, thời trang ngoại cỡ, thời trang nam	TP. Hồ Chí Minh	False	None	False	5	False	0.0	[0, 0, 0, 0, 0, 0]	None	None	39000000000	-1	39000000000	-1	39000000000	0	None	0	0	0	False	False	6	0	0	0
Quần Jean Đen Thời Trang Nam Hàn Quốc	Nước ngoài	False	50%	False	7	False	0.0	[0, 0, 0, 0, 0, 0]	None	None	28660000000	57030000000	29420000000	58530000000	28660000000	57030000000	None	0	0	0	False	False	9	0	0	0
UNDER ARMOUR Quần Ngắn Lưng Thun Thời Trang Nam 2020	Nước ngoài	False	50%	False	5	False	0.0	[0, 0, 0, 0, 0, 0]	None	None	21300000000	42600000000	21300000000	42600000000	21300000000	42600000000	None	0	1	0	False	False	8	0	0	0
Quần Lót Lụa Lạnh Thoáng Khí Nhanh Khô Thời Trang Nam Cao Cấp	Nước ngoài	False	None	False	4	False	0.0	[0, 0, 0, 0, 0, 0]	None	None	9970000000	-1	9970000000	-1	9970000000	0	None	0	0	0	False	False	9	0	0	0
Quần Thun Dài Thời Trang Nam Họa Tiết Nổi Bật	Nước ngoài	False	25%	False	5	False	0.0	[0, 0, 0, 0, 0, 0]	None	None	18000000000	24000000000	18000000000	24000000000	18000000000	24000000000	None	0	0	0	False	False	5	0	0	0
𝙎𝙞𝙚̂𝙪 𝙎𝙖𝙡𝙚 SALE 🥑ｓốｃ | ĐẲNG CẤP |_ Quần Bò thời trang nam- quần bò DSQ cao cấp -- Siêu Đẹp M09 🥑 ⚡ : * :	TP. Hồ Chí Minh	False	None	False	5	False	0.0	[0, 0, 0, 0, 0, 0]	None	None	18826200000	-1	18826200000	-1	18826200000	0	None	0	0	0	False	False	1	0	0	0
Quần Jeans Mỏng Ống Suông Rộng Thời Trang Nam Cá Tính	Nước ngoài	False	None	False	10	False	0.0	[0, 0, 0, 0, 0, 0]	None	None	82360000000	-1	82360000000	-1	82360000000	0	None	0	0	0	False	False	9	0	0	0
Quần Thun Dài Thể Thao Thời Trang Nam Năng Động	Nước ngoài	False	25%	False	4	False	0.0	[0, 0, 0, 0, 0, 0]	None	None	10500000000	13900000000	10800000000	14400000000	10500000000	13900000000	None	0	0	0	False	False	9	0	0	0
Sale 🥑ｓốｃ ⭐ ⚡ | Sales | | 10-10 |_ Quần Bò thời trang nam- quần bò DSQ cao cấp -- Siêu Đẹp .. . 2020 . . . Xịn 🥑 ⚡ . ' .	TP. Hồ Chí Minh	False	30%	False	5	False	0.0	[0, 0, 0, 0, 0, 0]	None	None	10875900000	15536900000	10875900000	15536900000	10875900000	15536900000	None	0	0	0	False	False	1	0	0	0
Quần Nhung Mỏng Ống Suông Rộng Thời Trang Nam Cá Tính	Nước ngoài	False	48%	False	6	False	0.0	[0, 0, 0, 0, 0, 0]	None	None	25310000000	48570000000	28930000000	55800000000	25310000000	48570000000	None	0	0	0	False	False	9	0	0	0
Quần Ngố Bò Nam Vải Xước Cao Cấp Thời Trang Nam BN11	Hà Nội	True	41%	False	7	False	5.0	[1, 0, 0, 0, 0, 1]	None	None	9900000000	16700000000	9900000000	16700000000	9900000000	16700000000	None	1593	0	1	False	True	7	1	0	5
TẾT XẢ Sale Quần Jean nam.quần bò thời trang nam SPF new .	Bà Rịa - Vũng Tàu	False	None	False	7	False	0.0	[0, 0, 0, 0, 0, 0]	None	None	32533700000	-1	32533700000	-1	32533700000	0	None	0	0	0	False	False	5	0	0	0
Quần Jeans Dài Ống Đứng Thời Trang Nam	Nước ngoài	False	50%	False	1	False	0.0	[0, 0, 0, 0, 0, 0]	None	None	47380000000	94760000000	47380000000	94760000000	47380000000	94760000000	None	0	0	0	False	False	8	0	0	0
Quần Short Vải Lanh Mỏng Ống Rộng Thời Trang Nam	Nước ngoài	False	44%	False	8	False	0.0	[0, 0, 0, 0, 0, 0]	None	None	15960000000	28260000000	17760000000	31860000000	15960000000	28260000000	None	0	0	0	False	False	9	0	0	0
Quần Lót Boxer Phối Lưới Thời Trang Nam Gợi Cảm C607	Nước ngoài	False	38%	False	4	False	0.0	[0, 0, 0, 0, 0, 0]	None	None	15220000000	24560000000	15220000000	24560000000	15220000000	24560000000	None	0	0	0	False	False	9	0	0	0
HÀNG NHẬP KHẨU -  Quần Jeans Nam Ống Rộng Dáng Dài Phối Cùng Áo Thun, Sơ Mi Caro Thời Trang Nam MANDO QJN004 - Hàng Nhập	Hà Nội	False	None	False	5	False	0.0	[0, 0, 0, 0, 0, 0]	None	None	78000000000	-1	78000000000	-1	78000000000	0	None	0	2	0	False	False	9	1	0	0
[ Siêu phẩm 2021 ] QUẦN JEAN NGỐ THỜI TRANG NAM CAO CẤP CHẤT ĐẸP [ Đặt FreeShip Ngay ] *	TP. Hồ Chí Minh	False	None	False	7	False	0.0	[0, 0, 0, 0, 0, 0]	None	None	64118600000	-1	64118600000	-1	64118600000	0	None	0	0	0	False	False	9	0	0	0
Quần Short Thể Thao Phối Dây Thắt Thời Trang Nam Cao Cấp C703	Nước ngoài	False	38%	False	4	False	0.0	[0, 0, 0, 0, 0, 0]	None	None	16810000000	27200000000	16810000000	27200000000	16810000000	27200000000	None	0	0	0	False	False	9	0	0	0
Quần short nam kẻ sọc trắng cao cấp, phong cách thời trang nam Hàn Quốc	Hà Nội	True	41%	False	5	False	0.0	[0, 0, 0, 0, 0, 0]	None	None	12900000000	22000000000	12900000000	22000000000	12900000000	22000000000	None	0	2	0	True	False	4	0	0	0
Quần Jean Rách Thời Trang Nam	Nước ngoài	False	None	False	12	False	0.0	[0, 0, 0, 0, 0, 0]	None	None	61740000000	-1	61740000000	-1	61740000000	0	None	0	0	0	False	False	6	0	0	0
12.12 Sale 🍀 SALE Quần Bò thời trang nam- quần bò DSQ cao cấp 🌟 . 💕 . . . *	Lạng Sơn	False	None	False	5	False	0.0	[0, 0, 0, 0, 0, 0]	None	None	15306900000	-1	15306900000	-1	15306900000	0	None	0	2	0	False	False	1	0	0	0
QUẦN SHORT NAM THỂ THAO Jean Đen Rách_Quần sooc Jean Đen Cao Cấp  Thời Trang Nam Quynhha [CÒN HÀNG]	TP. Hồ Chí Minh	True	20%	False	5	False	5.0	[1, 0, 0, 0, 0, 1]	None	None	13400000000	16800000000	13400000000	16800000000	13400000000	16800000000	None	47	19	1	True	True	2	0	0	4
[HÀNG HOT 2020] Quần Jogger kaki co giãn trẻ trung thời trang nam cao cấp CEFFYLO	Hà Nội	False	35%	False	5	False	0.0	[0, 0, 0, 0, 0, 0]	None	None	29250000000	45000000000	29250000000	45000000000	29250000000	45000000000	None	0	1	0	False	False	9	0	0	0
Quần Jeans Mỏng Ống Suông Thoải Mái Thời Trang Nam Cá Tính	Nước ngoài	False	None	False	9	False	0.0	[0, 0, 0, 0, 0, 0]	None	None	42900000000	-1	42900000000	-1	42900000000	0	None	0	0	0	False	False	7	0	0	0
Quần Túi Hộp Ống Rộng Size Lớn Thời Trang Nam M-7xl	Nước ngoài	False	None	False	9	False	0.0	[0, 0, 0, 0, 0, 0]	None	None	85600000000	-1	85600000000	-1	85600000000	0	None	0	0	0	False	False	8	0	0	0
Tết🌺Sale [FASVIN] Quần shorts nam big size, Quần short gió thể thao Fasvin siêu mềm, Thời trang nam Bigsize (D206) .	Hà Nội	False	None	False	3	False	0.0	[0, 0, 0, 0, 0, 0]	None	None	13631200000	-1	13631200000	-1	13631200000	0	None	0	0	0	False	False	9	0	0	0
Quần Jeans Size Lớn Thời Trang Nam Năng Động M-8xl	Nước ngoài	False	50%	False	10	False	0.0	[0, 0, 0, 0, 0, 0]	None	None	45210000000	89970000000	45210000000	89970000000	45210000000	89970000000	None	0	1	0	False	False	9	0	0	0
Quần Jean Rách Thời Trang Nam	Nước ngoài	False	50%	False	7	False	0.0	[0, 0, 0, 0, 0, 0]	None	None	27820000000	55360000000	30830000000	61350000000	27820000000	55360000000	None	0	0	0	False	False	9	0	0	0
QUẦN BAGGY ĐŨI NAM Thời Trang Nam Cao Cấp Thương Hiệu Raacus (4 màu) - ma7979s	None	False	None	False	1	False	0.0	[0, 0, 0, 0, 0, 0]	None	None	34000000000	-1	51000000000	-1	34000000000	0	None	0	1	0	False	False	7	0	0	0
Quần Dài Giữ Ấm Thời Trang Nam	Nước ngoài	False	None	False	12	False	0.0	[0, 0, 0, 0, 0, 0]	None	None	85817800000	-1	85817800000	-1	85817800000	0	None	0	0	0	False	False	9	0	0	0
Quần đũi ngố thời trang nam phom 40-75kg,phong cách trẻ chung,mát mẻ,nhẹ nhàng	Hà Nội	False	50%	False	3	False	5.0	[1, 0, 0, 0, 0, 1]	None	None	10000000000	20000000000	10000000000	20000000000	10000000000	20000000000	None	0	9	1	False	False	9	0	0	40
quần ống rộng Thời Trang Năm 2021 Cho Nam	Nước ngoài	False	22%	False	8	False	0.0	[0, 0, 0, 0, 0, 0]	None	None	32370000000	41500000000	32370000000	41500000000	32370000000	41500000000	None	0	0	0	False	False	9	0	0	0
Quần Lót Lụa Lạnh Hình Mũi Voi Thời Trang Nam Quyến Rũ B610	Nước ngoài	False	38%	False	4	False	0.0	[0, 0, 0, 0, 0, 0]	None	None	14510000000	23500000000	14510000000	23500000000	14510000000	23500000000	None	0	0	0	False	False	9	0	0	0
QUẦN LÓT COTTON THỜI TRANG NAM CO GIÃN	Hà Nội	False	50%	False	1	False	0.0	[0, 0, 0, 0, 0, 0]	None	None	5450000000	10900000000	5450000000	10900000000	5450000000	10900000000	None	0	0	0	False	False	5	0	0	0
[ Siêu phẩm 2021 ] QUẦN JEAN THỜI TRANG NAM CAO CẤP CHẤT ĐẸP [ Đặt FreeShip Ngay ] *	TP. Hồ Chí Minh	False	None	False	7	False	0.0	[0, 0, 0, 0, 0, 0]	None	None	87648100000	-1	87648100000	-1	87648100000	0	None	0	1	0	False	False	9	0	0	0
Quần Cotton Mỏng Ống Suông Rộng Thời Trang Nam Năng Động	Nước ngoài	False	21%	False	4	False	0.0	[0, 0, 0, 0, 0, 0]	None	None	27550000000	34690000000	27550000000	34690000000	27550000000	34690000000	None	0	0	0	False	False	7	0	0	0
Rẻ Đẹp - Kaki Thời Trang Nam, Quần Dáng Slim, trẻ trung, lịch sự, giá rẻ, chất vải mềm, mặc thoải mái AT	Hòa Bình	False	None	False	11	False	0.0	[0, 0, 0, 0, 0, 0]	None	None	12592600000	-1	13677400000	-1	12592600000	0	None	0	0	0	False	False	6	0	0	0
Quần Bò - Quần Jean Nam Ống Đứng , Thời Trang Nam Phong Cách Trẻ Trung Năng Động	Hà Nội	False	None	False	5	False	0.0	[0, 0, 0, 0, 0, 0]	None	None	49000000000	-1	49000000000	-1	49000000000	0	None	0	1	0	False	False	6	0	0	0
Quần short jean họa tiết kết hợp rách gối tăng vẻ đẹp chiếc quần, quần sọt jean thời trang nam S56	TP. Hồ Chí Minh	False	37%	False	6	False	0.0	[0, 0, 0, 0, 0, 0]	None	None	13900000000	22000000000	13900000000	22000000000	13900000000	22000000000	None	0	2	0	False	False	5	0	0	0
Quần Jeans Dài Phối Vết Rách Cá Tính Thời Trang Nam	Nước ngoài	False	50%	False	6	False	0.0	[0, 0, 0, 0, 0, 0]	None	None	48700000000	96910000000	48700000000	96910000000	48700000000	96910000000	None	0	0	0	False	True	7	0	0	0
Quần Quân Đội Nhiều Túi Chống Thấm Mồ Hôi Thời Trang Nam Năng Động	Nước ngoài	False	None	False	8	False	0.0	[0, 0, 0, 0, 0, 0]	None	None	51380000000	-1	78700000000	-1	51380000000	0	None	0	1	0	False	False	9	0	0	0
Quần Thể Thao Lót Nhung Dày Ống Suông Rộng Thời Trang Nam Đơn Giản	Nước ngoài	False	None	False	6	False	0.0	[0, 0, 0, 0, 0, 0]	None	None	27320000000	-1	44940000000	-1	27320000000	0	None	0	0	0	False	False	7	0	0	0
Hp Quần Jean Rách Thời Trang Nam	Nước ngoài	False	None	False	6	False	0.0	[0, 0, 0, 0, 0, 0]	None	None	83510000000	-1	83510000000	-1	83510000000	0	None	0	0	0	False	False	5	0	0	0
Quần jean ống đứng rộng thời trang nam Hàn Quốc	Nước ngoài	False	44%	False	9	False	0.0	[0, 0, 0, 0, 0, 0]	None	None	16430000000	28970000000	24090000000	42900000000	16430000000	28970000000	None	0	0	0	False	False	9	0	0	0
Quần Lót Boxer Vải Lụa Lạnh Thoáng Khí Thời Trang Nam Cao Cấp	Nước ngoài	False	None	False	4	False	0.0	[0, 0, 0, 0, 0, 0]	None	None	17710000000	-1	17710000000	-1	17710000000	0	None	0	0	0	False	False	7	0	0	0
Sale 🥑ｓốｃ ⭐ ⚡ | Sales | | 10-10 |_ Quần Bò thời trang nam- quần bò DSQ cao cấp -- Siêu Đẹp .. . 2020 . . Xịn 🥑 ⚡ . ✿ *	Hà Nội	False	None	False	5	False	0.0	[0, 0, 0, 0, 0, 0]	None	None	16617400000	-1	16617400000	-1	16617400000	0	None	0	1	0	False	False	1	0	0	0
Quần Jeans Mỏng Ống Suông Thời Trang Nam Cá Tính	Nước ngoài	False	None	False	8	False	0.0	[0, 0, 0, 0, 0, 0]	None	None	41750000000	-1	41750000000	-1	41750000000	0	None	0	0	0	False	False	1	0	0	0
Quần Lót Chữ Tiếng Anh Lưng Thấp Thời Trang Nam Cao Cấp Vc32	Nước ngoài	False	50%	False	4	False	0.0	[0, 0, 0, 0, 0, 0]	None	None	14160000000	28170000000	14160000000	28170000000	14160000000	28170000000	None	0	0	0	False	False	8	0	0	0
Ma79s QUẦN BAGGY ĐŨI NAM Thời Trang Nam Cao Cấp Thương Hiệu Raacus (4 màu) -  Ma7979s	None	False	None	False	1	False	0.0	[0, 0, 0, 0, 0, 0]	None	None	34000000000	-1	51000000000	-1	34000000000	0	None	0	0	0	False	False	7	0	0	0
Quần Sooc đùi Thời Trang Nam NK	TP. Hồ Chí Minh	False	None	False	5	False	0.0	[0, 0, 0, 0, 0, 0]	None	None	15000000000	-1	15000000000	-1	15000000000	0	None	2	0	0	False	False	3	0	0	0
Quần Lửng Vải Lanh Cotton Ống Rộng Thời Trang Nam 1104	Nước ngoài	False	None	False	6	False	0.0	[0, 0, 0, 0, 0, 0]	None	None	22360000000	-1	37330000000	-1	22360000000	0	None	0	0	0	False	False	7	0	0	0
Quần Lót Tam Giác Vải Lụa Lạnh Mỏng Thoáng Khí Thời Trang Nam Quyến Rũ	Nước ngoài	False	1%	False	4	False	0.0	[0, 0, 0, 0, 0, 0]	None	None	45290000000	45730000000	49780000000	50310000000	45290000000	45730000000	None	0	0	0	False	False	9	0	0	0
Quần Jeans Mỏng Ống Suông Rộng Thời Trang Nam Cá Tính	Nước ngoài	False	None	False	10	False	0.0	[0, 0, 0, 0, 0, 0]	None	None	82430000000	-1	82430000000	-1	82430000000	0	None	0	0	0	False	False	9	0	0	0
Quần Lót Boxer Vải Lụa Lạnh Thoáng Khí Thời Trang Nam Cao Cấp 2-4	Nước ngoài	False	49%	False	5	False	0.0	[0, 0, 0, 0, 0, 0]	None	None	21800000000	43110000000	21800000000	43110000000	21800000000	43110000000	None	0	0	0	False	False	8	0	0	0
Quần Dài Ống Đứng Thời Trang Nam	Nước ngoài	False	None	False	6	False	0.0	[0, 0, 0, 0, 0, 0]	None	None	31780000000	-1	31780000000	-1	31780000000	0	None	0	0	0	False	False	9	0	0	0
Quần jogger thời trang nam phong cách	TP. Hồ Chí Minh	True	41%	False	0	False	0.0	[0, 0, 0, 0, 0, 0]	None	None	7990000000	13500000000	7990000000	13500000000	7990000000	13500000000	None	1	1	0	False	True	3	0	0	3
Quần Thun Dài Thời Trang Nam Phong Cách Năng Động	Nước ngoài	False	None	False	10	False	0.0	[0, 0, 0, 0, 0, 0]	None	None	13340000000	-1	48160000000	-1	13340000000	0	None	0	0	0	False	False	9	0	0	0
Ma79s QUẦN BAGGY ĐŨI NAM Thời Trang Nam Cao Cấp Thương Hiệu Raacus (4 màu) -  Ma7979s	Hà Nội	False	None	False	1	False	0.0	[0, 0, 0, 0, 0, 0]	None	None	34000000000	-1	51000000000	-1	34000000000	0	None	0	0	0	False	False	7	0	0	0
QUẦN BAGGY ĐŨI NAM Thời Trang Nam Cao Cấp Thương Hiệu Raacus (4 màu) - ma7979s	None	False	None	False	1	False	0.0	[0, 0, 0, 0, 0, 0]	None	None	34000000000	-1	51000000000	-1	34000000000	0	None	0	0	0	False	False	7	0	0	0
Quần Jeans Dài Phối Vết Rách Cá Tính Thời Trang Nam	Nước ngoài	False	None	False	4	False	5.0	[1, 0, 0, 0, 0, 1]	None	None	27470000000	-1	27470000000	-1	27470000000	0	None	3	0	1	False	True	9	1	0	1
Quần chất liệu vải đũi, có ống bo chun thời trang nam , Mã 21	Hà Nội	False	40%	False	4	False	5.0	[1, 0, 0, 0, 0, 1]	None	None	11900000000	19900000000	11900000000	19900000000	11900000000	19900000000	None	3028	9	1	False	False	9	0	0	6
