category_id	name	shop_location	item_public_time	item_be_got_time	sell_time	shopee_verified	discount	is_adult	options	show_official_shop_label_in_title	rating_star	five_star	four_star	three_star	two_star	one_star	flash_sale	upcoming_flash_sale	price_min	price_min_before_discount	price_max	price_max_before_discount	price	price_before_discount	coin_earn_label	liked_count	view_count	cmt_count	is_preferred_plus_seller	show_free_shipping	images	video_info_list	historical_sold
2429	[LIMITED+FULLBOX] #AMMY - Giày Nam DIOR Cao Cấp - GIÀY GUCCI thời trang Nam Sneaker-Đế Bệt 2cm-Khử Mùi Hôi-Mẫu Độc Quyền	Hà Nội	1609156155	1609917402	761247	False	56%	False	6	False	5.0	7	0	0	0	0	None	None	29920000000	68000000000	29920000000	68000000000	29920000000	68000000000	None	13	84	7	False	False	9	0	1816
2429	[LIMITED+FULLBOX] #AMMY - Giày Nam Louis VuitonCao Cấp -GIÀY thời trang Nam Sneaker-Đế Bệt 2cm-Khử Mùi Hôi-Mẫu Độc Quyên	Hà Nội	1609467008	1609917402	450394	False	50%	False	6	False	5.0	6	0	0	0	0	None	None	33800000000	67600000000	33800000000	67600000000	33800000000	67600000000	None	5	18	6	False	False	6	1	569
2429	Dép Kẹp Xỏ Ngón Thời Trang Nam Mẫu Mới	TP. Hồ Chí Minh	1554801708	1609917402	55115694	False	10%	False	18	False	4.3333330000000005	2	0	1	0	0	None	None	19980000000	22200000000	19980000000	22200000000	19980000000	22200000000	None	4	41	3	False	True	9	0	6
2429	[LIMITED+FULLBOX] #AMMY - Giày Nam Versace Cao Cấp - #GIÀY thời trang Nam Sneaker-Đế Bệt 2cm-Khử Mùi Hôi-Mẫu Độc Quyền	Hà Nội	1609158644	1609917402	758758	False	56%	False	6	False	5.0	7	0	0	0	0	None	None	29920000000	68000000000	29920000000	68000000000	29920000000	68000000000	None	7	52	7	False	False	7	0	431
2429	Dép xỏ ngón thời trang nam màu xám - CVM007	Hà Nội	1556791105	1609917402	53126297	False	50%	False	5	False	5.0	1	0	0	0	0	None	None	9950000000	19900000000	9950000000	19900000000	9950000000	19900000000	None	1	0	1	False	False	8	0	1
2429	(CÓ 4 MÀU) Dép đế đúc thời trang nam Pulorrr sườn hình tam giác có 4 màu	Hà Nội	1591024340	1609917402	18893062	True	50%	False	36	False	5.0	2	0	0	0	0	None	None	3990000000	7980000000	4990000000	9980000000	3990000000	7980000000	None	0	55	2	False	False	9	0	7
2429	Giày Lười Canvas Thời Trang Nam	Nước ngoài	1592391270	1609917402	17526132	False	None	False	50	False	0.0	0	0	0	0	0	None	None	24150000000	-1	24150000000	-1	24150000000	0	None	1	11	0	False	True	9	0	1
2429	TẾT ff free Thời trang nam Giày đế bằng da Graffiti đầy màu sắc Trượt trên giày lái xe uy tín Uy Tín 2020 ! A232 1 m HOT	TP. Hồ Chí Minh	1609770633	1609917402	146769	False	None	False	12	False	0.0	0	0	0	0	0	None	None	18382400000	-1	18382400000	-1	18382400000	0	None	0	1	0	False	False	9	0	0
2429	Giày sneaker nam giày thể thao nam F35 (04 màu) giày chạy bộ nam giày thời trang nam	Hà Nội	1600137855	1609917402	9779547	False	47%	False	24	False	0.0	0	0	0	0	0	None	None	26500000000	50000000000	26500000000	50000000000	26500000000	50000000000	None	249	286	0	False	False	9	1	0
2429	Giày thể thao das thời trang nam màu xám HĐ101	Bình Dương	1557484979	1609917402	52432423	False	46%	False	4	False	0.0	0	0	0	0	0	None	None	18900000000	35000000000	18900000000	35000000000	18900000000	35000000000	None	27	1	0	False	True	5	0	1
2429	Giay da thời trang nam cao cấp cực đẹp	Hà Nội	1538836307	1609917402	71081095	False	49%	False	11	False	5.0	1	0	0	0	0	None	None	51000000000	99999900000	51000000000	99999900000	51000000000	99999900000	None	150	11	1	False	True	6	0	6
2429	Giày Sandal Đế Bằng Đục Lỗ Hai Cách Mang Thời Trang Nam Size 40-45	Nước ngoài	1598755658	1609917402	11161744	False	None	False	18	False	5.0	1	0	0	0	0	None	None	21260000000	-1	21260000000	-1	21260000000	0	None	0	59	1	False	False	9	0	7
2429	Tất chân thể thao thoáng khí thời trang nam	Nước ngoài	1548060169	1609917402	61857233	False	45%	False	5	False	0.0	0	0	0	0	0	None	None	3100000000	5600000000	3100000000	5600000000	3100000000	5600000000	None	1	2	0	False	True	9	0	3
2429	[Chính Hãng] Giày Adidas thời trang nam xám . 2020 new . :)) [ NEW 2020 ] new ✔️	TP. Hồ Chí Minh	1609123134	1609917402	794268	False	None	False	8	False	0.0	0	0	0	0	0	None	None	12343500000	-1	12343500000	-1	12343500000	0	None	0	0	0	False	False	5	0	0
2429	Giày sneaker nam giày thể thao nam A529 màu đen full giày chạy bộ giày ulzzang nam giày thời trang nam	Hà Nội	1599062816	1609917402	10854586	False	48%	False	9	False	0.0	0	0	0	0	0	None	None	25900000000	50000000000	25900000000	50000000000	25900000000	50000000000	None	1003	1074	0	False	True	6	1	1
2429	Giày tây nam lịch lãm GGDB2 ,giày thời trang nam chuyenmuasam96_store	Hà Nội	1540198284	1609917402	69719118	True	20%	False	6	False	5.0	1	0	0	0	0	None	None	7900000000	9900000000	7900000000	9900000000	7900000000	9900000000	None	3	13	1	False	True	5	1	5
2429	Giày sneaker nam giày thể thao nam D29 (04 màu) giày chạy bộ nam giày thời trang nam	Hà Nội	1599145076	1609917402	10772326	False	48%	False	36	False	5.0	1	0	0	0	0	None	None	26900000000	51500000000	26900000000	51500000000	26900000000	51500000000	None	1793	1906	1	False	True	9	1	103
2429	salle free Giày da thời trang nam phong cách lịch lãm uy tín Uy Tín 2020 ! A232 1 m HOT	Bình Dương	1609141642	1609917402	775760	False	30%	False	20	False	0.0	0	0	0	0	0	None	None	14498200000	20711700000	14498200000	20711700000	14498200000	20711700000	None	0	2	0	False	False	9	0	0
2429	[Rẻ Nhất] Dép Thời Trang Nam,Dép 3 Sọc Trắng-Đen Size 44 Size 45 Size 46 Size 47 Size 48	TP. Hồ Chí Minh	1586515783	1609917402	23401619	False	None	False	10	False	0.0	0	0	0	0	0	None	None	35000000000	-1	35000000000	-1	35000000000	0	None	1214	159	0	False	True	5	1	1
2429	Giày sneaker nam giày thể thao nam A529 màu xanh giày chạy bộ giày ulzzang nam giày thời trang nam	Hà Nội	1599062814	1609917402	10854588	False	48%	False	6	False	0.0	0	0	0	0	0	None	None	25900000000	50000000000	25900000000	50000000000	25900000000	50000000000	None	1048	1115	0	False	False	6	1	1
2429	GIÀY SNEAKER QP MS9 THỜI TRANG NAM  giày thể thao	Hà Nội	1542033864	1609917402	67883538	False	None	False	1	False	2.0	0	0	0	1	0	None	None	6000000000	-1	6000000000	-1	6000000000	0	None	3	0	1	False	True	4	1	5
2429	| Rẻ Nhất rồi | HOT Giày Nam Thể Thao Thời Trang Nam Phong Cách 2020 - GN92 New 2020 new new . . . ,	Lạng Sơn	1609148926	1609917402	768476	False	None	False	12	False	0.0	0	0	0	0	0	None	None	12447300000	-1	16367700000	-1	12447300000	0	None	0	5	0	False	False	9	0	0
2429	Giầy thể thao thời trang Nam(DSMH01300-ĐEN)	Hà Nội	1601964389	1609917402	7953013	False	5%	False	6	False	0.0	0	0	0	0	0	None	None	47405000000	49900000000	47405000000	49900000000	47405000000	49900000000	None	1	30	0	False	False	6	0	1
2429	Giày da lộn thời trang nam phong cách hàn quốc	Hà Nội	1576902548	1609917402	33014854	True	48%	False	18	False	5.0	1	0	0	0	0	None	None	9900000000	18900000000	9900000000	18900000000	9900000000	18900000000	None	3	34	1	False	True	8	0	4
2429	[LIMITED+FULLBOX] #AMMY - Giày Lười Nam D&G Cao Cấp - GIÀY thời trang Nam Sneaker - Đế Bệt 2cm-Khử Mùi Hôi-Mẫu Độc Quyền	Hà Nội	1609466762	1609917402	450640	False	50%	False	10	False	4.8333330000000005	5	1	0	0	0	None	None	32600000000	65200000000	32600000000	65200000000	32600000000	65200000000	None	4	12	6	False	False	6	1	519
2429	LV-NEW ⚡ [XẢ KHO] Giày Nam Thể Thao Thời Trang Nam bền đẹp giá rẻ [ĐEP CHUẨN ] 🔥 ✔️ : : : 🔥 XIÊU RẺ ' ,	Đà Nẵng	1609142221	1609917402	775181	False	None	False	3	False	0.0	0	0	0	0	0	None	None	11567100000	-1	11567100000	-1	11567100000	0	None	0	0	0	False	False	7	0	0
2429	Giày quai hậu thời trang nam thiết kế mạnh mẽ cá tính	Nước ngoài	1559630829	1609917402	50286573	False	10%	False	18	False	5.0	1	0	0	0	0	None	None	34740000000	38600000000	34740000000	38600000000	34740000000	38600000000	None	5	29	1	False	True	9	0	2
2429	giầy da thời trang nam giúp tăng chiều cao ( kèm ảnh thật )	Hà Nội	1529246373	1609917402	80671029	False	48%	False	14	False	4.625	7	0	0	1	0	None	None	46800000000	89999900000	46800000000	89999900000	46800000000	89999900000	None	276	159	8	False	True	7	1	19
2429	FALE SALE Giày sneaker thời trang nam cao cấp Verygood MS7 sbsx Có Sẵn ⚡ CHẤT sịn : new L	TP. Hồ Chí Minh	1609131053	1609917402	786349	False	20%	False	12	False	0.0	0	0	0	0	0	None	None	12255000000	15318700000	12255000000	15318700000	12255000000	15318700000	None	0	1	0	False	False	6	0	0
2429	Giày da thời trang nam phong cách thể thao lịch lãm . 2020 new	Hải Dương	1609162805	1609917402	754597	False	None	False	20	False	0.0	0	0	0	0	0	None	None	26400000000	-1	26400000000	-1	26400000000	0	None	0	1	0	False	False	9	0	0
2429	[freeship] Giầy Lười Da Nam Cao Cấp Thời Trang Nam	Hà Nội	1594951484	1609917402	14965918	False	None	False	1	False	0.0	0	0	0	0	0	None	None	232000000000	-1	232000000000	-1	232000000000	0	None	15	33	0	False	False	1	0	0
2429	[Siêu Sales] Giày Nam Cao Cổ Dây Xích Thời Trang Nam, Giày Cao Cổ Nam, Giày Nam	Hà Nội	1563908205	1609917402	46009197	False	None	False	12	False	0.0	0	0	0	0	0	None	None	27900000000	-1	27900000000	-1	27900000000	0	None	2081	8	0	False	True	9	0	1
2429	HOT Dép Nam😍Freeship đơn 150k HN💥Dép lê thời trang nam bản ngang Guci bản màu đen viền vàng cực teen 	Hà Nội	1577180460	1609917402	32736942	False	None	False	10	False	5.0	2	0	0	0	0	None	None	9900000000	-1	10900000000	-1	9900000000	0	None	0	56	2	False	False	8	0	2
2429	[LIMITED+FULLBOX] #AMMY - Giày Nam DIOR Cao Cấp - GIÀY GUCCI thời trang Nam Sneaker-Đế Bệt 2cm-Khử Mùi Hôi-Mẫu Độc Quyền	Hà Nội	1609155592	1609917402	761810	False	56%	False	6	False	5.0	7	0	0	0	0	None	None	29920000000	68000000000	29920000000	68000000000	29920000000	68000000000	None	10	74	7	False	False	8	1	1682
2429	Giày Lười Thời Trang Nam 2020	Hà Nội	1571284705	1609917402	38632697	True	46%	False	6	False	5.0	2	0	0	0	0	None	None	10500000000	19500000000	11500000000	19500000000	10500000000	19500000000	None	382	55	2	False	False	3	0	5
2429	GIÀY SNEAKER QP MS9 THỜI TRANG NAM - MÀU ĐEN	Hà Nội	1520828073	1609917402	89089329	True	None	False	5	False	3.0	1	0	0	0	1	None	None	3900000000	-1	3900000000	-1	3900000000	0	None	0	18	2	False	True	6	1	6
2429	Dép thời trang nam chữ NY phản quang 7 màu cực đẹp	Hà Nội	1596775472	1609917402	13141930	True	50%	False	6	False	5.0	1	0	0	0	0	None	None	9000000000	18000000000	10500000000	18000000000	9000000000	18000000000	None	3	219	1	False	False	6	1	5
2429	[FULLBOX+VIDEO] Giày Nam Dior Trắng Cao Cấp - Giày Thời Trang Nam - Mẫu Độc Quyền Số Lượng Có Hạn	Hà Nội	1608574000	1609917402	1343402	False	None	False	5	False	5.0	2	0	0	0	0	None	None	59900000000	-1	59900000000	-1	59900000000	0	None	7	103	2	False	False	5	0	1309
2429	Giày CX5 Thể Thao Thời Trang Nam Cao Cấp Hit Hot	Hà Nội	1562827600	1609917402	47089802	True	41%	False	5	False	5.0	1	0	0	0	0	None	None	9900000000	16700000000	9900000000	16700000000	9900000000	16700000000	None	16	6	1	False	True	6	1	1
2429	[FULLBOX+VIDEO]Giày Nam Hoạ Tiết Dior Trắng Cao Cấp - Giày Thời Trang Nam Đẹp - Mẫu Độc Quyền Số Lượng Có Hạn	Hà Nội	1608572982	1609917402	1344420	False	None	False	5	False	0.0	0	0	0	0	0	None	None	59900000000	-1	59900000000	-1	59900000000	0	None	6	30	0	False	False	5	1	510
2429	[FULLBOX+VIDEO] Giày Nam Dior Đen Cao Cấp - Giày Thời Trang Nam - Mẫu Độc Quyền Số Lượng Có Hạn	Hà Nội	1608573441	1609917402	1343961	False	None	False	5	False	5.0	2	0	0	0	0	None	None	59900000000	-1	59900000000	-1	59900000000	0	None	6	46	2	False	False	6	0	809
2429	Giày sneaker nam giày thể thao nam D529 màu xanh rêu giày chạy bộ nam giày thời trang nam	Hà Nội	1599144482	1609917402	10772920	False	48%	False	6	False	5.0	1	0	0	0	0	None	None	26900000000	51500000000	26900000000	51500000000	26900000000	51500000000	None	241	284	1	False	False	5	1	1
2429	salle Real Nhất Giày Adidas thời trang nam xám kẻo hết ) bán chạy . new . 2020 K .	TP. Hồ Chí Minh	1609143217	1609917402	774185	False	30%	False	8	False	0.0	0	0	0	0	0	None	None	12313000000	17590000000	12313000000	17590000000	12313000000	17590000000	None	0	1	0	False	False	5	0	0
2429	Giày Nam Thể Thao Thời Trang Nam bền đẹp giá rẻ	Hà Nam	1588912680	1609917402	21004722	False	43%	False	18	False	5.0	1	0	0	0	0	None	None	16000000000	28000000000	19000000000	28000000000	16000000000	28000000000	None	3871	38	1	False	False	9	0	4
2429	Giày Sneaker Da Thời Trang Nam Cao Cấp Cổ Cao 2 Màu Đẳng Cấp 2020 - GD170  - doremonoff	Hà Nội	1601911406	1609917402	8005996	False	None	False	12	False	0.0	0	0	0	0	0	None	None	93534000000	-1	93534000000	-1	93534000000	0	None	5	133	0	False	False	7	0	140
2429	Dép lê quai ngang thời trang nam siêu lưới LUOEUUU có 2 màu	Hà Nội	1589694675	1609917402	20222727	True	50%	False	10	False	4.9	9	1	0	0	0	None	None	4400000000	8800000000	9600000000	9600000000	4400000000	8800000000	None	4	55	10	False	False	8	0	22
2429	Giày Sneaker Thời Trang Nam 2 Màu Cao Cấp - GF278  - vippermark	Hà Nội	1601968028	1609917402	7949374	False	None	False	12	False	0.0	0	0	0	0	0	None	None	78700000000	-1	78700000000	-1	78700000000	0	None	0	72	0	False	False	7	0	98
2429	Giầy Tây Nam Cao Cấp Thời Trang Nam Giầy Nam	Hà Nội	1592127282	1609917402	17790120	False	None	False	1	False	0.0	0	0	0	0	0	None	None	230000000000	-1	230000000000	-1	230000000000	0	None	31	66	0	False	True	1	0	0
2429	Giày sneaker thời trang nam  Verygood  MS10  màu đen vrg1381	Hà Nội	1516675646	1609917402	93241756	False	None	False	10	False	2.0	1	0	0	0	3	None	None	8900000000	-1	8900000000	-1	8900000000	0	None	9	1	4	False	True	7	1	14
2429	Giày sneaker nam giày thể thao nam A529 màu đen full giày chạy bộ giày ulzzang nam giày thời trang nam	Hà Nội	1599047180	1609917402	10870222	True	48%	False	9	False	5.0	4	0	0	0	0	None	None	26900000000	52000000000	26900000000	52000000000	26900000000	52000000000	None	366	651	4	True	True	6	1	10
2429	Giày thể thao nam chữ M chất đẹp TT5104 , giày thời trang nam phong cách thể thao trẻ trung	Hà Nội	1546850528	1609917402	63066874	True	None	False	24	False	5.0	1	0	0	0	0	None	None	10900000000	-1	10900000000	-1	10900000000	0	None	3	12	1	False	True	9	1	3
2429	Giày sneaker thời trang nam cao cấp 1680 diệu shop	Hà Nội	1575603049	1609917402	34314353	True	34%	False	10	False	5.0	1	0	0	0	0	None	None	6900000000	10500000000	6900000000	10500000000	6900000000	10500000000	None	1	7	1	False	True	4	0	1
2429	⚡ SALE ⚡ DÉP THỜI TRANG NAM CHUỘT MICKEY [ XẢ KHO] hàng cao cấp	Hà Nội	1593165364	1609917402	16752038	False	13%	False	5	False	5.0	1	0	0	0	0	None	None	14000000000	16000000000	14000000000	16000000000	14000000000	16000000000	None	1905	57	1	False	False	5	0	2
2429	GIÀY SNEAKER THỜI TRANG NAM VERYGOOD MS9 QP - MÀU ĐEN 1381 MS9	Hà Nội	1517027878	1609917402	92889524	False	20%	False	6	False	5.0	11	0	0	0	0	None	None	3900000000	4900000000	3900000000	4900000000	3900000000	4900000000	None	16	51	11	False	True	4	0	29
2429	Giày Thể Thao Thời Trang Nam Đồng Giá 49k (khách chỉ được chọn size, màu shop tùy chọn gửi)	Lào Cai	1534436867	1609917402	75480535	False	None	False	6	False	4.255319	34	2	3	5	3	None	None	6900000000	-1	6900000000	-1	6900000000	0	None	2131	126	47	False	True	5	0	178
2429	Dép thời trang nam Đính đầu hổ PL cực hót	Hà Nội	1587405034	1609917402	22512368	True	50%	False	6	False	5.0	6	0	0	0	0	None	None	7500000000	15000000000	8800000000	15000000000	7500000000	15000000000	None	1257	233	6	False	False	8	1	10
2429	Cỡ lớn 38-48 Thời trang nam Giày sandal thoáng khí Chống nước ngoài trời đẹp trai	Nước ngoài	1594540281	1609917402	15377121	False	None	False	0	False	5.0	1	0	0	0	0	None	None	41400000000	-1	41400000000	-1	41400000000	0	None	0	65	1	False	False	9	0	2
2429	Giày sneaker thời trang nam cao cấp-MS7 - màu trắng	Hà Nội	1528788971	1609917402	81128431	True	None	False	6	False	2.0	0	0	0	1	0	None	None	5900000000	-1	5900000000	-1	5900000000	0	None	1	14	1	False	True	4	1	2
2429	Giày lười thời trang nam công sở da bò Rozalo R5139	Hà Nội	1553572639	1609917402	56344763	False	40%	False	18	True	4.736842	17	1	0	0	1	None	None	16900000000	28400000000	16900000000	28400000000	16900000000	28400000000	None	2929	499	19	False	True	9	0	40
2429	Giày sneaker thời trang nam cao cấp chữ M Verygood MS1 năng động	Hà Nội	1541730660	1609917402	68186742	False	45%	False	12	False	5.0	1	0	0	0	0	None	None	6900000000	12500000000	6900000000	12500000000	6900000000	12500000000	None	0	5	1	False	True	6	0	2
2429	Giày sneaker nam giày thể thao nam F12 (03 màu) giày ulzzang nam giày thời trang nam giày chạy bộ nam	Hà Nội	1586313623	1609917402	23603779	True	46%	False	18	False	4.857143	26	0	2	0	0	None	None	27900000000	52000000000	27900000000	52000000000	27900000000	52000000000	None	407	804	28	True	True	9	0	73
2429	Dép Hot Hit Thái Siêu Nhẹ Xỏ Ngón Thời Trang Nam DT11	Hà Nội	1573177266	1609917402	36740136	True	41%	False	30	False	5.0	1	0	0	0	0	None	None	2900000000	4900000000	2900000000	4900000000	2900000000	4900000000	None	1747	9	1	False	True	9	1	2
2429	Giay da thời trang nam cao cấp sang trọng	Hà Nội	1574950362	1609917402	34967040	False	49%	False	6	False	0.0	0	0	0	0	0	None	None	40800000000	80000000000	40800000000	80000000000	40800000000	80000000000	None	133	1	0	False	False	5	0	0
2429	Giày sneaker nam giày thể thao nam V06 (04 màu) giày ulzzang nam giày chạy bộ nam giày thời trang nam -fullbox	Hà Nội	1585566421	1609917402	24350981	False	46%	False	24	False	4.933333	14	1	0	0	0	None	None	26900000000	50000000000	26900000000	50000000000	26900000000	50000000000	None	1765	2493	15	False	True	9	0	22
2429	GIÀY DA THỜI TRANG NAM sunzin VL60 - Kiểu giày lười, giày mọi - chất liệu da cán mờ hoặc vân sần	Hà Nội	1524917439	1609917402	84999963	False	None	False	11	False	0.0	0	0	0	0	0	None	None	12000000000	-1	12000000000	-1	12000000000	0	None	10	4	0	False	True	8	0	5
2429	[Freeship] Giày Sneaker nam thể thao phong cách hàng đẹp và chất lượng - Phố Thời Trang Nam SNK11	TP. Hồ Chí Minh	1551501629	1609917402	58415773	False	50%	False	10	False	5.0	1	0	0	0	0	None	None	35000000000	70000000000	35000000000	70000000000	35000000000	70000000000	None	1737	0	1	False	True	9	1	1
2429	salle NEW 2021 Dép thời trang nam quai ngang Superstar phối màu nổi bật bắt mắt 🔥 ' :	TP. Hồ Chí Minh	1609147072	1609917402	770330	False	None	False	15	False	0.0	0	0	0	0	0	None	None	13462200000	-1	13462200000	-1	13462200000	0	None	0	1	0	False	False	9	0	0
2429	Dép Thời Trang Nam Cao Cấp	TP. Hồ Chí Minh	1580704914	1609917402	29212488	False	14%	False	10	False	5.0	1	0	0	0	0	None	None	6880000000	8000000000	6880000000	8000000000	6880000000	8000000000	None	0	9	1	False	False	5	0	1
2429	Giày Sandal Da Thoáng Khí Thời Trang Nam	Nước ngoài	1590917167	1609917402	19000235	False	None	False	0	False	0.0	0	0	0	0	0	None	None	31400000000	-1	31400000000	-1	31400000000	0	None	0	8	0	False	False	9	0	1
2429	Dép Lê Xỏ Ngón Thời Trang Nam Creeks	TP. Hồ Chí Minh	1554794263	1609917402	55123139	False	15%	False	18	False	0.0	0	0	0	0	0	None	None	21675000000	25500000000	21675000000	25500000000	21675000000	25500000000	None	3	6	0	False	True	9	0	2
2429	Giày Lười Da Bò Thời Trang Nam SODOHA SDH55B66NX Nâu Xám	Hà Nội	1562407007	1609917402	47510395	False	50%	False	6	True	0.0	0	0	0	0	0	None	None	19500000000	39000000000	19500000000	39000000000	19500000000	39000000000	None	5	41	0	False	False	9	0	3
2429	Giày sneaker thời trang nam cao cấp - MS7, giày dép nam - CMS	Hà Nội	1553223854	1609917402	56693548	True	40%	False	12	False	4.0	1	0	1	0	0	None	None	5900000000	9900000000	5900000000	9900000000	5900000000	9900000000	None	3	9	2	False	True	6	0	3
2429	[ GIÁ SẬP SÀN ] Giày Thể Thao Thời Trang Nam Dây Buộc Đế Cao Su Siêu Êm - Màu Xanh Navy SV40	Hà Nội	1545925382	1609917402	63992020	True	23%	False	8	False	3.666667	1	0	2	0	0	None	None	4400000000	4400000000	16900000000	21900000000	4400000000	4400000000	None	1562	22	3	False	True	9	0	3
2429	Giày sneaker thời trang nam cao cấp - MS10	Hà Nội	1516931581	1609917402	92985821	True	None	False	15	False	3.0	1	0	0	0	1	None	None	6900000000	-1	6900000000	-1	6900000000	0	None	3	6	3	False	True	8	0	6
2429	Giày Canvas Thể Thao Thời Trang Nam	Nước ngoài	1572410684	1609917402	37506718	False	41%	False	24	False	0.0	0	0	0	0	0	None	None	20380000000	34040000000	24000000000	40650000000	20380000000	34040000000	None	0	1	0	False	False	9	0	1
2429	[FULLBOX+VIDEO] Giày Nam Dior Đen Cao Cấp - Giày Thời Trang Nam - Mẫu Độc Quyền Số Lượng Có Hạn	Hà Nội	1609300395	1609917402	617007	False	None	False	6	False	0.0	0	0	0	0	0	None	None	59900000000	-1	59900000000	-1	59900000000	0	None	1	0	0	False	False	6	0	0
2429	Giày Lười Thời Trang Nam SODOHA SDH0001	Hà Nội	1561602146	1609917402	48315256	False	50%	False	6	True	5.0	1	0	0	0	0	None	None	14900000000	29800000000	14900000000	29800000000	14900000000	29800000000	None	4	37	1	False	False	7	0	3
2429	Dép Quai Ngang Đen Thời Trang Nam QN01	Hà Nội	1562990812	1609917402	46926590	True	40%	False	7	False	5.0	4	0	0	0	0	None	None	3900000000	6500000000	3900000000	6500000000	3900000000	6500000000	None	1979	59	4	False	True	9	1	10
2429	Giày Nam Thể Thao Thời Trang Nam bền đẹp giá rẻ	Hà Nam	1588997436	1609917402	20919966	False	32%	False	5	False	5.0	1	0	0	0	0	None	None	15000000000	22000000000	15000000000	22000000000	15000000000	22000000000	None	3874	23	1	False	False	6	0	2
2429	[FREESHIP+FULLBOX] Giày lười vải thời trang nam khâu sườn có 2 màu siêu bền	Hà Nội	1593003744	1609917402	16913658	True	50%	False	10	False	5.0	2	0	0	0	0	None	None	8800000000	17600000000	10800000000	21600000000	8800000000	17600000000	None	0	79	2	False	False	9	0	6
2429	Giày sneaker thời trang nam cao cấp - GTTB13 - Giày thể thao	Hà Nội	1558336092	1609917402	51581310	False	48%	False	10	False	5.0	5	0	0	0	0	None	None	5900000000	11300000000	5900000000	11300000000	5900000000	11300000000	None	4	76	5	False	True	8	1	10
2429	GIÀY LUỜI THỜI TRANG NAM CÔNG SỞ GL-D61	Hà Nội	1578270400	1609917402	31647002	False	50%	False	8	False	4.3333330000000005	5	0	0	0	1	None	None	17500000000	35000000000	17500000000	35000000000	17500000000	35000000000	None	5	39	6	False	False	9	1	17
2429	Giày Sneaker Thời Trang Nam SACAS SC047	TP. Hồ Chí Minh	1536830008	1609917402	73087394	False	44%	False	15	True	0.0	0	0	0	0	0	None	None	13900000000	25000000000	13900000000	25000000000	13900000000	25000000000	None	3	23	0	False	True	8	0	4
2429	Sale - Hàng nhập khẩu  Giày Nam Thể Thao Thời Trang Nam Phong Cách 2020 - GN92 Liên hệ mua hàng 084.209.1989 ,	Hà Nam	1609141502	1609917402	775900	False	None	False	18	False	0.0	0	0	0	0	0	None	None	45060200000	-1	48410200000	-1	45060200000	0	None	0	1	0	False	False	9	0	0
2429	Giày Nam Thể Thao Thời Trang Nam Phong Cách 2020 TRT-GTTN-61	Hà Nội	1598957624	1609917402	10959778	True	36%	False	12	False	4.928571	13	1	0	0	0	None	None	15900000000	20000000000	20000000000	25000000000	15900000000	20000000000	None	15	1566	14	False	True	9	0	50
2429	Giày Boot Cổ Cao Thời Trang Nam	Nước ngoài	1609142030	1609917402	775372	False	None	False	18	False	0.0	0	0	0	0	0	None	None	22600300000	-1	22600300000	-1	22600300000	0	None	1	0	0	False	False	9	0	0
2429	VGT-Giày DA THỜI TRANG NAM  VL175 MÀU TRẮNG - Kiểu Giày lười, Giày mọi - chất liệu da cán mờ	Hà Nội	1551941108	1609917402	57976294	False	None	False	1	False	5.0	1	0	0	0	0	None	None	15421700000	-1	15421700000	-1	15421700000	0	None	0	23	1	False	False	8	0	2
2429	DÉP KẸP ĐÚC THỜI TRANG NAM CAO CẤP	TP. Hồ Chí Minh	1560057451	1609917402	49859951	False	None	False	12	False	5.0	1	0	0	0	0	None	None	18500000000	-1	18500000000	-1	18500000000	0	None	2	7	1	False	False	9	0	2
2429	Dép thời trang nam đính đầu hổ vàng cực chất	Hà Nội	1598539149	1609917402	11378253	True	38%	False	6	False	5.0	1	0	0	0	0	None	None	9200000000	14800000000	9900000000	14800000000	9200000000	14800000000	None	2108	28	1	False	False	8	0	1
2429	Dép da thời trang nam xịn - Dép quai ngang nam da bò da sáp cao cấp S2	TP. Hồ Chí Minh	1596358398	1609917402	13559004	False	None	False	5	False	0.0	0	0	0	0	0	None	None	30000000000	-1	30000000000	-1	30000000000	0	None	146	37	0	False	False	9	0	0
2429	Giày Sneaker Sup thời trang nam mẫu mới đế siêu bền	Hà Nội	1576233071	1609917402	33684331	True	30%	False	8	False	5.0	2	0	0	0	0	None	None	6900000000	9900000000	6900000000	9900000000	6900000000	9900000000	None	19	9	2	False	False	9	1	2
2429	Giày cổ cao thời trang nam TARANTO TRT-GBN-03-DT (Màu đen trắng)	Hà Nội	1537429365	1609917402	72488037	True	46%	False	4	False	0.0	0	0	0	0	0	None	None	14742000000	27300000000	14742000000	27300000000	14742000000	27300000000	None	13	8	0	False	True	5	0	5
2429	Giày thời trang nam fashion size 42eu =43 vn	Hà Nội	1551803492	1609917402	58113910	False	None	False	3	False	5.0	1	0	0	0	0	None	None	20000000000	-1	30000000000	-1	20000000000	0	None	2	3	1	False	False	1	0	1
2429	[FREESHIP] Giày sneaker nam giày thể thao nam V06 (04 màu) giày ulzzang nam giày chạy bộ nam giày thời trang nam	Hà Nội	1608978210	1609917402	939192	False	50%	False	24	False	0.0	0	0	0	0	0	None	None	32500000000	65000000000	32500000000	65000000000	32500000000	65000000000	None	183	239	0	False	False	9	0	0
