category_id	name	shop_location	item_public_time	item_be_got_time	sell_time	shopee_verified	discount	is_adult	options	show_official_shop_label_in_title	rating_star	five_star	four_star	three_star	two_star	one_star	flash_sale	upcoming_flash_sale	price_min	price_min_before_discount	price_max	price_max_before_discount	price	price_before_discount	coin_earn_label	liked_count	view_count	cmt_count	is_preferred_plus_seller	show_free_shipping	images	video_info_list	historical_sold
2429	salle <3 [Chính Hãng] Giày Adidas thời trang nam xám <3 . . 2020 K .	TP. Hồ Chí Minh	1609143201	1609917402	774201	False	30%	False	8	False	0.0	0	0	0	0	0	None	None	12581500000	17973500000	12581500000	17973500000	12581500000	17973500000	None	0	0	0	False	False	5	0	0
2429	12-12 giảm sâu Giày sneaker nam giày thể thao nam A529 màu đen cam giày chạy bộ giày ulzzang nam giày thời trang nam	Hà Nội	1609169792	1609917402	747610	False	None	False	6	False	0.0	0	0	0	0	0	None	None	16800000000	-1	16800000000	-1	16800000000	0	None	0	0	0	False	False	8	0	0
2429	Giày sneaker nam giày thể thao nam D529 màu ghi xám giày chạy bộ nam giày thời trang nam	Hà Nội	1609041589	1609917402	875813	False	50%	False	6	False	0.0	0	0	0	0	0	None	None	32500000000	65000000000	32500000000	65000000000	32500000000	65000000000	None	80	109	0	False	False	5	0	0
2429	SALLE [ Sales 11-11] Giày Thể Thao Thời Trang Nam _N01 Xịn Xò new new new . 2020 K . 11.11	TP. Hồ Chí Minh	1609133646	1609917402	783756	False	None	False	9	False	0.0	0	0	0	0	0	None	None	16526600000	-1	16526600000	-1	16526600000	0	None	0	0	0	False	False	5	0	0
2429	Giày sandal họa tiết ca rô thời trang nam 2019	Nước ngoài	1570376266	1609917402	39541136	False	None	False	30	False	0.0	0	0	0	0	0	None	None	37900000000	-1	37900000000	-1	37900000000	0	None	0	0	0	False	False	8	0	1
2429	Giày Sneaker Thời Trang Nam Cao Cấp - F5	Hà Nội	1556105052	1609917402	53812350	True	43%	False	15	False	5.0	1	0	0	0	0	None	None	16900000000	29900000000	16900000000	29900000000	16900000000	29900000000	None	3009	0	1	False	False	9	0	1
2429	[SIÊU SALE] Giày sneaker nam giày thể thao nam F35 (04 màu) giày chạy bộ nam giày thời trang nam	Hà Nội	1609000301	1609917402	917101	False	50%	False	24	False	0.0	0	0	0	0	0	None	None	32500000000	65000000000	32500000000	65000000000	32500000000	65000000000	None	101	118	0	False	False	9	0	0
2429	[ Xả kho ] GIÀY THỜI TRANG NAM THIẾT KẾ GIỚI HẠN T2202TR TINTO	TP. Hồ Chí Minh	1532404103	1609917402	77513299	False	None	False	5	False	3.0	1	0	0	0	1	None	None	18000000000	-1	18000000000	-1	18000000000	0	None	3	0	2	False	True	7	0	2
2429	[Đỉnh Cao] Giày Nam Thể Thao Thời Trang Nam Phong Cách 2020 - GN92 TỐT . . 🎁 .. new 👟 . . HOT ; ₁	TP. Hồ Chí Minh	1609210043	1609917402	707359	False	None	False	12	False	0.0	0	0	0	0	0	None	None	12433600000	-1	12897300000	-1	12433600000	0	None	0	0	0	False	False	9	0	0
2429	GIÀY NAM TƯƠI TẮN mã C014 Giày Nam ĐI BỘ - Giày Nam ĐI HỌC Giày THỜI TRANG nam	TP. Hồ Chí Minh	1562090139	1609917402	47827263	False	39%	False	12	False	0.0	0	0	0	0	0	None	None	22000000000	36000000000	22000000000	36000000000	22000000000	36000000000	None	15500	3	0	False	False	8	0	2
2429	Giày sneaker thời trang nam cao cấp-GTTB14	Hà Nội	1558280189	1609917402	51637213	False	None	False	10	False	5.0	1	0	0	0	0	None	None	10500000000	-1	10500000000	-1	10500000000	0	None	0	0	1	False	True	9	0	1
2429	Thời trang nam Top Sneaker đi bộ Giày thông thường Phong cách đường phố Dây kéo trẻ	Nước ngoài	1585652141	1609917402	24265261	False	None	False	20	False	5.0	1	0	0	0	0	None	None	35700000000	-1	35700000000	-1	35700000000	0	None	0	1	1	False	False	9	0	1
2429	[Chính Hãng] Giày Adidas thời trang nam xám . 2020 new . 2020 ️🥇 New new	Hà Nam	1609254775	1609917402	662627	False	None	False	8	False	0.0	0	0	0	0	0	None	None	13921600000	-1	13921600000	-1	13921600000	0	None	0	0	0	False	False	5	0	0
2429	12-12 giảm sâu Giày sneaker nam giày thể thao nam A529 màu ghi xám giày chạy bộ giày ulzzang nam giày thời trang nam	Hà Nội	1609169789	1609917402	747613	False	None	False	6	False	0.0	0	0	0	0	0	None	None	17020000000	-1	17020000000	-1	17020000000	0	None	0	0	0	False	False	6	0	0
2429	Giày thời trang nam-GT118	Hà Nội	1513332731	1609917402	96584671	False	None	False	1	False	0.0	0	0	0	0	0	None	None	25000000000	-1	25000000000	-1	25000000000	0	None	62	0	0	False	True	2	0	2
2429	SALE Giày sneaker thời trang nam cao cấp chữ M Verygood MS1 Có Sẵn ⚡ CHẤT sịn : new L '	TP. Hồ Chí Minh	1609564626	1609917402	352776	False	None	False	12	False	0.0	0	0	0	0	0	None	None	6570400000	-1	6570400000	-1	6570400000	0	None	0	0	0	False	False	8	0	0
2429	FALE SALE Giày thể thao thời trang nam đế cao su Rozalo RM52322 Có Sẵn ⚡ CHẤT sịn : new L	TP. Hồ Chí Minh	1609130264	1609917402	787138	False	20%	False	12	False	0.0	0	0	0	0	0	None	None	13780400000	17225400000	13780400000	17225400000	13780400000	17225400000	None	0	0	0	False	False	9	0	0
2429	Giày sneaker nam giày thể thao nam D529 màu đen full giày chạy bộ nam giày thời trang nam	Hà Nội	1609042650	1609917402	874752	False	None	False	9	False	0.0	0	0	0	0	0	None	None	65000000000	-1	65000000000	-1	65000000000	0	None	81	107	0	False	False	5	0	0
2429	Giày sneaker thời trang nam cao cấp, MS3	Hà Nội	1576482987	1609917402	33434415	True	26%	False	25	False	5.0	1	0	0	0	0	None	None	5900000000	8000000000	5900000000	8000000000	5900000000	8000000000	None	1	9	1	False	True	3	0	1
2429	(2 Màu) Dép Thời Trang Nam NY Cao Su Cao Cấp ms2020 cực rẻ	Hà Nội	1583246059	1609917402	26671343	False	34%	False	12	False	0.0	0	0	0	0	0	None	None	9900000000	15000000000	10900000000	15000000000	9900000000	15000000000	None	4	8	0	False	False	9	0	2
2429	sale Giày Thể Thao Thời Trang Nam _N01 Xịn Xò new new new . 2020 K . : : : :	Bình Dương	1609122949	1609917402	794453	False	None	False	9	False	0.0	0	0	0	0	0	None	None	20943200000	-1	20943200000	-1	20943200000	0	None	0	0	0	False	False	5	0	0
2429	salle 𝐑Ẻ 𝐍𝐇Ấ𝐓 [Chính Hãng] Giày Adidas thời trang nam xám . 2020 new . 2020 ️🥇 . NEW [ CHUẨN CHẤT ]	TP. Hồ Chí Minh	1609157919	1609917402	759483	False	None	False	8	False	0.0	0	0	0	0	0	None	None	22216000000	-1	22216000000	-1	22216000000	0	None	0	0	0	False	False	5	0	0
2429	Giày Sneaker nam - Giày thời trang nam . . 2020 new	Hải Dương	1609162284	1609917402	755118	False	None	False	8	False	0.0	0	0	0	0	0	None	None	27360000000	-1	27360000000	-1	27360000000	0	None	0	0	0	False	False	6	0	0
2429	FALE SALE Giày sneaker thời trang nam cao cấp - GTTB14 Có Sẵn ⚡ CHẤT sịn : new L	TP. Hồ Chí Minh	1609131133	1609917402	786269	False	20%	False	10	False	0.0	0	0	0	0	0	None	None	12455700000	15569600000	12455700000	15569600000	12455700000	15569600000	None	0	0	0	False	False	9	0	0
2429	Giày thể thao thời trang nam màu trắng T112	Bình Dương	1565081491	1609917402	44835911	False	50%	False	9	False	5.0	1	0	0	0	0	None	None	17500000000	35000000000	17500000000	35000000000	17500000000	35000000000	None	8	1	1	False	False	6	0	1
2429	Giày sneaker thời trang nam cao cấp Verygood- MS1- chữ M - CMS	Hà Nội	1557456769	1609917402	52460633	True	45%	False	6	False	3.0	1	0	0	0	1	None	None	6900000000	12500000000	6900000000	12500000000	6900000000	12500000000	None	1	7	2	False	True	6	0	2
2429	[freeship] Giầy Thể Thao Nam Cao Cấp Thời Trang Nam Giầy Nam	Hà Nội	1594952516	1609917402	14964886	False	None	False	1	False	0.0	0	0	0	0	0	None	None	182000000000	-1	182000000000	-1	182000000000	0	None	13	20	0	False	False	1	0	0
2429	[Đỉnh Cao] Giày Nam Thể Thao Thời Trang Nam Phong Cách 2020 - GN92 TỐT . . 2020 new	Hải Phòng	1609157410	1609917402	759992	False	None	False	12	False	0.0	0	0	0	0	0	None	None	11225600000	-1	12704300000	-1	11225600000	0	None	0	0	0	False	False	9	0	0
2429	giày canvas thể thao thời trang nam	Nước ngoài	1570128174	1609917402	39789228	False	2%	False	24	False	5.0	1	0	0	0	0	None	None	27350000000	28050000000	27350000000	28050000000	27350000000	28050000000	None	4	1	1	False	False	9	0	1
2429	Giày sneaker thời trang nam cao cấp chữ M Verygood MS1 TT&GĐ	Hà Nội	1574673187	1609917402	35244215	True	50%	False	5	False	0.0	0	0	0	0	0	None	None	7250000000	14500000000	7250000000	14500000000	7250000000	14500000000	None	1	10	0	False	False	8	0	0
2429	Giày sneaker, Giày sneaker nam, Giày thể thao thời trang nam 2019 mã M20. Khuyến mãi giảm 50%	Hưng Yên	1567135050	1609917402	42782352	False	50%	False	6	False	0.0	0	0	0	0	0	None	None	12900000000	25800000000	12900000000	25800000000	12900000000	25800000000	None	0	12	0	False	False	6	0	2
2429	Giày sneaker nam giày thể thao nam D529 màu đen full giày chạy bộ nam giày thời trang nam	Hà Nội	1609005521	1609917402	911881	False	50%	False	9	False	0.0	0	0	0	0	0	None	None	32500000000	65000000000	32500000000	65000000000	32500000000	65000000000	None	81	104	0	False	False	5	0	0
2429	SALLE [XẢ KHO] Giày thể thao nam 2018, Thời trang nam, Giày da màu trắng đen 030 ! ✔️ [ NEW ] . rẻ HOT :	Bình Dương	1609138172	1609917402	779230	False	30%	False	18	False	0.0	0	0	0	0	0	None	None	12497100000	17852900000	12497100000	17852900000	12497100000	17852900000	None	0	0	0	False	False	8	0	0
2429	Giày thể thao thời trang nam màu đen T119	Bình Dương	1578387632	1609917402	31529770	False	41%	False	8	False	5.0	1	0	0	0	0	None	None	20500000000	35000000000	20500000000	35000000000	20500000000	35000000000	None	6	0	1	False	False	4	0	1
2429	Giầy Tây Nam Cao Cấp Giầy Lười Nam Thời Trang Nam	Hà Nội	1592044512	1609917402	17872890	False	None	False	1	False	0.0	0	0	0	0	0	None	None	230000000000	-1	230000000000	-1	230000000000	0	None	16	0	0	False	False	1	0	0
2429	Giày Thể Thao Sneaker BT83 Thời Trang Nam	Hà Nội	1562828776	1609917402	47088626	True	41%	False	5	False	5.0	1	0	0	0	0	None	None	9900000000	16700000000	9900000000	16700000000	9900000000	16700000000	None	16	4	1	False	False	6	1	1
2429	DÉP BÁNH MÌ THỜI TRANG NAM YZ SLIDE. SIÊU NHẸ VÀ BỀN. HÀNG CHẤT LƯỢNG.	Bình Dương	1604418430	1609917402	5498972	False	10%	False	28	False	4.933333	14	1	0	0	0	None	None	8010000000	8900000000	12060000000	13400000000	8010000000	8900000000	None	17	1537	15	False	False	3	0	29
2429	Giày Da Nam - FREESHIP - Giày Thời Trang Nam Cá Tính Chất Chơi GD44	Hà Nội	1608695229	1609917402	1222173	False	None	False	15	False	0.0	0	0	0	0	0	None	None	34000000000	-1	34000000000	-1	34000000000	0	None	1073	0	0	False	False	4	0	0
2429	⚡ SALE SỐC ⚡ DÉP THỜI TRANG NAM VERSACE MẶT QUỶ [ CHUYÊN SỈ\] hàng cao cấp	Hà Nội	1592387300	1609917402	17530102	False	19%	False	5	False	4.8333330000000005	5	1	0	0	0	None	None	14500000000	18000000000	14500000000	18000000000	14500000000	18000000000	None	3	125	6	False	False	5	0	61
2429	| Rẻ Nhất rồi | HOT Giày Nam Thể Thao Thời Trang Nam Phong Cách 2020 - GN92 New 2020 👟 2020 👟 2020 . NEW NEW NEW 2020	Hải Dương	1609162778	1609917402	754624	False	None	False	12	False	0.0	0	0	0	0	0	None	None	15420000000	-1	19820000000	-1	15420000000	0	None	0	0	0	False	False	9	0	0
2429	Giày thể thao thoáng khí thời trang nam chống trượt kiểu Hàn Quốc trẻ trung	Nước ngoài	1605497501	1609917402	4419901	False	50%	False	50	False	4.8333330000000005	10	2	0	0	0	None	None	19900000000	39800000000	19900000000	39800000000	19900000000	39800000000	None	28	1501	12	False	False	9	0	30
2429	[Đỉnh Cao] Giày Nam Thể Thao Thời Trang Nam Phong Cách 2020 - GN92 TỐT . . 2020 new .	Ninh Bình	1609578953	1609917402	338449	False	None	False	12	False	0.0	0	0	0	0	0	None	None	10915600000	-1	12394300000	-1	10915600000	0	None	0	1	0	False	False	9	0	0
2429	Giày Da Thật Thời Trang Nam Cao Cấp Siêu Đẹp - GD1330  - vippermark	Hà Nội	1601967980	1609917402	7949422	False	None	False	6	False	0.0	0	0	0	0	0	None	None	103300000000	-1	103300000000	-1	103300000000	0	None	1	69	0	False	False	4	0	103
2429	Giày thời trang nam 360 BOUTIQUE Sneaker trẻ trung, phong cách - 4W20GIACN107	Hà Nội	1600922698	1609917402	8994704	False	None	False	10	True	5.0	4	0	0	0	0	None	None	62000000000	-1	62000000000	-1	62000000000	0	None	52	3171	4	False	False	8	0	6
2429	[FREESHIP] Giày dép SANDAL quai hậu kiểu dáng thời trang nam, đế cao su bền đẹp cực kỳ êm chân	TP. Hồ Chí Minh	1587803997	1609917402	22113405	False	15%	False	6	False	4.764705999999999	14	2	1	0	0	None	None	18200000000	21500000000	18200000000	21500000000	18200000000	21500000000	None	4	318	17	False	False	5	0	29
2429	12-12 giảm sâu Giày sneaker nam giày thể thao nam F12 (03 màu) giày ulzzang nam giày thời trang nam giày chạy bộ nam	Hà Nội	1609169786	1609917402	747616	False	None	False	18	False	0.0	0	0	0	0	0	None	None	17570000000	-1	17570000000	-1	17570000000	0	None	0	0	0	False	False	9	0	0
2429	SALLE [XẢ KHO] Giày thể thao nam 2018, Thời trang nam, Giày da màu trắng đen 030 ! ✔️ [ NEW ] . rẻ HOT	TP. Hồ Chí Minh	1609135312	1609917402	782090	False	30%	False	18	False	0.0	0	0	0	0	0	None	None	14020000000	20028500000	14020000000	20028500000	14020000000	20028500000	None	0	0	0	False	False	8	0	0
2429	Giày Thể Thao Nike Thời Trang Nam NIKE HAKATA PREM Brandoutletvn AQ9335-002	TP. Hồ Chí Minh	1604239962	1609917402	5677440	False	None	False	1	True	5.0	1	0	0	0	0	None	None	246900000000	-1	246900000000	-1	246900000000	0	None	0	293	1	False	False	6	1	1
2429	FALE <3 [Chính Hãng] Giày Adidas thời trang nam xám <3 . . 2020 K . : : :	TP. Hồ Chí Minh	1609129303	1609917402	788099	False	30%	False	8	False	0.0	0	0	0	0	0	None	None	15209700000	21728100000	15209700000	21728100000	15209700000	21728100000	None	0	0	0	False	False	5	0	0
2429	Dép xỏ ngón thời trang nam kiểu dáng trẻ trung thời trang hè 2019	Nước ngoài	1563184715	1609917402	46732687	False	None	False	80	False	5.0	4	0	0	0	0	None	None	26600000000	-1	29500000000	-1	26600000000	0	None	4	30	4	False	False	3	0	5
2429	Sục nam😍Freeship đơn 150k💥giầy sục thời trang nam, mặt sói xanh, mèo xanh cực đẹp	Hà Nội	1563983377	1609917402	45934025	False	None	False	10	False	4.884615	23	3	0	0	0	None	None	10900000000	-1	10900000000	-1	10900000000	0	None	221	119	26	False	False	8	0	70
2429	sale NEW- Chất -  [Số 1] Giày thể thao da lộn thời trang nam chính hãng Noblesse - TYTT01A . RẺ VÔ ĐỊCH XCv ' ,	Hà Nội	1609140631	1609917402	776771	False	None	False	5	False	0.0	0	0	0	0	0	None	None	18899300000	-1	18899300000	-1	18899300000	0	None	0	0	0	False	False	7	0	0
2429	GIÀY SNEAKER THỜI TRANG NAM VERYGOOD 1381 MÀU ĐEN MS9	Hà Nội	1524195105	1609917402	85722297	True	50%	False	5	False	4.25	3	0	0	1	0	None	None	4000000000	8000000000	4000000000	8000000000	4000000000	8000000000	None	6	30	4	False	True	6	1	9
2429	Giày Lười Thể Thao Thời Trang Nam BT 06 (Đen)	Hà Nội	1519701785	1609917402	90215617	True	40%	False	5	False	4.759258999999999	47	4	1	1	1	None	None	7900000000	13200000000	7900000000	13200000000	7900000000	13200000000	None	2650	33	54	False	True	7	0	135
2429	FALE sale <3 [Chính Hãng] Giày Adidas thời trang nam xám <3 . . 2020 K . : : :	TP. Hồ Chí Minh	1609129238	1609917402	788164	False	30%	False	8	False	0.0	0	0	0	0	0	None	None	14846800000	21209700000	14846800000	21209700000	14846800000	21209700000	None	0	0	0	False	False	5	0	0
2429	Giày Thể Thao Thời Trang Nam, Giày Nam Cột Dây 037	Lào Cai	1534928840	1609917402	74988562	False	40%	False	12	False	4.6666669999999995	10	1	0	1	0	None	None	11900000000	19800000000	11900000000	19800000000	11900000000	19800000000	None	1063	54	12	False	True	9	1	26
2429	Giày Thể Thao Thoáng Khí Chống Nước Thời Trang Nam	Nước ngoài	1593577051	1609917402	16340351	False	40%	False	21	False	5.0	2	0	0	0	0	None	None	27400000000	45758000000	29300000000	48931000000	27400000000	45758000000	None	1	7	2	False	True	7	0	2
2429	Giày thể thao da trắng thời trang Nam, Giày Sneakers Nam, mẫu hot năm 2019	Hà Nội	1567151146	1609917402	42766256	True	40%	False	12	False	4.79661	51	6	1	0	1	None	None	13900000000	23000000000	13900000000	23000000000	13900000000	23000000000	None	376	65	59	False	False	8	0	145
2429	Giày Thể Thao Nike Thời Trang Nam ADU NIKE SB CHECK SOLAR Brandoutlet 843896-017	TP. Hồ Chí Minh	1604249938	1609917402	5667464	False	None	False	1	True	5.0	1	0	0	0	0	None	None	176900000000	-1	176900000000	-1	176900000000	0	None	4	1022	1	False	False	6	1	2
2429	Giày Nam Thể Thao Thời Trang Nam	Hà Nam	1555349377	1609917402	54568025	False	36%	False	18	False	4.857143	33	1	0	0	1	None	None	16000000000	25000000000	19000000000	25000000000	16000000000	25000000000	None	5274	600	35	False	True	9	0	100
2429	Giày slipon thời trang  nam	TP. Hồ Chí Minh	1515085623	1609917402	94831779	True	None	False	10	False	0.0	0	0	0	0	0	None	None	19990000000	-1	19990000000	-1	19990000000	0	None	1	12	0	False	True	9	0	3
2429	Giày thời trang nam giày công sở	Nước ngoài	1569047994	1609917402	40869408	False	44%	False	40	False	4.0	3	0	0	0	1	None	None	29840600000	53286800000	29840600000	53286800000	29840600000	53286800000	None	26	7	4	False	False	9	0	15
2429	Giày nam thể thao thời trang nam phong cách năng động	TP. Hồ Chí Minh	1534756491	1609917402	75160911	False	50%	False	12	False	4.8604650000000005	38	4	1	0	0	None	None	12500000000	25000000000	12500000000	25000000000	12500000000	25000000000	None	3900	84	43	False	True	9	0	105
2429	Giày Công Sở Nam - FREESHIP - Giày Thời Trang Nam Da Bò Búc Sáp Mạnh Mẽ Men Lỳ GVN01	Hà Nội	1607527954	1609917402	2389448	False	None	False	10	False	0.0	0	0	0	0	0	None	None	52000000000	-1	52000000000	-1	52000000000	0	None	0	38	0	False	False	4	0	40
2429	Giày sneaker thời trang nam cao cấp- Verygood-MS7	Hà Nội	1543389522	1609917402	66527880	True	41%	False	12	False	4.285714	5	0	1	1	0	None	None	5900000000	10000000000	5900000000	10000000000	5900000000	10000000000	None	15	9	7	False	True	5	1	20
2429	Rozalo RM8601-Giày thời trang nam thể thao chống thấm	Hà Nội	1543312206	1609917402	66605196	False	43%	False	12	True	4.391304	18	1	1	1	2	None	None	12900000000	22700000000	12900000000	22700000000	12900000000	22700000000	None	1707	133	23	False	True	9	0	54
2429	Giày Lười Thời Trang Nam 06	Hà Nội	1522228427	1609917402	87688975	True	49%	False	15	False	5.0	3	0	0	0	0	None	None	7900000000	15500000000	7900000000	15500000000	7900000000	15500000000	None	5966	0	3	False	True	9	1	6
2429	Giày sneaker thời trang nam cao cấp MS3 - đen pha đỏ      1347	Hà Nội	1541909722	1609917402	68007680	False	43%	False	25	False	5.0	2	0	0	0	0	None	None	5099900000	9000000000	5099900000	9000000000	5099900000	9000000000	None	4	8	2	False	True	8	0	3
2429	[Chính Hãng] Giày Adidas thời trang nam xám . 2020 new . , 2020 new 🌟 : 🛫 new ⚡	Hà Nội	1609124033	1609917402	793369	False	None	False	8	False	0.0	0	0	0	0	0	None	None	14610700000	-1	14610700000	-1	14610700000	0	None	0	0	0	False	False	5	0	0
2429	Giày sneaker thời trang nam - Verygood - MS10 - màu xanh -1381	Hà Nội	1516347224	1609917402	93570178	True	None	False	15	False	5.0	3	0	0	0	0	None	None	11000000000	-1	11000000000	-1	11000000000	0	None	22	4	7	False	True	9	0	21
2429	Giày thắt dây đen bóng thời trang nam MS1 (1257)	Hà Nội	1527039414	1609917402	82877988	False	None	False	6	False	4.3333330000000005	2	0	1	0	0	None	None	9800000000	-1	9800000000	-1	9800000000	0	None	4	0	3	False	True	7	0	10
2429	Giày sneaker thời trang nam cao cấp- Verygood- MS10	Hà Nội	1546844530	1609917402	63072872	True	42%	False	10	False	5.0	3	0	0	0	0	None	None	6900000000	11900000000	6900000000	11900000000	6900000000	11900000000	None	1	10	3	False	True	8	1	5
2429	Giày sneaker nam giày thể thao nam A529 màu ghi xám giày chạy bộ giày ulzzang nam giày thời trang nam	Hà Nội	1599046786	1609917402	10870616	True	48%	False	6	False	5.0	5	0	0	0	0	None	None	26900000000	52000000000	26900000000	52000000000	26900000000	52000000000	None	389	562	5	True	True	6	1	5
2429	Giày cao cổ da lộn đế độn cao thời trang, Thời trang nam mới dể phối đồ T593	Đà Nẵng	1590585405	1609917402	19331997	False	None	False	4	False	0.0	0	0	0	0	0	None	None	40900000000	-1	40900000000	-1	40900000000	0	None	1	7	0	False	False	5	0	0
2429	Giày sneaker thời trang nam Verygood MS10	Hà Nội	1516410645	1609917402	93506757	True	43%	False	12	False	3.666667	5	1	0	1	2	None	None	6900000000	12000000000	6900000000	12000000000	6900000000	12000000000	None	18	29	10	False	True	9	1	50
2429	Giày Nam Thể Thao Thời Trang Nam bền đẹp giá rẻ	Hà Nam	1554696386	1609917402	55221016	False	None	False	18	False	4.777778	24	2	0	0	1	None	None	23000000000	-1	23000000000	-1	23000000000	0	None	5135	83	27	False	True	8	0	52
2429	Giày thể thao thời trang nam màu trắng HĐ112	Bình Dương	1557479551	1609917402	52437851	False	46%	False	9	False	5.0	2	0	0	0	0	None	None	18900000000	35000000000	18900000000	35000000000	18900000000	35000000000	None	30	71	2	False	True	3	0	7
2429	Giày sneaker nam giày thể thao nam A529 màu xanh giày chạy bộ giày ulzzang nam giày thời trang nam	Hà Nội	1599046537	1609917402	10870865	True	48%	False	6	False	5.0	3	0	0	0	0	None	None	26900000000	52000000000	26900000000	52000000000	26900000000	52000000000	None	361	483	3	True	False	6	1	4
2429	Giày sneaker thời trang nam SACAS SC061	TP. Hồ Chí Minh	1541489205	1609917402	68428197	False	43%	False	10	True	3.5	2	0	1	0	1	None	None	19900000000	35000000000	19900000000	35000000000	19900000000	35000000000	None	1	40	4	False	True	8	0	10
2429	DPA  Sục nam😍Freeship đơn 150k💥giầy sục thời trang nam, mặt sói xanh, mèo xanh cực đẹp	Hà Nội	1562341955	1609917402	47575447	False	None	False	10	False	5.0	2	0	0	0	0	None	None	10900000000	-1	10900000000	-1	10900000000	0	None	809	4	2	False	True	8	0	3
2429	[Chính Hãng] Giày Adidas thời trang nam xám . 2020 new . :)) [ MỚI VỀ ] new : ✔️	TP. Hồ Chí Minh	1609123237	1609917402	794165	False	None	False	8	False	0.0	0	0	0	0	0	None	None	17582600000	-1	17582600000	-1	17582600000	0	None	0	0	0	False	False	5	0	0
2429	Giày sneaker thời trang nam - MS10 TT&GĐ	Hà Nội	1575684644	1609917402	34232758	True	23%	False	15	False	5.0	3	0	0	0	0	None	None	6900000000	9000000000	6900000000	9000000000	6900000000	9000000000	None	0	44	3	False	True	7	0	3
2429	Giày Sandal PRESTO Quai Dù Thời Trang Nam (Đỏ) - TN02	TP. Hồ Chí Minh	1578838937	1609917402	31078465	True	25%	False	10	False	5.0	3	0	0	0	0	None	None	19500000000	26000000000	19500000000	26000000000	19500000000	26000000000	None	11	515	3	False	True	9	1	7
2429	Giày sneaker thời trang nam cao cấp 2018-GTTB13	Hà Nội	1554514225	1609917402	55403177	True	40%	False	12	False	5.0	3	0	0	0	0	None	None	5900000000	9800000000	5900000000	9800000000	5900000000	9800000000	None	0	5	3	False	True	9	1	4
2429	Giày sneaker thời trang nam cao cấp ,giày thể thao nam - GTTB15 - CMS	Hà Nội	1537579690	1609917402	72337712	True	34%	False	12	False	4.5	1	1	0	0	0	None	None	5900000000	8900000000	5900000000	8900000000	5900000000	8900000000	None	4	10	2	False	True	8	1	4
2429	Giày Sneaker Thời Trang Nam.	TP. Hồ Chí Minh	1495118447	1609917402	114798955	False	50%	False	16	False	5.0	2	0	0	0	0	None	None	11500000000	23000000000	11500000000	23000000000	11500000000	23000000000	None	19	7	2	False	True	9	0	17
2429	TOÀN QUỐC - [Freeship] Giày Sneaker nam thể thao phong cách hàng đẹp chất lượng - Phố Thời Trang Nam SNK02	TP. Hồ Chí Minh	1550058638	1609917402	59858764	False	None	False	12	False	5.0	1	0	0	0	0	None	None	35000000000	-1	35000000000	-1	35000000000	0	None	3628	13	1	False	True	9	1	3
2429	Giày sneaker nam giày thể thao nam F35 màu đen giày chạy bộ nam giày ulzzang nam giày thời trang nam	Hà Nội	1599903189	1609917402	10014213	True	49%	False	9	False	5.0	2	0	0	0	0	None	None	26500000000	51500000000	26500000000	51500000000	26500000000	51500000000	None	376	460	2	True	False	8	1	3
2429	Giày sneaker thời trang nam cao cấp - GTTB14 (kèm video ảnh thật) - CMS	Hà Nội	1558316562	1609917402	51600840	True	14%	False	10	False	5.0	3	0	0	0	0	None	None	6900000000	8000000000	6900000000	8000000000	6900000000	8000000000	None	2	6	3	False	True	8	1	3
2429	Giày Thời Trang Nam Thể Thao Phong Cách F5	Hà Nội	1565662826	1609917402	44254576	True	None	False	15	False	4.2	4	0	0	0	1	None	None	27900000000	-1	27900000000	-1	27900000000	0	None	1310	3	5	False	False	9	0	7
2429	Giày sneaker thời trang nam 1314 màu đen	Hà Nội	1522739080	1609917402	87178322	False	None	False	6	False	5.0	3	0	0	0	0	None	None	8000000000	-1	8000000000	-1	8000000000	0	None	2	0	3	False	True	5	0	5
2429	[Giày Độc] Giày Thời Trang Nam GT02 - Giày Thể Thao Nam Thổ Dân Vẩy Cá Chép Đính Đinh	Hà Nội	1603958696	1609917402	5958706	True	15%	False	12	False	5.0	11	0	0	0	0	None	None	44200000000	52000000000	44200000000	52000000000	44200000000	52000000000	None	4591	20114	11	False	False	9	1	132
2429	Giày Thể Thao Vải Xước Thời Trang Nam V88	Hà Nội	1556102575	1609917402	53814827	True	44%	False	15	False	5.0	3	0	0	0	0	None	None	9900000000	17600000000	9900000000	17600000000	9900000000	17600000000	None	3057	5	3	False	True	9	1	5
2429	ff [ Sales 11-11] <3 [Chính Hãng] Giày Adidas thời trang nam xám <3 . . 2020 K . 11.11	TP. Hồ Chí Minh	1609555485	1609917402	361917	False	30%	False	8	False	0.0	0	0	0	0	0	None	None	11104600000	15863700000	11104600000	15863700000	11104600000	15863700000	None	0	0	0	False	False	5	0	0
2429	Giày Bốt Da Bò Nam - FREESHIP - Giày Thời Trang Nam Chelsea Boot Độc Đáo Thanh Lịch GNK101	Hà Nội	1604741836	1609917402	5175566	False	None	False	25	False	5.0	1	0	0	0	0	None	None	50000000000	-1	50000000000	-1	50000000000	0	None	3	120	1	False	False	9	0	60
