category	name	shop_location	item_public_time	item_be_got_time	sell_time	shopee_verified	discount	is_adult	options	show_official_shop_label_in_title	rating_star	five_star	four_star	three_star	two_star	one_star	flash_sale	upcoming_flash_sale	price_min	price_min_before_discount	price_max	price_max_before_discount	price	price_before_discount	coin_earn_label	liked_count	view_count	cmt_count	is_preferred_plus_seller	show_free_shipping	images	video_info_list	historical_sold
Phu kien Nam	Mũ Lông Giả Giữ Ấm Thời Trang Nam	Nước ngoài	1572783910	1609910398	37126488	False	None	False	3	False	0.0	0	0	0	0	0	None	None	23450000000	-1	25300000000	-1	23450000000	0	None	1	40	0	False	True	3	0	3
Phu kien Nam	❌SIÊU CẤP❌nón kết mũ lưỡi trai unisex nam nữ THÁI LAN CAO CẤP thời trang hot trend hàng Thái Lan	TP. Hồ Chí Minh	1601538869	1609910398	8371529	False	None	False	13	False	5.0	12	0	0	0	0	None	None	13000000000	-1	13900000000	-1	13000000000	0	None	798	542	12	False	False	9	0	291
Phu kien Nam	SET KHĂN MŨ LEN NAM LÓT NỈ CỰC ẤM THỜI TRANG	Hưng Yên	1546486853	1609910398	63423545	True	50%	False	5	False	4.75	45	3	3	0	1	None	None	4500000000	9000000000	4500000000	9000000000	4500000000	9000000000	None	63	1556	52	False	True	6	0	280
Phu kien Nam	Cà vạt nam chấm bi thời trang lịch lãm	Nước ngoài	1561382021	1609910398	48528377	False	50%	False	9	False	4.75	21	2	0	0	1	None	None	6623600000	13247200000	7069900000	14139800000	6623600000	13247200000	None	89	693	24	False	False	8	0	218
Phu kien Nam	Mũ Len Thêu Logo Naruto Akatsuki Thời Trang Nam	Nước ngoài	1606809956	1609910398	3100442	False	50%	False	4	False	0.0	0	0	0	0	0	None	None	8400000000	16720000000	8400000000	16720000000	8400000000	16720000000	None	0	26	0	False	False	5	0	1
Phu kien Nam	NÓN BUCKET HOA 2 Lớp - Thời Trang Nam Nữ	TP. Hồ Chí Minh	1584121087	1609910398	25789311	True	9%	False	5	False	4.9457830000000005	162	1	2	0	1	None	None	3266900000	3590000000	3266900000	3590000000	3266900000	3590000000	None	69	245	166	False	False	6	0	467
Phu kien Nam	Cà Vạt Họa Tiết Sọc Chéo Nhiều Kiểu Thời Trang Cho Nam 8cm	Nước ngoài	1574254619	1609910398	35655779	True	17%	False	18	False	4.841667	109	7	2	0	2	None	None	2307000000	2653300000	2570000000	3000000000	2307000000	2653300000	None	181	5748	120	False	False	9	0	671
Phu kien Nam	Nón kết The North Face (Mẫu 01) - Thời trang Nam	None	1501910179	1609910398	108000219	False	None	False	1	None	5.0	2	0	0	0	0	None	None	7800000000	-1	7800000000	-1	7800000000	0	None	4	17	2	False	True	5	0	2
Phu kien Nam	Cà Vạt Lụa Kẻ Sọc Thời Trang Cho Nam 6cm	Nước ngoài	1592138757	1609910398	17771641	True	32%	False	20	False	4.96875	31	1	0	0	0	None	None	6750000000	9890000000	6750000000	9890000000	6750000000	9890000000	None	27	1329	32	False	False	9	0	127
Phu kien Nam	Vớ Nam Kiểu Dáng Công Sở Thời Trang Phong Cách	Nước ngoài	1560751696	1609910398	49158702	False	26%	False	5	None	4.724138	26	0	2	0	1	None	None	1100000000	1480000000	1100000000	1480000000	1100000000	1480000000	None	6	94	29	False	False	7	0	150
Phu kien Nam	Vớ nam thời trang chất liệu cotton D009	Nước ngoài	1571711492	1609910398	38198906	True	38%	False	5	False	4.952381	40	2	0	0	0	None	None	990000000	1600000000	990000000	1600000000	990000000	1600000000	None	8	28	42	False	False	6	0	198
Phu kien Nam	Set Áo Sơ Mi Ngắn Tay + Cà Vạt + Cà Vạt Thời Trang Nam Gs5	Nước ngoài	1597369062	1609910398	12541336	False	31%	False	24	False	0.0	0	0	0	0	0	None	None	17690000000	25670000000	17690000000	25670000000	17690000000	25670000000	None	0	1	0	False	False	7	0	0
Phu kien Nam	Nón Lưỡi Trai Nam Nữ Thời Trang, Phong Cách, Thể Thao Đẹp Vải Kaki Cao Cấp Màu Trắng	TP. Hồ Chí Minh	1598583365	1609910398	11327033	False	14%	False	1	False	0.0	0	0	0	0	0	None	None	6900000000	8000000000	6900000000	8000000000	6900000000	8000000000	None	11	339	0	False	False	6	0	0
Phu kien Nam	Găng Tay Nam Chất Nỉ Lót Lông Giữ Ấm Thời Trang Hàn Quốc – Bao Tay Nỉ Cảm Ứng Điện Thoại Chống Thấm Giữ Nhiệt Tốt Ms583	Hà Nội	1572421194	1609910398	37489204	True	23%	False	3	False	4.814371	146	14	5	1	1	None	None	6900000000	9000000000	6900000000	9000000000	6900000000	9000000000	None	2152	7310	167	False	False	8	1	500
Phu kien Nam	Mũ Nam Cao Cấp Nón Kết Trắng Thời Trang HOLISTER	TP. Hồ Chí Minh	1606060466	1609910398	3849932	True	26%	False	1	False	5.0	3	0	0	0	0	None	None	18500000000	25000000000	18500000000	25000000000	18500000000	25000000000	None	6	949	3	False	False	4	0	13
Phu kien Nam	Combo 5 đôi tất vớ lười nam, silicon chống tụt gót với sợi cotton kháng khuẩn khử mùi, chống hôi chân MRM Manlywear - CM	Hà Nội	1569655205	1609910398	40255193	False	21%	False	4	True	4.945946	35	2	0	0	0	None	None	13900000000	17500000000	13900000000	17500000000	13900000000	17500000000	None	13	224	37	False	True	9	0	99
Phu kien Nam	Kẹp cà vạt Nam thời trang màu Bạc 4cm phù hợp cà vạt bản 4,5cm trở lên {Phụ Kiện Vest nam - AdamZone}	Hà Nội	1564943479	1609910398	44966919	True	None	False	7	False	4.945946	35	2	0	0	0	None	None	1900000000	-1	3200000000	-1	1900000000	0	None	16	328	37	False	True	7	0	124
Phu kien Nam	Nơ đeo cài cổ áo Vest Nam 2 lớp thời trang đính đá và nhiều mẫu họa tiết NO-80 {Phụ Kiện Vest Nam – AdamZone}	None	1575568486	1609910398	34341912	False	None	False	19	None	4.961538	25	1	0	0	0	None	None	8899900000	-1	8899900000	-1	8899900000	0	None	14	288	26	False	True	9	0	81
Phu kien Nam	Cà vạt Nam thắt sẵn cao cấp bản to 8cm phong cách công sở lịch sự, cà vạt phom đẹp thời trang CV-850- CV-859 - AdamZone	Hà Nội	1575730342	1609910398	34180056	True	None	False	38	False	5.0	48	0	0	0	0	None	None	8190000000	-1	8590000000	-1	8190000000	0	None	32	428	48	False	True	9	0	159
Phu kien Nam	Mũ Lưỡi Trai 💖 FREESHIP 💖 Mũ Lưỡi Trai Nam Nữ Cao Cấp, Chất Liệu Vải Canvas Loại I, Phù Hợp Nam Nữ - Freesize	Hà Nội	1604806493	1609910398	5103905	True	25%	False	4	False	4.952381	40	2	0	0	0	None	None	5900000000	7900000000	5900000000	7900000000	5900000000	7900000000	None	14	1052	42	False	False	8	1	65
Phu kien Nam	Mũ bucket che nắng chất liệu cotton thoáng khí thời trang dành cho cả nam và nữ	Nước ngoài	1588078112	1609910398	21832286	False	18%	False	5	None	5.0	7	0	0	0	0	None	None	6340000000	7750000000	6480000000	7750000000	6340000000	7750000000	None	10	299	7	False	False	9	0	18
Phu kien Nam	Nơ cài cổ áo Nam thời trang màu Đen NO-50 {Phụ Kiện Áo Vest V-Smile VietNam}	None	1544987315	1609910398	64923083	False	21%	False	10	None	4.818182	10	0	1	0	0	None	None	4950000000	4950000000	6250000000	7900000000	4950000000	4950000000	None	8	79	11	False	True	9	0	40
Phu kien Nam	Thắt Lưng Canvas Thời Trang Nam	Nước ngoài	1606987948	1609910398	2922450	False	50%	False	16	False	0.0	0	0	0	0	0	None	None	11557100000	23114200000	12368700000	24737300000	11557100000	23114200000	None	1	1	0	False	False	9	0	0
Phu kien Nam	Cà vạt lụa Nam bản nhỏ 3,5cm - 5cm tự thắt màu đen Thời trang phong cách Hàn Quốc CV-01, CV-525- AdamZone	Hà Nội	1564917632	1609910398	44992766	True	None	False	3	False	4.769231	59	2	1	1	2	None	None	2650000000	-1	2650000000	-1	2650000000	0	None	70	157	65	False	True	9	0	296
Phu kien Nam	[Bán lẻ giá sỉ] Nón Kết Chữ T - Thời Trang Nam Siêu Đẹp	TP. Hồ Chí Minh	1594916641	1609910398	14993757	False	None	False	2	False	0.0	0	0	0	0	0	None	None	5000000000	-1	5000000000	-1	5000000000	0	None	1	5	0	False	False	2	0	0
Phu kien Nam	NÓN KẾT PHỐI LƯỚI HÌNH CON GÀ THÊU THỜI TRANG NAM	None	1606999708	1609910398	2910690	False	None	False	4	None	0.0	0	0	0	0	0	None	None	5000000000	-1	5000000000	-1	5000000000	0	None	0	14	0	False	False	5	0	0
Phu kien Nam	Cặp Khuy Măng Sét Phim 007 Thời Trang Nam	Nước ngoài	1603182437	1609910398	6727961	False	50%	False	1	False	0.0	0	0	0	0	0	None	None	3370000000	6690000000	3370000000	6690000000	3370000000	6690000000	None	0	1	0	False	False	8	0	0
Phu kien Nam	Mũ Len Giữ Ấm Thời Trang Nam	Nước ngoài	1592122050	1609910398	17788348	False	50%	False	12	False	0.0	0	0	0	0	0	None	None	15980000000	31800000000	21360000000	42510000000	15980000000	31800000000	None	0	1	0	False	False	9	0	0
Phu kien Nam	NÓN KẾT CHỮ CÁI ĐƠN GIẢN THỜI TRANG NAM NỮ	TP. Hồ Chí Minh	1585390391	1609910398	24520007	True	None	False	11	False	4.972222	35	1	0	0	0	None	None	1900000000	-1	1900000000	-1	1900000000	0	None	16	195	36	False	True	1	0	155
Phu kien Nam	Nón thời trang nam cao cấp	TP. Hồ Chí Minh	1599382879	1609910398	10527519	False	None	False	1	False	0.0	0	0	0	0	0	None	None	40000000000	-1	40000000000	-1	40000000000	0	None	4	31	0	False	False	5	0	0
Phu kien Nam	Thời Trang Nam,Giay Nam Cao Cấp V006	Hà Nội	1608431526	1609910398	1478872	False	None	False	1	False	0.0	0	0	0	0	0	None	None	180000000000	-1	180000000000	-1	180000000000	0	None	1	0	0	False	False	1	0	0
Phu kien Nam	Mũ lưỡi trai nón kết unisex nam nữ THÁI LAN CAO CẤP thời trang hot trend hàng Thái Lan	TP. Hồ Chí Minh	1601236838	1609910398	8673560	False	None	False	13	False	5.0	9	0	0	0	0	None	None	13000000000	-1	13900000000	-1	13000000000	0	None	0	84	9	False	False	9	1	142
Phu kien Nam	Cà vạt phong cách Harry Potter thời trang Anh sọc polyester nam cà vạt	Hà Nội	1568199489	1609910398	41710909	False	None	False	4	False	4.5897440000000005	32	3	1	1	2	None	None	3000000000	-1	3000000000	-1	3000000000	0	None	93	171	39	False	False	3	0	168
Phu kien Nam	Nón Bóng Chày Tommy Fb Thời Trang Nam Cá Tính	Nước ngoài	1607132327	1609910398	2778071	False	10%	False	6	False	0.0	0	0	0	0	0	None	None	47020000000	52190000000	47020000000	52190000000	47020000000	52190000000	None	0	6	0	False	False	6	0	0
Phu kien Nam	Mũ Tai Bèo Chống Nắng Thời Trang Nam	Nước ngoài	1597817796	1609910398	12092602	False	40%	False	8	False	0.0	0	0	0	0	0	None	None	6360000000	10510000000	6540000000	10810000000	6360000000	10510000000	None	0	1	0	False	False	8	0	1
Phu kien Nam	Mũ Giữ Ấm Thời Trang Nam	Nước ngoài	1600237799	1609910398	9672599	False	45%	False	5	False	0.0	0	0	0	0	0	None	None	5280000000	9600000000	6150000000	11200000000	5280000000	9600000000	None	0	1	0	False	False	3	0	0
Phu kien Nam	Mũ lưỡi trai nam nữ thời trang thêu NYY NewwYorrk mới vải cotton thoáng khí mới về	Hà Nội	1589355558	1609910398	20554840	True	47%	False	2	False	4.7619050000000005	18	2	0	1	0	None	None	1850000000	3500000000	1850000000	3500000000	1850000000	3500000000	None	12	187	21	False	False	8	0	66
Phu kien Nam	Dây Đai Quần Chữ X Đàn Hồi 4 Kẹp Thời Trang Nam	Nước ngoài	1594890791	1609910398	15019607	False	None	False	2	False	0.0	0	0	0	0	0	None	None	63730000000	-1	63730000000	-1	63730000000	0	None	0	1	0	False	False	7	0	0
Phu kien Nam	❌HÀNG XỊN❌Mũ Nón lưỡi trai CAO CẤP unisex nam nữ thêu chữ logo cực kì xịn xò thời trang hot trend HÀNG VNXK	TP. Hồ Chí Minh	1584133022	1609910398	25777376	False	None	False	1	False	5.0	15	0	0	0	0	None	None	13000000000	-1	13000000000	-1	13000000000	0	None	2	159	15	False	False	5	0	322
Phu kien Nam	NÓN THỜI TRANG NAM NỮ - NYY	TP. Hồ Chí Minh	1556543065	1609910398	53367333	True	25%	False	4	False	4.938462	62	2	1	0	0	None	None	4125000000	5500000000	4125000000	5500000000	4125000000	5500000000	None	53	90	65	False	True	6	0	245
Phu kien Nam	Mũ lưỡi trai – Nón kết thời trang nam chóp vuông logo lệch hình chim	None	1573102358	1609910398	36808040	False	34%	False	3	None	5.0	1	0	0	0	0	None	None	7900000000	12000000000	7900000000	12000000000	7900000000	12000000000	None	0	24	1	False	False	9	0	8
Phu kien Nam	Nón kết Dù SON VÁ DA CÀ ĐUÔI THỜI TRANG NAM	TP. Hồ Chí Minh	1606924743	1609910398	2985655	True	None	False	1	False	0.0	0	0	0	0	0	None	None	9500000000	-1	9500000000	-1	9500000000	0	None	0	6	0	False	False	3	0	0
Phu kien Nam	❌SIÊU CẤP❌Mũ lưỡi trai nón kết unisex nam nữ THÁI LAN CAO CẤP thời trang hot trend hàng Thái Lan	TP. Hồ Chí Minh	1601436882	1609910398	8473516	True	50%	False	13	False	4.6	9	0	0	0	1	None	None	13000000000	26000000000	13900000000	26000000000	13000000000	26000000000	None	5	404	10	False	True	9	1	364
Phu kien Nam	❌NÓN THÁI❌NÓN KẾT Mũ lưỡi trai unisex  nam nữ thêu chữ logo cực kì xịn xò thời trang hot trend nhập trực tiếp từ Thái La	TP. Hồ Chí Minh	1604944720	1609910398	4965678	False	None	False	5	False	5.0	6	0	0	0	0	None	None	14900000000	-1	14900000000	-1	14900000000	0	None	4	302	6	False	True	9	1	94
Phu kien Nam	[Form Cứng] Nón Kết Mũ Lưỡi Trai Thời Trang Nam Nữ Hot Trend hoa cúc	TP. Hồ Chí Minh	1582268286	1609910398	27642112	False	42%	False	8	False	4.911765	32	1	1	0	0	None	None	3200000000	5500000000	3200000000	5500000000	3200000000	5500000000	None	17	56	34	False	False	9	0	118
Phu kien Nam	NÓN BUCKET RẰN RI THỜI TRANG NAM	TP. Hồ Chí Minh	1603008515	1609910398	6901883	False	None	False	3	False	0.0	0	0	0	0	0	None	None	5590000000	-1	5590000000	-1	5590000000	0	None	0	1	0	False	False	1	0	0
Phu kien Nam	Cà vạt Nam tự thắt giá rẻ bản 5cm thời trang phong cách Hàn Quốc trẻ trung CV-512520  {Phụ Kiện Vest Nam – AdamZone}	Hà Nội	1567802747	1609910398	42107651	True	None	False	9	False	5.0	20	0	0	0	0	None	None	5490000000	-1	5490000000	-1	5490000000	0	None	24	190	20	False	True	9	0	73
Phu kien Nam	Combo 5 Đôi Tất Nam Thể Thao Cổ Ngắn Thời Trang	None	1607091268	1609910398	2819130	False	None	False	5	None	5.0	8	0	0	0	0	None	None	3100000000	-1	3100000000	-1	3100000000	0	None	6	367	8	False	False	6	0	362
Phu kien Nam	Mũ Len Thời Trang Nam Kèm Khăn Quàng Cổ	Hà Nội	1607226514	1609910398	2683884	True	45%	False	6	False	0.0	0	0	0	0	0	None	None	6600000000	12000000000	6600000000	12000000000	6600000000	12000000000	None	0	16	0	False	False	8	0	0
Phu kien Nam	Mũ(nón) thời trang Nam.	Khánh Hòa	1601263462	1609910398	8646936	False	None	False	1	False	0.0	0	0	0	0	0	None	None	18000000000	-1	18000000000	-1	18000000000	0	None	0	1	0	False	True	9	0	0
Phu kien Nam	Khăn cotton trùm đầu thời trang thể thao năng động cho nam 55X55Cm	Nước ngoài	1539489179	1609910398	70421219	True	38%	False	9	False	4.5	7	0	0	0	1	None	None	1240000000	2000000000	1240000000	2000000000	1240000000	2000000000	None	8	79	8	False	False	9	0	121
Phu kien Nam	Nón Kết Họa Tiết Rằn Ri Thời Trang Nam	Nước ngoài	1592374825	1609910398	17535573	False	49%	False	19	False	0.0	0	0	0	0	0	None	None	25497500000	49995200000	25497500000	49995200000	25497500000	49995200000	None	0	6	0	False	False	7	0	0
Phu kien Nam	Mũ lưỡi trai cotton form đẹp, thời trang cho cả nam và nữ	None	1593007060	1609910398	16903338	False	14%	False	1	None	5.0	28	0	0	0	0	None	None	16000000000	18700000000	16000000000	18700000000	16000000000	18700000000	None	2637	475	28	False	True	8	1	309
Phu kien Nam	[ Hàng Mới 2020 ] Nón Kết Under Phối Đuôi - Thời Trang Nam	TP. Hồ Chí Minh	1597230643	1609910398	12679755	False	None	False	3	False	0.0	0	0	0	0	0	None	None	4929900000	-1	4929900000	-1	4929900000	0	None	0	1	0	False	False	4	0	0
Phu kien Nam	Mũ Beret Giữ Ấm Thời Trang Nam	Nước ngoài	1591168930	1609910398	18741468	False	None	False	8	False	0.0	0	0	0	0	0	None	None	19010000000	-1	19010000000	-1	19010000000	0	None	0	1	0	False	False	9	0	0
Phu kien Nam	Mũ nồi thời trang cho nam	Nước ngoài	1529645371	1609910398	80265027	False	None	False	6	False	4.8	34	5	0	1	0	None	None	4500000000	-1	4700000000	-1	4500000000	0	None	44	70	40	False	False	9	0	284
Phu kien Nam	Mũ Lưỡi Trai Chống Nắng Thời Trang Nam	Nước ngoài	1605151081	1609910398	4759317	False	50%	False	3	False	0.0	0	0	0	0	0	None	None	38680000000	76960000000	38680000000	76960000000	38680000000	76960000000	None	0	0	0	False	False	8	0	0
Phu kien Nam	Mũ Lưỡi Trai hàn quốc Reclusive ❤️ Nón Lưỡi Trai Thời trang ❤️ Nón Kết nam nữ đẹp	Hà Nội	1603171893	1609910398	6738505	False	None	False	4	False	5.0	8	0	0	0	0	None	None	12900000000	-1	12900000000	-1	12900000000	0	None	7152	831	8	False	False	8	0	455
Phu kien Nam	Mũ Lưỡi Trai Thời Trang Nam 2020 Ahegao Is Love Rare Dangk Meme Hat1	Nước ngoài	1603740108	1609910398	6170290	False	50%	False	4	False	0.0	0	0	0	0	0	None	None	16480000000	32780000000	16480000000	32780000000	16480000000	32780000000	None	0	2	0	False	False	3	0	0
Phu kien Nam	5 Đôi Tất Chân Len Giữ Ấm Thời Trang Nam Ckc 77	Nước ngoài	1606136303	1609910398	3774095	False	None	False	1	False	0.0	0	0	0	0	0	None	None	28590000000	-1	28590000000	-1	28590000000	0	None	0	1	0	False	False	6	0	0
Phu kien Nam	Nón mũ lưỡi trai NY đen nam nữ đẹp Logo Thêu New York vải kaki trẻ trung thời trang	TP. Hồ Chí Minh	1570412164	1609910398	39498234	True	50%	False	1	False	4.7708330000000005	43	3	0	0	2	None	None	2500000000	5000000000	2500000000	5000000000	2500000000	5000000000	None	70	275	48	False	True	8	1	172
Phu kien Nam	Nón Lưỡi Trai Vải Dù Cao Cấp Full Tem Thời Trang Nam Nữ - MS14	TP. Hồ Chí Minh	1588741169	1609910398	21169229	False	40%	False	1	False	5.0	15	0	0	0	0	None	None	6900000000	11500000000	6900000000	11500000000	6900000000	11500000000	None	1285	70	15	False	False	7	0	201
Phu kien Nam	Combo 10 đôi tất nam uni khử mùi cổ cao	None	1511352238	1609910398	98558160	False	34%	False	1	None	4.767568	165	8	6	1	5	None	None	9900000000	15000000000	9900000000	15000000000	9900000000	15000000000	None	48	595	185	False	True	1	0	528
Phu kien Nam	Khăn cài túi áo Vest họa tiết Paisley dành cho nam - Phụ kiện cài áo cao cấp thời trang	Hà Nội	1602428989	1609910398	7481409	False	23%	False	20	False	5.0	6	0	0	0	0	None	None	5290000000	6900000000	6580000000	6900000000	5290000000	6900000000	None	24	413	6	False	False	9	0	20
Phu kien Nam	[ FREESHIP TOÀN QUỐC ] Mũ Nón Lưỡi Trai Thời Trang Nam Nữ Converse Siêu Đẹp Quai Kim Loại Cao Cấp - BH 3 Tháng Sử Dụng	Hà Nội	1553867676	1609910398	56042722	False	46%	False	3	False	4.7647059999999986	14	2	1	0	0	None	None	5988800000	11000000000	5988800000	11000000000	5988800000	11000000000	None	1155	137	17	False	False	4	1	58
Phu kien Nam	Nón Kết - Mũ Lưỡi Trai BIGCITYBOY Binz Thời Trang NAM/NỮ , Cực Hot	TP. Hồ Chí Minh	1602261172	1609910398	7649226	True	None	False	7	False	4.851852	25	0	2	0	0	None	None	3200000000	-1	6000000000	-1	3200000000	0	None	14	335	27	False	False	8	0	97
Phu kien Nam	Nón Lưỡi Trai Nam Nữ Đẹp Có Dây Kéo Hình Con Mắt Siêu Ngầu	TP. Hồ Chí Minh	1598658472	1609910398	11251926	False	5%	False	3	False	0.0	0	0	0	0	0	None	None	5700000000	6000000000	5700000000	6000000000	5700000000	6000000000	None	57	299	0	False	False	8	0	4
Phu kien Nam	Cà vạt Nam tự thắt giá rẻ bản 5cm thời trang phong cách Hàn Quốc trẻ trung CV-512520  {Phụ Kiện Vest Nam – AdamZone}	Hà Nội	1567802747	1609910398	42107651	True	None	False	9	False	5.0	20	0	0	0	0	None	None	5490000000	-1	5490000000	-1	5490000000	0	None	24	190	20	False	True	9	0	73
Phu kien Nam	Tất chống trượt chất liệu thoáng khí thời trang dành cho nam giới	Nước ngoài	1582513381	1609910398	27397017	False	50%	False	5	None	5.0	78	0	0	0	0	None	None	1100000000	2190000000	1100000000	2190000000	1100000000	2190000000	None	10	312	78	False	True	7	0	409
Phu kien Nam	Cà vạt Nam giá rẻ bản to 8cm thời trang, cà vạt công sở, CV-801, CV-820 {Phụ Kiện Vest Nam – AdamZone}	Hà Nội	1568146908	1609910398	41763490	True	None	False	18	False	4.943396	51	1	1	0	0	None	None	1290000000	-1	5290000000	-1	1290000000	0	None	38	771	53	False	True	9	0	226
Phu kien Nam	MBH3X - Set khăn mũ len lót lông nam nữ hot hit (Video thật)	Hà Nội	1608795890	1609910398	1114508	False	44%	False	5	False	5.0	1	0	0	0	0	None	None	4500000000	8000000000	4500000000	8000000000	4500000000	8000000000	None	0	51	1	False	False	5	0	1
Phu kien Nam	(SP Kèm Video) COMBO 5 ĐÔI TẤT NAM CỔ NGẮN HÀNG DƯ GIÁ RẺ, CHỐNG HÔI CHÂN, KHÁNG KHUẨN	Hà Nội	1597828678	1609910398	12081720	True	30%	False	6	False	4.936306	149	6	2	0	0	None	None	5565000000	7950000000	5565000000	7950000000	5565000000	7950000000	None	33	533	157	True	True	8	1	573
Phu kien Nam	Nón Thủy Thủ Thời Trang Nam Cá Tính 1229	Nước ngoài	1609229603	1609910398	680795	False	None	False	8	False	0.0	0	0	0	0	0	None	None	26660000000	-1	35350000000	-1	26660000000	0	None	0	3	0	False	False	3	0	0
Phu kien Nam	Mũ Lưỡi Trai Che Tai Giữ Ấm Thời Trang Nam	Nước ngoài	1604565682	1609910398	5344716	False	50%	False	3	None	0.0	0	0	0	0	0	None	None	8690000000	17300000000	9160000000	18210000000	8690000000	17300000000	None	0	9	0	False	False	9	0	0
Phu kien Nam	Nơ đeo cài cổ áo Vest Nam 2 lớp thời trang đính đá và nhiều mẫu họa tiết NO-80 {Phụ Kiện Vest Nam – AdamZone}	None	1575568486	1609910398	34341912	False	None	False	19	None	4.961538	25	1	0	0	0	None	None	8899900000	-1	8899900000	-1	8899900000	0	None	14	288	26	False	True	9	0	81
Phu kien Nam	Nón Kết Dạng Lưới Thời Trang Nam	Nước ngoài	1598758116	1609910398	11152282	False	50%	False	5	False	0.0	0	0	0	0	0	None	None	14360000000	28570000000	14360000000	28570000000	14360000000	28570000000	None	0	1	0	False	False	4	0	0
Phu kien Nam	Cà - vạt Hàn Quốc thời trang nam doanh nhân phong cách Anh Quốc	Nước ngoài	1572492822	1609910398	37417576	False	None	False	11	False	0.0	0	0	0	0	0	None	None	16400000000	-1	16400000000	-1	16400000000	0	None	0	0	0	False	False	4	0	0
Phu kien Nam	Mũ Lưỡi Trai ❤ FREESHIP ❤ Nón kết nam nữ thời trang	Hà Nội	1563016135	1609910398	46894263	True	None	False	2	False	4.714286	24	2	1	0	1	None	None	3800000000	-1	3800000000	-1	3800000000	0	None	12982	76	28	False	True	5	0	640
Phu kien Nam	NÓN LƯỠI TRAI THỜI TRANG - MŨ LƯỠI TRAI NAM (NON-006)	TP. Hồ Chí Minh	1573820504	1609910398	36089894	True	10%	False	1	False	4.924242	63	1	2	0	0	None	None	8900000000	9900000000	8900000000	9900000000	8900000000	9900000000	None	84	1013	66	False	True	9	0	177
Phu kien Nam	Thắt Lưng Da Thời Trang Nam Lịch Lãm	Nước ngoài	1592376952	1609910398	17533446	False	24%	False	1	False	0.0	0	0	0	0	0	None	None	4390000000	5764000000	4390000000	5764000000	4390000000	5764000000	None	0	0	0	False	True	7	0	0
Phu kien Nam	Thắt Lưng Da Thời Trang Nam Lịch Lãm	Nước ngoài	1585052433	1609910398	24857965	False	None	False	14	False	0.0	0	0	0	0	0	None	None	8800000000	-1	9700000000	-1	8800000000	0	None	0	1	0	False	False	8	0	0
Phu kien Nam	Nón lưỡi trai cao cấp unisex nam nữ thêu chữ logo cực kì xịn xò thời trang hot trend	TP. Hồ Chí Minh	1584127511	1609910398	25782887	True	50%	False	1	False	4.820513	36	1	1	0	1	None	None	13000000000	26000000000	13000000000	26000000000	13000000000	26000000000	None	21	545	39	False	True	6	1	2137
Phu kien Nam	Mũ Len Kèm Khăn Nam Nữ Nón Len Mùa Đông Giữ Ấm Kiểu Dáng Thời Trang [QQ-118]	Quảng Ninh	1603308144	1609910398	6602254	False	34%	False	6	False	4.705882	15	1	0	0	1	None	None	2500000000	3000000000	9900000000	15000000000	2500000000	3000000000	None	21	818	17	False	False	9	0	239
Phu kien Nam	NÓN LƯỠI TRAI THỜI TRANG - MŨ LƯỠI TRAI NAM (NON-009)	TP. Hồ Chí Minh	1573821019	1609910398	36089379	True	10%	False	1	False	4.678571	23	3	0	2	0	None	None	8900000000	9900000000	8900000000	9900000000	8900000000	9900000000	None	18	404	28	False	True	9	0	75
Phu kien Nam	Mũ nón nam nữ thời trang hip hop	Hà Nội	1578479156	1609910398	31431242	False	None	False	2	False	4.987805000000002	81	1	0	0	0	None	None	9900000000	-1	9900000000	-1	9900000000	0	None	53	37	82	False	True	5	0	109
Phu kien Nam	Áo Len Cổ Lọ Dài Tay Thời Trang Nam	Nước ngoài	1596100723	1609910398	13809675	False	40%	False	12	False	0.0	0	0	0	0	0	None	None	8100000000	13500000000	8100000000	13500000000	8100000000	13500000000	None	0	8	0	False	False	9	0	0
Phu kien Nam	Thắt Lưng Da Thời Trang Nam Lịch Lãm	Nước ngoài	1585052456	1609910398	24857942	False	None	False	48	False	0.0	0	0	0	0	0	None	None	8600000000	-1	10400000000	-1	8600000000	0	None	0	1	0	False	False	9	0	0
Phu kien Nam	Nơ Cài Cổ Áo Thời Trang Nam	Nước ngoài	1575118512	1609910398	34791886	False	None	False	17	False	0.0	0	0	0	0	0	None	None	18100000000	-1	24100000000	-1	18100000000	0	None	0	1	0	False	False	3	0	0
Phu kien Nam	Nón Bóng Chày Dior Thời Trang Nam Cá Tính 4	Nước ngoài	1603065042	1609910398	6845356	False	10%	False	4	False	0.0	0	0	0	0	0	None	None	37620000000	41770000000	37620000000	41770000000	37620000000	41770000000	None	0	4	0	False	False	4	0	0
Phu kien Nam	Nón bóng chày mềm thời trang nam năng động	Nước ngoài	1585405465	1609910398	24504933	False	49%	False	4	False	0.0	0	0	0	0	0	None	None	7550000000	14780000000	7550000000	14780000000	7550000000	14780000000	None	0	1	0	False	False	9	0	0
Phu kien Nam	Mũ lưỡi trai phong cách thời trang hiện đại Hàn Quốc cho cả nam và nữ	None	1593392710	1609910398	16517688	False	22%	False	4	None	5.0	18	0	0	0	0	None	None	12900000000	16600000000	12900000000	16600000000	12900000000	16600000000	None	1662	159	18	False	False	9	1	152
Phu kien Nam	Mũ Lưỡi Trai Da Bò Giữ Ấm Thời Trang Nam Trung Niên	Nước ngoài	1601809596	1609910398	8100802	False	20%	False	19	False	0.0	0	0	0	0	0	None	None	35150000000	44140000000	38150000000	47880000000	35150000000	44140000000	None	0	4	0	False	False	9	0	0
Phu kien Nam	Nón Bóng Chày Lv Thời Trang Nam Cá Tính	Nước ngoài	1608291490	1609910398	1618908	False	10%	False	3	False	0.0	0	0	0	0	0	None	None	43500000000	48270000000	43500000000	48270000000	43500000000	48270000000	None	0	0	0	False	False	3	0	0
