name	shop_location	shopee_verified	discount	is_adult	options	show_official_shop_label_in_title	rating_star	rating_count	flash_sale	upcoming_flash_sale	price_min	price_min_before_discoun	price_max	price_max_before_discount	price	price_before_discount	coin_earn_label	liked_count	view_count	cmt_count	is_preferred_plus_seller	show_free_shipping	images	video_info_list	sold	historical_sold
Áo Khoác Phao Dày Dặn Giữ Ấm Thời Trang Nam Trung Niên	Nước ngoài	False	None	False	7	False	0.0	[0, 0, 0, 0, 0, 0]	None	None	33010000000	-1	33010000000	-1	33010000000	0	None	0	0	0	False	False	8	0	0	0
Áo hoodie có nón dài tay họa tiết 3d thời trang nam	Nước ngoài	False	50%	False	10	False	0.0	[0, 0, 0, 0, 0, 0]	None	None	25300000000	50350000000	25300000000	50350000000	25300000000	50350000000	None	0	0	0	False	False	3	0	0	0
Áo Khoác Giữ Ấm Dày Dặn Thời Trang Nam Trung Niên	Nước ngoài	False	None	False	5	False	0.0	[0, 0, 0, 0, 0, 0]	None	None	91703500000	-1	91703500000	-1	91703500000	0	None	0	3	0	False	False	6	0	0	0
Áo Khoác Bóng Chày Thời Trang Nam	Nước ngoài	False	49%	False	6	False	0.0	[0, 0, 0, 0, 0, 0]	None	None	46218900000	90625300000	46218900000	90625300000	46218900000	90625300000	None	0	0	0	False	False	7	0	0	0
Áo Khoác Thời Trang Nam	Nước ngoài	False	46%	False	12	False	0.0	[0, 0, 0, 0, 0, 0]	None	None	33240000000	61660000000	33240000000	61660000000	33240000000	61660000000	None	0	0	0	False	False	6	0	0	0
Set Áo Thun Ngắn Tay Cổ Tròn + Quần Short Lưng Thun Thời Trang Nam	Nước ngoài	False	50%	False	6	False	0.0	[0, 0, 0, 0, 0, 0]	None	None	34360000000	68370000000	34360000000	68370000000	34360000000	68370000000	None	0	0	0	False	False	9	0	0	0
Áo Khoác Jeans Phối Màu Cá Tính Thời Trang Nam	Nước ngoài	False	None	False	5	False	0.0	[0, 0, 0, 0, 0, 0]	None	None	67220000000	-1	67220000000	-1	67220000000	0	None	1	0	0	False	False	9	0	0	0
Áo Hoodies Có Nón Dài Tay Thời Trang Nam	Nước ngoài	False	None	False	4	False	0.0	[0, 0, 0, 0, 0, 0]	None	None	108500000000	-1	108500000000	-1	108500000000	0	None	0	0	0	False	False	5	0	0	0
Áo Khoác Bóng Chày Thời Trang Nam	Nước ngoài	False	None	False	5	False	0.0	[0, 0, 0, 0, 0, 0]	None	None	32540000000	-1	50000000000	-1	32540000000	0	None	0	0	0	False	False	7	0	0	0
Áo Khoác Thời Trang Nam 2020	Nước ngoài	False	25%	False	7	False	0.0	[0, 0, 0, 0, 0, 0]	None	None	52960000000	71020000000	52960000000	71020000000	52960000000	71020000000	None	0	0	0	False	False	6	0	0	0
Áo Khoác Da Pu Thời Trang Nam Cá Tính	Nước ngoài	False	20%	False	6	False	0.0	[0, 0, 0, 0, 0, 0]	None	None	71170000000	89140000000	71170000000	89140000000	71170000000	89140000000	None	0	0	0	False	False	9	0	0	0
Áo Khoác Bóng Chày In Hình 3d Thời Trang Nam	Nước ngoài	False	None	False	5	False	0.0	[0, 0, 0, 0, 0, 0]	None	None	40010000000	-1	40010000000	-1	40010000000	0	None	0	0	0	False	False	4	0	0	0
[XẢ KHO GIÁ HUỶ DIỆT] _ Áo gió cao cấp trong lót lưới thời trang nam One 4, phom 50-75kg - Sẵn Hàng	Quảng Ninh	False	20%	False	2	False	0.0	[0, 0, 0, 0, 0, 0]	None	None	23920000000	29900000000	23920000000	29900000000	23920000000	29900000000	None	0	0	0	False	False	8	0	0	0
Thời trang nam thu đông áo khoác nam kiki dày dặn 2 màu - Hàng nhập khẩu	Hà Nội	False	None	False	3	False	0.0	[0, 0, 0, 0, 0, 0]	None	None	56000000000	-1	56000000000	-1	56000000000	0	None	0	0	0	False	False	8	0	0	0
áo hoodie Mobile Legends in hình đẹp ⚡ FREESHIP ⚡Áo Game đẹp giá rẻ thời trang nam	Hà Nội	False	None	False	5	False	0.0	[0, 0, 0, 0, 0, 0]	None	None	17910000000	-1	17910000000	-1	17910000000	0	None	0	2	0	False	False	1	0	0	0
-HÀNG NHẬP KHẨU Áo bò, Áo khoác jean nam in hình Bowie A thời trang nam - màu đen 2020 Liên hệ mua hàng 084.209.1989	Hà Nội	False	None	False	3	False	0.0	[0, 0, 0, 0, 0, 0]	None	None	70060000000	-1	70060000000	-1	70060000000	0	None	0	12	0	False	False	9	0	0	0
Áo Khoác Thời Trang Nam	Nước ngoài	False	None	False	10	False	0.0	[0, 0, 0, 0, 0, 0]	None	None	79860000000	-1	79860000000	-1	79860000000	0	None	0	0	0	False	False	6	0	0	0
Áo Khoác Dù Có Nón Thời Trang Nam	Nước ngoài	False	50%	False	1	False	0.0	[0, 0, 0, 0, 0, 0]	None	None	4090000000	8130000000	4090000000	8130000000	4090000000	8130000000	None	0	0	0	False	False	9	0	0	0
Áo Hoodies Có Nón Dài Tay Thời Trang Nam	Nước ngoài	False	39%	False	0	False	0.0	[0, 0, 0, 0, 0, 0]	None	None	10430000000	16100000000	12320000000	17200000000	10430000000	16100000000	None	0	0	0	False	True	8	0	0	0
Áo Hoodies Có Nón Dài Tay Thời Trang Nam	Nước ngoài	False	33%	False	0	False	0.0	[0, 0, 0, 0, 0, 0]	None	None	11550000000	15200000000	13580000000	17200000000	11550000000	15200000000	None	0	0	0	False	True	9	0	0	0
Áo Khoác Phao Không Tay Khóa Kéo Thời Trang Nam	Nước ngoài	False	40%	False	4	False	0.0	[0, 0, 0, 0, 0, 0]	None	None	22900000000	38100000000	22900000000	38100000000	22900000000	38100000000	None	0	3	0	False	False	9	0	0	0
Áo Khoác Chống Nắng Nam💖FREESHIP💖Áo Khoác Dù Nam Trượt Nước Cao Cấp-Thời Trang Nam-AKDM01	TP. Hồ Chí Minh	False	None	False	10	False	0.0	[0, 0, 0, 0, 0, 0]	None	None	14900000000	-1	28900000000	-1	14900000000	0	None	0	1	0	False	False	9	0	0	0
Áo Hoodies Có Nón Dài Tay Thời Trang Nam	Nước ngoài	False	39%	False	0	False	0.0	[0, 0, 0, 0, 0, 0]	None	None	11900000000	19300000000	12810000000	20500000000	11900000000	19300000000	None	0	0	0	False	True	9	0	0	0
Áo Sweater Phối Lớp Ngoài Thời Trang Nam Cá Tính M-4xl	Nước ngoài	False	None	False	6	False	0.0	[0, 0, 0, 0, 0, 0]	None	None	11160000000	-1	11160000000	-1	11160000000	0	None	0	1	0	False	False	9	0	0	0
🔥HOT🔥 Mẫu áo Hoodie Law One Piece in hình đẹp ⚡ FREESHIP ⚡Áo Anime đẹp giá rẻ thời trang nam	Hà Nội	False	None	False	5	False	0.0	[0, 0, 0, 0, 0, 0]	None	None	20900000000	-1	20900000000	-1	20900000000	0	None	1	0	0	False	False	1	0	0	0
Áo Hoodies Có Nón Dài Tay Thời Trang Nam	Nước ngoài	False	47%	False	0	False	0.0	[0, 0, 0, 0, 0, 0]	None	None	9730000000	18300000000	9730000000	18300000000	9730000000	18300000000	None	0	0	0	False	True	9	0	0	0
Áo Khoác Gió Thời Trang Nam Phong Cách Phái Mạnh	Hà Nội	False	None	False	4	False	0.0	[0, 0, 0, 0, 0, 0]	None	None	39800000000	-1	39800000000	-1	39800000000	0	None	0	0	0	False	False	9	0	0	0
Áo Khoác Thời Trang Nam Phong Cách Lịch Lãm	Nước ngoài	False	50%	False	20	False	0.0	[0, 0, 0, 0, 0, 0]	None	None	21220000000	42220000000	22760000000	45290000000	21220000000	42220000000	None	1	1	0	False	False	9	0	0	0
Áo Hoodies Có Nón Dài Tay 9 Màu Thời Trang Nam	Nước ngoài	False	50%	False	5	False	0.0	[0, 0, 0, 0, 0, 0]	None	None	16630000000	33090000000	16630000000	33090000000	16630000000	33090000000	None	0	0	0	False	False	9	0	0	0
Áo khoác cổ đứng khóa kéo thời trang nam	Nước ngoài	False	32%	False	5	False	0.0	[0, 0, 0, 0, 0, 0]	None	None	22800000000	33300000000	23000000000	33300000000	22800000000	33300000000	None	0	0	0	False	True	9	0	0	0
Áo Hoodies Có Nón Dài Tay Thời Trang Nam Retro	Nước ngoài	False	19%	False	6	False	0.0	[0, 0, 0, 0, 0, 0]	None	None	21700000000	26730000000	21700000000	26730000000	21700000000	26730000000	None	0	0	0	False	False	5	0	0	0
Áo Hoodies Có Nón Dài Tay Thời Trang Nam	Nước ngoài	False	34%	False	6	False	0.0	[0, 0, 0, 0, 0, 0]	None	None	21339300000	32153800000	21848300000	32153800000	21339300000	32153800000	None	0	0	0	False	False	4	0	0	0
áo hoodie Mobile Legends in hình đẹp ⚡ FREESHIP ⚡Áo Game đẹp giá rẻ thời trang nam	Hà Nội	False	None	False	5	False	0.0	[0, 0, 0, 0, 0, 0]	None	None	18706000000	-1	18706000000	-1	18706000000	0	None	0	0	0	False	False	1	0	0	0
Áo Khoác Da Bóng Thời Trang Nam	Nước ngoài	False	28%	False	6	False	0.0	[0, 0, 0, 0, 0, 0]	None	None	29390000000	40370000000	41040000000	57020000000	29390000000	40370000000	None	0	0	0	False	False	8	0	0	0
Áo Khoác Jean Thời Trang Nam 2019	Nước ngoài	False	36%	False	6	False	0.0	[0, 0, 0, 0, 0, 0]	None	None	45410000000	71000000000	45410000000	71000000000	45410000000	71000000000	None	0	0	0	False	False	7	0	0	0
Áo Len Cổ V Dài Tay Thời Trang Nam 2019	Nước ngoài	False	None	False	5	False	0.0	[0, 0, 0, 0, 0, 0]	None	None	26570000000	-1	33890000000	-1	26570000000	0	None	0	2	0	False	False	7	0	0	0
Áo khoác denim phối rách thời trang nam trẻ trung	Nước ngoài	False	48%	False	6	False	0.0	[0, 0, 0, 0, 0, 0]	None	None	26680000000	51580000000	26680000000	51580000000	26680000000	51580000000	None	0	0	0	False	False	6	0	0	0
Áo Hoodies Có Nón Dài Tay 2 Lớp Thời Trang Nam	Nước ngoài	False	45%	False	6	False	0.0	[0, 0, 0, 0, 0, 0]	None	None	31700000000	57730000000	31700000000	57730000000	31700000000	57730000000	None	0	1	0	False	False	9	0	0	0
Set Áo Thun Ngắn Tay Cổ Tròn + Quần Short Lưng Thun Thời Trang Nam	Nước ngoài	False	50%	False	6	False	0.0	[0, 0, 0, 0, 0, 0]	None	None	28240000000	56200000000	28240000000	56200000000	28240000000	56200000000	None	0	0	0	False	False	5	0	0	0
Áo Khoác Da Pu Thời Trang Nam Cá Tính	Nước ngoài	False	None	False	3	False	0.0	[0, 0, 0, 0, 0, 0]	None	None	58692200000	-1	86081800000	-1	58692200000	0	None	0	0	0	False	False	9	0	0	0
Áo Khoác Phao Không Tay Thời Trang Nam	Nước ngoài	False	18%	False	9	False	0.0	[0, 0, 0, 0, 0, 0]	None	None	37360000000	45350000000	37360000000	45350000000	37360000000	45350000000	None	0	0	0	False	False	7	0	0	0
Áo Khoác Da Giả Khóa Kéo Thời Trang Nam	Nước ngoài	False	26%	False	4	False	0.0	[0, 0, 0, 0, 0, 0]	None	None	69782000000	94300000000	69782000000	94300000000	69782000000	94300000000	None	0	0	0	False	False	9	0	0	0
Áo Khoác Cổ Lọ Dài Tay Thời Trang Nam Trung Niên	Nước ngoài	False	None	False	4	False	0.0	[0, 0, 0, 0, 0, 0]	None	None	22550000000	-1	22550000000	-1	22550000000	0	None	0	0	0	False	False	4	0	0	0
áo gió lỗ thời trang nam_taduc.123456789	Hà Nội	False	None	False	1	False	0.0	[0, 0, 0, 0, 0, 0]	None	None	23000000000	-1	23000000000	-1	23000000000	0	None	0	1	0	False	False	5	0	0	0
Áo Nỉ Tay Dài In Chữ Trẻ Trung Thời Trang Nam	Nước ngoài	False	None	False	9	False	0.0	[0, 0, 0, 0, 0, 0]	None	None	99000000000	-1	99000000000	-1	99000000000	0	None	0	0	0	False	False	2	0	0	0
Áo Hoodies Có Nón Dài Tay Thời Trang Nam	Nước ngoài	False	None	False	5	False	0.0	[0, 0, 0, 0, 0, 0]	None	None	16500000000	-1	16500000000	-1	16500000000	0	None	0	0	0	False	False	8	0	0	0
Áo Khoác Thời Trang Nam Phong Cách Hip Hop	Nước ngoài	False	50%	False	20	False	0.0	[0, 0, 0, 0, 0, 0]	None	None	28750000000	57210000000	28750000000	57210000000	28750000000	57210000000	None	0	0	0	False	False	5	0	0	0
Áo Khoác Sơ Mi Tay Dài Trẻ Trung Thời Trang Nam	Nước ngoài	False	19%	False	5	False	0.0	[0, 0, 0, 0, 0, 0]	None	None	23040000000	28420000000	30180000000	37310000000	23040000000	28420000000	None	0	0	0	False	True	3	0	0	0
Áo Khoác Bóng Chày Thời Trang Nam Cá Tính	Nước ngoài	False	50%	False	6	False	0.0	[0, 0, 0, 0, 0, 0]	None	None	24980000000	49700000000	24980000000	49700000000	24980000000	49700000000	None	0	3	0	False	False	9	0	0	0
Áo Khoác Thời Trang Nam Màu Đen A0002	Nước ngoài	False	None	False	1	False	0.0	[0, 0, 0, 0, 0, 0]	None	None	49620000000	-1	49620000000	-1	49620000000	0	None	0	0	0	False	False	2	0	0	0
Set Áo Hoodies Có Nón Dài Tay + Quần Dài Ống Rộng Thời Trang Nam	Nước ngoài	False	25%	False	4	False	0.0	[0, 0, 0, 0, 0, 0]	None	None	28690000000	38200000000	28690000000	38200000000	28690000000	38200000000	None	0	8	0	False	False	9	0	0	0
Áo Khoác Phao Không Tay Thời Trang Nam	Nước ngoài	False	21%	False	4	False	0.0	[0, 0, 0, 0, 0, 0]	None	None	34010000000	42820000000	34010000000	42820000000	34010000000	42820000000	None	0	0	0	False	False	8	0	0	0
Áo Khoác Phao Cộc Tay Lót Nhung Giữ Ấm Thời Trang Nam	Nước ngoài	False	21%	False	2	False	0.0	[0, 0, 0, 0, 0, 0]	None	None	26170000000	32960000000	26170000000	32960000000	26170000000	32960000000	None	0	16	0	False	False	6	0	0	0
Áo Hoodies Có Nón Dài Tay Thời Trang Nam	Nước ngoài	False	None	False	5	False	0.0	[0, 0, 0, 0, 0, 0]	None	None	31325000000	-1	31325000000	-1	31325000000	0	None	0	0	0	False	False	9	0	0	0
Áo Khoác Khóa Kéo Thời Trang Nam Trung Niên	Nước ngoài	False	50%	False	5	False	0.0	[0, 0, 0, 0, 0, 0]	None	None	44417900000	88835800000	49754500000	99508900000	44417900000	88835800000	None	0	0	0	False	False	9	0	0	0
Áo Khoác Thời Trang Nam Màu Tương Phản	Nước ngoài	False	24%	False	5	False	0.0	[0, 0, 0, 0, 0, 0]	None	None	33810000000	44230000000	33810000000	44230000000	33810000000	44230000000	None	0	0	0	False	False	8	0	0	0
Mẫu áo Hoodie Law One Piece in hình đẹp ⚡ FREESHIP ⚡Áo Anime đẹp giá rẻ thời trang nam / uy tín chất lượng	Hà Nội	False	None	False	1	False	0.0	[0, 0, 0, 0, 0, 0]	None	None	19855000000	-1	19855000000	-1	19855000000	0	None	0	0	0	False	False	1	0	0	0
Áo khoác da thời trang nam phong cách retro	Nước ngoài	False	None	False	3	False	0.0	[0, 0, 0, 0, 0, 0]	None	None	57800000000	-1	57800000000	-1	57800000000	0	None	0	6	0	False	False	4	0	0	0
Sẵn hàng - [HÀNG MỚI VỀ] _ Áo gió 2 lớp thời trang nam AG02, phom 45-80kg - Acx23 . - Rẻ vô địch	Bắc Giang	False	20%	False	3	False	0.0	[0, 0, 0, 0, 0, 0]	None	None	23926400000	29908000000	23926400000	29908000000	23926400000	29908000000	None	0	0	0	False	False	9	0	0	0
AHPT Áo khoác phao đại hàn thời trang nam siêu dày ấm cao cấp APHA03-1827	Hà Nội	False	None	False	5	False	0.0	[0, 0, 0, 0, 0, 0]	None	None	126000000000	-1	126000000000	-1	126000000000	0	None	0	13	0	False	False	9	0	0	0
Áo Khoác Bóng Chày Cổ Tròn Thời Trang Nam	Nước ngoài	False	None	False	6	False	0.0	[0, 0, 0, 0, 0, 0]	None	None	78450000000	-1	78450000000	-1	78450000000	0	None	0	0	0	False	False	8	0	0	0
áo khoác sơ mi caro thời trang nam hàn quốc	Nước ngoài	False	None	False	3	False	0.0	[0, 0, 0, 0, 0, 0]	None	None	61600000000	-1	61600000000	-1	61600000000	0	None	0	0	0	False	False	4	0	0	0
Áo Khoác Jean Không Tay Thời Trang Nam	Nước ngoài	False	21%	False	4	False	0.0	[0, 0, 0, 0, 0, 0]	None	None	31900000000	40180000000	31900000000	40180000000	31900000000	40180000000	None	0	0	0	False	False	6	0	0	0
Áo Khoác Phao Cổ Đứng Thời Trang Nam	Nước ngoài	False	None	False	6	False	0.0	[0, 0, 0, 0, 0, 0]	None	None	66530000000	-1	66530000000	-1	66530000000	0	None	0	0	0	False	False	9	0	0	0
( Sang xịn ) Hot [Thời trang nam 2020] ÁO GIÓ HỌA TIẾT CAMO DẰN DI [HOT] "	Quảng Ninh	False	27%	False	3	False	0.0	[0, 0, 0, 0, 0, 0]	None	None	58350600000	79932300000	58350600000	79932300000	58350600000	79932300000	None	0	0	0	False	False	4	0	0	0
áo khoác bomber jacket thời trang nam mẫu mới la*coste nam nữ đều mặc được cổ lông tháo được	Hà Nội	False	20%	False	5	False	0.0	[0, 0, 0, 0, 0, 0]	None	None	270400000000	338000000000	270400000000	338000000000	270400000000	338000000000	None	0	0	0	False	False	9	0	0	0
Áo Khoác Denim Không Tay Thời Trang Nam	Nước ngoài	False	41%	False	6	False	0.0	[0, 0, 0, 0, 0, 0]	None	None	24240000000	41040000000	24240000000	41040000000	24240000000	41040000000	None	0	0	0	False	False	9	0	0	0
Áo Khoác Dù Nam Unisex Hàng Đôc Sn-Ak05, Thời Trang Nam Phái Mạnh	TP. Hồ Chí Minh	False	19%	False	1	False	0.0	[0, 0, 0, 0, 0, 0]	None	None	11800000000	14500000000	11800000000	14500000000	11800000000	14500000000	None	0	0	0	False	False	3	0	0	0
ÁO KHOÁT THỜI TRANG NAM	TP. Hồ Chí Minh	False	None	False	1	False	0.0	[0, 0, 0, 0, 0, 0]	None	None	8900000000	-1	8900000000	-1	8900000000	0	None	0	1	0	False	False	3	0	0	0
áo thun tay dài in chữ trẻ trung thời trang nam	Nước ngoài	False	32%	False	8	False	0.0	[0, 0, 0, 0, 0, 0]	None	None	11980000000	17710000000	11980000000	17710000000	11980000000	17710000000	None	0	0	0	False	False	6	0	0	0
Áo khoác thời trang nam phong cách Nhật Bản	Nước ngoài	False	None	False	4	False	0.0	[0, 0, 0, 0, 0, 0]	None	None	18200000000	-1	18200000000	-1	18200000000	0	None	0	2	0	False	False	9	0	0	0
Áo khoác thời trang nam có dây kéo	Nước ngoài	False	49%	False	7	False	0.0	[0, 0, 0, 0, 0, 0]	None	None	18700000000	36500000000	18700000000	36500000000	18700000000	36500000000	None	0	0	0	False	True	9	0	0	0
Áo Khoác Thời Trang Nam	Nước ngoài	False	21%	False	5	False	0.0	[0, 0, 0, 0, 0, 0]	None	None	24470000000	31050000000	24470000000	31050000000	24470000000	31050000000	None	2	0	0	False	False	9	0	0	0
Áo khoác thời trang nam màu ngụy trang	Nước ngoài	False	33%	False	0	False	0.0	[0, 0, 0, 0, 0, 0]	None	None	18224000000	27200000000	18760000000	28000000000	18224000000	27200000000	None	1	2	0	False	True	9	0	0	0
Áo Khoác Dù Nam Trượt Nước Cao Cấp,Thời Trang Nam-AKDM01 _VNXK # Cao cấp _ AJ	TP. Hồ Chí Minh	False	36%	False	6	False	0.0	[0, 0, 0, 0, 0, 0]	None	None	16800000000	26268000000	16800000000	26268000000	16800000000	26268000000	None	0	3	0	False	False	8	0	0	0
Áo Khoác Dù Nam Chống Mưa,Nắng Cao Cấp,Thời Trang Nam-AKD01 _VNXK # Cao cấp	TP. Hồ Chí Minh	False	29%	False	6	False	0.0	[0, 0, 0, 0, 0, 0]	None	None	16900000000	23880000000	16900000000	23880000000	16900000000	23880000000	None	0	1	0	False	True	9	0	0	0
Áo khoác hóa thân siêu anh hùng thời trang nam cá tính	Nước ngoài	False	33%	False	0	False	0.0	[0, 0, 0, 0, 0, 0]	None	None	20234000000	30200000000	20636000000	30800000000	20234000000	30200000000	None	3	0	0	False	True	9	0	0	0
Áo Khoác Thời Trang Nam Họa Tiết Chữ Tiếng Anh	Nước ngoài	False	None	False	4	False	0.0	[0, 0, 0, 0, 0, 0]	None	None	23990000000	-1	23990000000	-1	23990000000	0	None	0	0	0	False	False	9	1	0	0
Áo Khoác Dù Nam Trượt Nước Cao Cấp,Thời Trang Nam-AKDM01 _VNXK _Cao cấp # AJ	TP. Hồ Chí Minh	False	50%	False	6	False	0.0	[0, 0, 0, 0, 0, 0]	None	None	19900000000	39490000000	19900000000	39490000000	19900000000	39490000000	None	1148	2	0	False	False	8	0	0	0
Áo khoác thời trang nam màu trơn	Nước ngoài	False	None	False	4	False	0.0	[0, 0, 0, 0, 0, 0]	None	None	20500000000	-1	20500000000	-1	20500000000	0	None	0	0	0	False	True	9	0	0	0
[Xả Lỗ] Áo Khoác Len Dạ Kiểu Vest Cao Cấp Ak094 Áo Khoác Măng Tô Thời Trang Nam 2019 - thienvuongshop	Hà Nội	False	50%	False	5	False	0.0	[0, 0, 0, 0, 0, 0]	None	None	29950000000	59900000000	29950000000	59900000000	29950000000	59900000000	None	5	175	0	False	False	7	0	0	0
Áo Khoác Dù Nam Chống Mưa,Nắng Cao Cấp,Thời Trang Nam _VNXK _Cao cấp	TP. Hồ Chí Minh	False	None	False	9	False	0.0	[0, 0, 0, 0, 0, 0]	None	None	23880000000	-1	23880000000	-1	23880000000	0	None	0	0	0	False	True	9	0	0	0
Áo Khoác Jean Thời Trang Nam	Nước ngoài	False	None	False	1	False	0.0	[0, 0, 0, 0, 0, 0]	None	None	27680000000	-1	27680000000	-1	27680000000	0	None	0	0	0	False	False	6	0	0	0
Áo Khoác Da Pu Thời Trang Nam Cá Tính	Nước ngoài	False	None	False	6	False	0.0	[0, 0, 0, 0, 0, 0]	None	None	56370000000	-1	56370000000	-1	56370000000	0	None	0	0	0	False	False	8	0	0	0
Men Coats Denim Coat Jacket Thời Trang Nam Áo khoác Áo khoác jeans Áo khoác jean đẹp phong cách Hàn quốc áo khoác nam W	Nước ngoài	False	None	False	5	False	0.0	[0, 0, 0, 0, 0, 0]	None	None	84900000000	-1	84900000000	-1	84900000000	0	None	1	13	0	False	False	8	0	0	0
 Áo Khoác Mỏng Thời Trang Nam Dáng Áo Ves	Hà Nội	False	None	False	1	False	0.0	[0, 0, 0, 0, 0, 0]	None	None	101000000000	-1	101000000000	-1	101000000000	0	None	0	22	0	False	False	1	0	0	0
Men Jacket Denim Coat Outwear Thời Trang Nam Áo khoác Áo khoác jeans Áo khoác jean đẹp phong cách Hàn quốc áo khoác nam	Nước ngoài	False	None	False	6	False	0.0	[0, 0, 0, 0, 0, 0]	None	None	45900000000	-1	45900000000	-1	45900000000	0	None	4	10	0	False	False	9	0	0	0
Men Jacket Denim Mens Coat Thời Trang Nam Áo khoác Áo khoác jeans Áo khoác jean đẹp phong cách Hàn quốc áo khoác nam TOP	Nước ngoài	False	None	False	6	False	0.0	[0, 0, 0, 0, 0, 0]	None	None	46300000000	-1	46300000000	-1	46300000000	0	None	3	6	0	False	False	7	0	0	0
Áo Khoác Bóng Chày Thời Trang Nam	Nước ngoài	False	None	False	5	False	0.0	[0, 0, 0, 0, 0, 0]	None	None	29790000000	-1	29790000000	-1	29790000000	0	None	0	0	0	False	False	9	0	0	0
Áo Khoác Thời Trang Nam	Nước ngoài	False	None	False	5	False	0.0	[0, 0, 0, 0, 0, 0]	None	None	38660000000	-1	38660000000	-1	38660000000	0	None	0	0	0	False	True	9	0	0	0
Áo Hoodie Thời Trang Nam Phong Cách Roman 02	Nước ngoài	False	2%	False	4	False	0.0	[0, 0, 0, 0, 0, 0]	None	None	53020000000	54160000000	53020000000	54160000000	53020000000	54160000000	None	0	0	0	False	False	8	0	0	0
Áo Khoác Thời Trang Nam Họa Tiết Hình Con Mèo	Nước ngoài	False	5%	False	3	False	0.0	[0, 0, 0, 0, 0, 0]	None	None	28380000000	29860000000	28380000000	29860000000	28380000000	29860000000	None	1	0	0	False	False	8	0	0	0
Áo Khoác Thời Trang Nam	Nước ngoài	False	39%	False	10	False	0.0	[0, 0, 0, 0, 0, 0]	None	None	32850000000	53690000000	32850000000	53690000000	32850000000	53690000000	None	0	0	0	False	True	9	0	0	0
Fashion Men Jacket Denim Coat Thời Trang Nam Áo khoác Áo khoác jeans Áo khoác jean đẹp phong cách Hàn quốc áo khoác nam	Nước ngoài	False	None	False	5	False	0.0	[0, 0, 0, 0, 0, 0]	None	None	63900000000	-1	63900000000	-1	63900000000	0	None	0	6	0	False	False	9	0	0	0
Áo Khoác Dù Nam Cao Cấp,Thời Trang Nam-AKDND03 _VNXK _Cao cấp _ AJ	TP. Hồ Chí Minh	False	None	False	9	False	0.0	[0, 0, 0, 0, 0, 0]	None	None	26268000000	-1	26268000000	-1	26268000000	0	None	0	0	0	False	False	2	0	0	0
Áo Khoác Dù Nam Cao Cấp,Thời Trang Nam _VNXK _Cao cấp _ AJ	TP. Hồ Chí Minh	False	None	False	9	False	0.0	[0, 0, 0, 0, 0, 0]	None	None	26213000000	-1	26213000000	-1	26213000000	0	None	0	0	0	False	False	7	0	0	0
Áo khoác thời trang nam phong cách Hàn Quốc size M-5XL	Nước ngoài	False	None	False	7	False	0.0	[0, 0, 0, 0, 0, 0]	None	None	57624000000	-1	57624000000	-1	57624000000	0	None	1	0	0	False	True	6	0	0	0
áo khoác thời trang nam	Nước ngoài	False	None	False	8	False	0.0	[0, 0, 0, 0, 0, 0]	None	None	59500000000	-1	59500000000	-1	59500000000	0	None	0	0	0	False	True	8	0	0	0
ÁO PHAO THỜI TRANG NAM SIÊU ẤM  LÓT LÔNG MÀU GHI TỐI	Hà Nội	False	50%	False	4	False	0.0	[0, 0, 0, 0, 0, 0]	None	None	29900000000	59800000000	29900000000	59800000000	29900000000	59800000000	None	0	0	0	False	True	5	0	0	0
Áo khoác thể thao thời trang nam năng động trẻ trung	Nước ngoài	False	None	False	6	False	0.0	[0, 0, 0, 0, 0, 0]	None	None	67483400000	-1	67483400000	-1	67483400000	0	None	1	0	0	False	False	9	0	0	0
Áo Khoác Dù Nam Cao Cấp,Thời Trang Nam-ASSSS03 _VNXK _Cao cấp _ AJ	TP. Hồ Chí Minh	False	None	False	9	False	0.0	[0, 0, 0, 0, 0, 0]	None	None	26268000000	-1	26268000000	-1	26268000000	0	None	0	0	0	False	False	2	0	0	0
Áo Khoác Da Pu Thời Trang Nam Cá Tính	Nước ngoài	False	None	False	5	False	0.0	[0, 0, 0, 0, 0, 0]	None	None	37120000000	-1	60620000000	-1	37120000000	0	None	0	0	0	False	False	9	0	0	0
Áo Thun Bóng Rổ Cộc Tay Thời Trang Nam	Nước ngoài	False	50%	False	6	False	0.0	[0, 0, 0, 0, 0, 0]	None	None	38380000000	76090000000	38380000000	76090000000	38380000000	76090000000	None	0	0	0	False	False	6	0	0	0
Áo Khoác Jean Không Tay Thời Trang Nam	Nước ngoài	False	24%	False	9	False	0.0	[0, 0, 0, 0, 0, 0]	None	None	40260000000	53030000000	40260000000	53030000000	40260000000	53030000000	None	0	0	0	False	False	5	0	0	0
Set Đồ Thể Thao Dài Tay Khóa Kéo Thời Trang Nam	Nước ngoài	False	31%	False	20	False	0.0	[0, 0, 0, 0, 0, 0]	None	None	35940000000	52320000000	37170000000	54090000000	35940000000	52320000000	None	0	0	0	False	True	6	0	0	0
Men Jacket Denim Coat Thời Trang Nam Áo khoác Áo khoác jeans Áo khoác jean đẹp phong cách Hàn quốc áo khoác nam	Nước ngoài	False	None	False	5	False	0.0	[0, 0, 0, 0, 0, 0]	None	None	59900000000	-1	59900000000	-1	59900000000	0	None	0	12	0	False	False	9	0	0	0
Áo Khoác Thời Trang Nam Họa Tiết Hoa Văn	Nước ngoài	False	None	False	6	False	0.0	[0, 0, 0, 0, 0, 0]	None	None	61890000000	-1	61890000000	-1	61890000000	0	None	1	0	0	False	True	8	0	0	0
Áo khoác da thời trang nam	Nước ngoài	False	None	False	4	False	0.0	[0, 0, 0, 0, 0, 0]	None	None	93900000000	-1	93900000000	-1	93900000000	0	None	7	1	0	False	False	8	0	0	0
Áo khoác phao thời trang nam năng động trẻ trung	Nước ngoài	False	None	False	7	False	0.0	[0, 0, 0, 0, 0, 0]	None	None	57131200000	-1	57131200000	-1	57131200000	0	None	0	0	0	False	False	9	0	0	0
Áo Khoác Ghi Lê Nhiều Túi Thời Trang Nam	Nước ngoài	False	36%	False	5	False	0.0	[0, 0, 0, 0, 0, 0]	None	None	42250000000	65680000000	42250000000	65680000000	42250000000	65680000000	None	0	0	0	False	False	5	0	0	0
Áo Khoác Phao Lót Nhung Giữ Ấm Thời Trang Nam Trung Niên	Nước ngoài	False	None	False	4	False	0.0	[0, 0, 0, 0, 0, 0]	None	None	64590000000	-1	72520000000	-1	64590000000	0	None	0	0	0	False	False	8	0	0	0
áo khoác thời trang nam	Nước ngoài	False	None	False	5	False	0.0	[0, 0, 0, 0, 0, 0]	None	None	85510000000	-1	85510000000	-1	85510000000	0	None	0	0	0	False	False	8	0	0	0
Áo Khoác Thời Trang Nam Phong Cách Trung Hoa	Nước ngoài	False	20%	False	14	False	0.0	[0, 0, 0, 0, 0, 0]	None	None	74810000000	93840000000	74810000000	93840000000	74810000000	93840000000	None	0	0	0	False	True	9	0	0	0
Áo khoác thời trang nam	Nước ngoài	False	20%	False	4	False	0.0	[0, 0, 0, 0, 0, 0]	None	None	43680000000	54600000000	43680000000	54600000000	43680000000	54600000000	None	1	0	0	False	True	5	0	0	0
