name	shop_location	shopee_verified	discount	is_adult	options	show_official_shop_label_in_title	rating_star	rating_count	flash_sale	upcoming_flash_sale	price_min	price_min_before_discoun	price_max	price_max_before_discount	price	price_before_discount	coin_earn_label	liked_count	view_count	cmt_count	is_preferred_plus_seller	show_free_shipping	images	video_info_list	sold	historical_sold
Áo Khoác Thời Trang Nam	Nước ngoài	False	25%	False	7	False	0.0	[0, 0, 0, 0, 0, 0]	None	None	69170000000	92610000000	69170000000	92610000000	69170000000	92610000000	None	0	0	0	False	False	6	0	0	0
Áo Khoác Phao Không Tay Trẻ Trung Thời Trang Nam 2020	Nước ngoài	False	27%	False	5	False	0.0	[0, 0, 0, 0, 0, 0]	None	None	69750000000	95390000000	69750000000	95390000000	69750000000	95390000000	None	0	0	0	False	False	7	0	0	0
Áo Khoác Bóng Chày Phối Màu Trẻ Trung Thời Trang Nam	Nước ngoài	False	30%	False	4	False	0.0	[0, 0, 0, 0, 0, 0]	None	None	40060000000	57030000000	40060000000	57030000000	40060000000	57030000000	None	0	0	0	False	False	9	0	0	0
Áo Khoác Da Pu Thời Trang Nam Lịch Lãm	Nước ngoài	False	None	False	6	False	0.0	[0, 0, 0, 0, 0, 0]	None	None	82950000000	-1	98680000000	-1	82950000000	0	None	1	1	0	False	False	9	0	0	0
Áo khoác dáng rộng thời trang nam trẻ trung chất lượng	Nước ngoài	False	None	False	6	False	0.0	[0, 0, 0, 0, 0, 0]	None	None	79670000000	-1	79670000000	-1	79670000000	0	None	0	0	0	False	False	9	0	0	0
Áo Khoác Denim Có Nón Thời Trang Nam	Nước ngoài	False	23%	False	5	False	0.0	[0, 0, 0, 0, 0, 0]	None	None	48070000000	62710000000	48070000000	62710000000	48070000000	62710000000	None	0	0	0	False	False	9	0	0	0
Áo Khoác Jeans Phối Màu Trẻ Trung Thời Trang Nam	Nước ngoài	False	None	False	5	False	0.0	[0, 0, 0, 0, 0, 0]	None	None	82720000000	-1	82720000000	-1	82720000000	0	None	0	0	0	False	False	5	0	0	0
Áo Nỉ Dài Tay Cổ Tròn Thời Trang Nam Trung Niên	Nước ngoài	False	50%	False	5	False	0.0	[0, 0, 0, 0, 0, 0]	None	None	35346100000	70692100000	35346100000	70692100000	35346100000	70692100000	None	0	0	0	False	False	9	0	0	0
Set Áo Thun Ngắn Tay Cổ Tròn + Quần Dài Thể Thao Thời Trang Nam	Nước ngoài	False	None	False	6	False	0.0	[0, 0, 0, 0, 0, 0]	None	None	35130000000	-1	35130000000	-1	35130000000	0	None	0	0	0	False	False	7	0	0	0
[XẢ KHO GIÁ HUỶ DIỆT] _ Áo gió cao cấp trong lót lưới thời trang nam One 4, phom 50-75kg -BI9721 .	Hải Phòng	False	None	False	2	False	0.0	[0, 0, 0, 0, 0, 0]	None	None	23620000000	-1	23620000000	-1	23620000000	0	None	0	0	0	False	False	8	0	0	0
Áo Khoác Ghi Lê Nhiều Túi Thời Trang Nam	Nước ngoài	False	None	False	6	False	0.0	[0, 0, 0, 0, 0, 0]	None	None	63570000000	-1	63570000000	-1	63570000000	0	None	0	0	0	False	False	9	0	0	0
Áo khoác Jeans thời trang nam phong cách Hàn Quốc	Nước ngoài	False	None	False	3	False	0.0	[0, 0, 0, 0, 0, 0]	None	None	42100000000	-1	42100000000	-1	42100000000	0	None	0	0	0	False	False	4	0	0	0
Áo Khoác Phao Không Tay Giữ Ấm Thời Trang Nam	Nước ngoài	False	None	False	5	False	0.0	[0, 0, 0, 0, 0, 0]	None	None	72305300000	-1	72305300000	-1	72305300000	0	None	0	0	0	False	True	9	0	0	0
[XẢ KHO GIÁ HUỶ DIỆT] _ Áo gió cao cấp trong lót lưới thời trang nam One 4, phom 50-75kg -Re111 !	Hà Nội	False	None	False	2	False	0.0	[0, 0, 0, 0, 0, 0]	None	None	29905000000	-1	29905000000	-1	29905000000	0	None	0	0	0	False	False	8	0	0	0
Áo Khoác Bóng Chày Thời Trang Nam 2019	Nước ngoài	False	41%	False	5	False	0.0	[0, 0, 0, 0, 0, 0]	None	None	23790000000	40270000000	23790000000	40270000000	23790000000	40270000000	None	0	0	0	False	False	3	0	0	0
Áo Khoác Denim Thời Trang Nam	Nước ngoài	False	None	False	6	False	0.0	[0, 0, 0, 0, 0, 0]	None	None	71220000000	-1	71220000000	-1	71220000000	0	None	0	0	0	False	False	9	0	0	0
Áo Hoodies Có Nón Dài Tay Giả Hai Lớp Thời Trang Nam	Nước ngoài	False	42%	False	6	False	0.0	[0, 0, 0, 0, 0, 0]	None	None	33480000000	57730000000	33480000000	57730000000	33480000000	57730000000	None	0	0	0	False	False	9	0	0	0
Áo Khoác Phao Không Tay Thời Trang Nam Trung Niên	Nước ngoài	False	41%	False	5	False	0.0	[0, 0, 0, 0, 0, 0]	None	None	17440000000	29420000000	17440000000	29420000000	17440000000	29420000000	None	0	0	0	False	False	9	0	0	0
Sẵn hàng - [Thời trang nam 2020] ÁO GIÓ CHỐNG NƯỚC 2 LỚP LÓT LƯỚI TRÁNG GƯƠNG [HOT] - Acx23 ☭ - Rẻ vô địch	Bắc Giang	False	20%	False	4	False	0.0	[0, 0, 0, 0, 0, 0]	None	None	50464800000	63081000000	50464800000	63081000000	50464800000	63081000000	None	0	0	0	False	False	6	0	0	0
Áo Khoác Phao Không Tay Trẻ Trung Thời Trang Nam	Nước ngoài	False	None	False	6	False	0.0	[0, 0, 0, 0, 0, 0]	None	None	42830000000	-1	47940000000	-1	42830000000	0	None	0	0	0	False	False	9	0	0	0
🍀 Hot [Siêu Quà] Áo khoác phao đại hàn thời trang nam siêu dày ấm cao cấp APHA03-1827 . ⇹ .	Thái Bình	False	None	False	5	False	0.0	[0, 0, 0, 0, 0, 0]	None	None	46372700000	-1	46372700000	-1	46372700000	0	None	0	0	0	False	False	9	0	0	0
Áo Phao Nam Soái Ca 3 Lớp Khóa Mũ Thời Trang Nam Cao Cấp	Nam Định	True	25%	False	3	False	0.0	[0, 0, 0, 0, 0, 0]	None	None	20625000000	27500000000	20625000000	27500000000	20625000000	27500000000	None	0	31	0	False	False	6	0	0	0
Áo Hoodies Có Nón Dài Tay Thời Trang Nam	Nước ngoài	False	40%	False	0	False	0.0	[0, 0, 0, 0, 0, 0]	None	None	11700000000	19500000000	12780000000	21300000000	11700000000	19500000000	None	0	0	0	False	False	9	0	0	0
⚜️FREESHIP⚜️ Áo khoác nỉ thời trang cao cấp nam , áo khoác tròng cổ thời trang nam MT31 Chất Liệu Tốt	TP. Hồ Chí Minh	False	48%	False	3	False	0.0	[0, 0, 0, 0, 0, 0]	None	None	11440000000	22000000000	11440000000	22000000000	11440000000	22000000000	None	0	7	0	False	False	5	0	0	0
Áo Bò Nam , Áo Khoác Thời Trang Nam 2020	Hà Nội	False	None	False	3	False	0.0	[0, 0, 0, 0, 0, 0]	None	None	26900000000	-1	26900000000	-1	26900000000	0	None	1	22	0	False	False	4	0	0	0
Áo khoác thiết kế thể thao đẹp mắt thời trang nam King168 , áo khoác chống nắng cao cấp nam F04	TP. Hồ Chí Minh	False	29%	False	3	False	0.0	[0, 0, 0, 0, 0, 0]	None	None	16000000000	22500000000	16000000000	22500000000	16000000000	22500000000	None	0	9	0	False	False	5	0	0	0
[THỜI TRANG NAM] ÁO KHOÁC VẢI TRƯỢT NƯỚC THỂ THAO	TP. Hồ Chí Minh	False	None	False	4	False	0.0	[0, 0, 0, 0, 0, 0]	None	None	50000000000	-1	50000000000	-1	50000000000	0	None	0	0	0	False	False	9	0	0	0
Áo hoodie thời trang nam	Nước ngoài	False	None	False	8	False	0.0	[0, 0, 0, 0, 0, 0]	None	None	29900000000	-1	29900000000	-1	29900000000	0	None	0	1	0	False	True	3	0	0	0
Áo Hoodies Có Nón Dài Tay Thời Trang Nam	Nước ngoài	False	40%	False	5	False	0.0	[0, 0, 0, 0, 0, 0]	None	None	15180000000	25300000000	15180000000	25300000000	15180000000	25300000000	None	0	8	0	False	False	9	0	0	0
Áo Khoác Có Túi Thời Trang Nam	Nước ngoài	False	36%	False	5	False	0.0	[0, 0, 0, 0, 0, 0]	None	None	33690000000	52720000000	47350000000	74480000000	33690000000	52720000000	None	0	3	0	False	False	9	0	0	0
Áo Len Cổ Tròn Dài Tay Thời Trang Nam	Nước ngoài	False	24%	False	6	False	0.0	[0, 0, 0, 0, 0, 0]	None	None	26980000000	35430000000	26980000000	35430000000	26980000000	35430000000	None	0	1	0	False	False	9	0	0	0
ÁO KHOÁC THỜI TRANG NAM SIÊU ĐẸP KẾT HỢP GĂNG TAY CAO CẤP FAIRY TAIL	Hà Nội	False	13%	False	4	False	0.0	[0, 0, 0, 0, 0, 0]	None	None	34800000000	40000000000	34800000000	40000000000	34800000000	40000000000	None	0	1	0	False	False	6	0	0	0
Set Áo Hoodies Có Nón Dài Tay + Quần Dài Thời Trang Nam	Nước ngoài	False	48%	False	5	False	0.0	[0, 0, 0, 0, 0, 0]	None	None	43900000000	84300000000	43900000000	84300000000	43900000000	84300000000	None	0	0	0	False	False	9	0	0	0
Áo Khoác Cổ Đứng Thời Trang Nam	Nước ngoài	False	42%	False	4	False	0.0	[0, 0, 0, 0, 0, 0]	None	None	37500000000	61400000000	37600000000	64900000000	37500000000	61400000000	None	0	0	0	False	False	9	0	0	0
Áo Hoodie Tay Ngắn In Số 1 Thời Trang Năm 2020 Cho Nam	Nước ngoài	False	20%	False	4	False	0.0	[0, 0, 0, 0, 0, 0]	None	None	14130000000	17660000000	14130000000	17660000000	14130000000	17660000000	None	0	6	0	False	False	5	0	0	0
Áo Khoác Jeans Có Nón Thời Trang Nam Cá Tính	Nước ngoài	False	30%	False	0	False	0.0	[0, 0, 0, 0, 0, 0]	None	None	30170000000	43100000000	33390000000	47700000000	30170000000	43100000000	None	0	0	0	False	False	9	0	0	0
Áo Khoác Bóng Chày Thời Trang Nam	Nước ngoài	False	50%	False	6	False	0.0	[0, 0, 0, 0, 0, 0]	None	None	28770000000	57240000000	28770000000	57240000000	28770000000	57240000000	None	0	0	0	False	False	8	0	0	0
Áo Khoác Jeans Có Nón Thời Trang Nam	Nước ngoài	False	36%	False	2	False	0.0	[0, 0, 0, 0, 0, 0]	None	None	48300000000	75520000000	63480000000	98880000000	48300000000	75520000000	None	0	0	0	False	False	9	0	0	0
Áo Khoác Thời Trang Nam Trẻ Trung Cá Tính	Nước ngoài	False	50%	False	2	False	0.0	[0, 0, 0, 0, 0, 0]	None	None	39330000000	78260000000	39330000000	78260000000	39330000000	78260000000	None	0	0	0	False	False	5	0	0	0
Áo Hoodie Thời Trang Nam 2019	Nước ngoài	False	33%	False	20	False	0.0	[0, 0, 0, 0, 0, 0]	None	None	29380000000	43760000000	29380000000	43760000000	29380000000	43760000000	None	0	0	0	False	False	9	0	0	0
Áo khoác denim giả 2 lớp dáng rộng thời trang nam Hàn Quốc	Nước ngoài	False	25%	False	5	False	0.0	[0, 0, 0, 0, 0, 0]	None	None	48730000000	65380000000	48730000000	65380000000	48730000000	65380000000	None	1	4	0	False	False	9	0	0	0
áo hoodie Mobile Legends in hình đẹp ⚡ FREESHIP ⚡Áo Game đẹp giá rẻ thời trang nam	Hà Nội	False	None	False	1	False	0.0	[0, 0, 0, 0, 0, 0]	None	None	20298000000	-1	20298000000	-1	20298000000	0	None	0	0	0	False	False	1	0	0	0
Áo Khoác Phao Khóa Kéo Thời Trang Nam	Nước ngoài	False	48%	False	5	False	0.0	[0, 0, 0, 0, 0, 0]	None	None	29290000000	56570000000	29580000000	56570000000	29290000000	56570000000	None	0	0	0	False	False	9	0	0	0
Áo Khoác Phao Không Tay Thời Trang Nam	Nước ngoài	False	50%	False	7	False	0.0	[0, 0, 0, 0, 0, 0]	None	None	22700000000	45400000000	22700000000	45400000000	22700000000	45400000000	None	1	5	0	False	False	9	0	0	0
Áo Len Cổ Tròn Dài Tay Thời Trang Nam	Nước ngoài	False	50%	False	3	False	0.0	[0, 0, 0, 0, 0, 0]	None	None	36260000000	72160000000	36650000000	72930000000	36260000000	72160000000	None	0	0	0	False	False	9	0	0	0
Áo Khoác Thời Trang Nam 156	Nước ngoài	False	39%	False	4	False	0.0	[0, 0, 0, 0, 0, 0]	None	None	48490000000	79500000000	48490000000	79500000000	48490000000	79500000000	None	0	0	0	False	False	9	0	0	0
Áo khoác phao dày giữ ấm mùa đông thời trang nam	Nước ngoài	False	49%	False	8	False	0.0	[0, 0, 0, 0, 0, 0]	None	None	32340000000	63620000000	45290000000	89610000000	32340000000	63620000000	None	0	4	0	False	False	6	0	0	0
Áo Khoác Hoodie Rách Thời Trang Nam 2019	Nước ngoài	False	50%	False	5	False	0.0	[0, 0, 0, 0, 0, 0]	None	None	30830000000	61350000000	30830000000	61350000000	30830000000	61350000000	None	0	0	0	False	False	5	0	0	0
Áo Khoác Không Tay Có Nón Thời Trang Nam	Nước ngoài	False	None	False	4	False	0.0	[0, 0, 0, 0, 0, 0]	None	None	96600000000	-1	96600000000	-1	96600000000	0	None	0	0	0	False	False	6	0	0	0
Áo Khoác Bóng Chày Thời Trang Nam 2020	Nước ngoài	False	None	False	6	False	0.0	[0, 0, 0, 0, 0, 0]	None	None	27640000000	-1	38870000000	-1	27640000000	0	None	0	0	0	False	False	9	0	0	0
Áo Khoác Dạ Thời Trang Nam	Nước ngoài	False	40%	False	4	False	0.0	[0, 0, 0, 0, 0, 0]	None	None	26760100000	44600200000	26760100000	44600200000	26760100000	44600200000	None	0	0	0	False	False	9	0	0	0
[KM Khủng ] áo hoodie Mobile Legends in hình đẹp ⚡ FREESHIP ⚡Áo Game đẹp giá rẻ thời trang nam rẻ nhất ..!	Hà Nội	False	None	False	5	False	0.0	[0, 0, 0, 0, 0, 0]	None	None	21890000000	-1	21890000000	-1	21890000000	0	None	0	0	0	False	False	1	0	0	0
[SALE GIÁ GỐC] áo hoodie Mobile Legends in hình đẹp ⚡ FREESHIP ⚡Áo Game đẹp giá rẻ thời trang nam	Hà Nội	False	None	False	1	False	0.0	[0, 0, 0, 0, 0, 0]	None	None	19800000000	-1	19800000000	-1	19800000000	0	None	0	0	0	False	False	1	0	0	0
Áo Khoác Thời Trang Nam Màu Trơn	Nước ngoài	False	5%	False	15	False	0.0	[0, 0, 0, 0, 0, 0]	None	None	21480000000	22610000000	21480000000	22610000000	21480000000	22610000000	None	0	0	0	False	False	9	0	0	0
Thời Trang Nam, áo khoác jeans loang màu, RL1450 - TRẮNG	TP. Hồ Chí Minh	False	None	False	2	False	0.0	[0, 0, 0, 0, 0, 0]	None	None	41000000000	-1	41000000000	-1	41000000000	0	None	1	5	0	False	False	6	0	0	0
Áo Khoác Da Lịch Lãm Thời Trang Nam 2020	Nước ngoài	False	36%	False	6	False	0.0	[0, 0, 0, 0, 0, 0]	None	None	47180000000	73860000000	58320000000	90990000000	47180000000	73860000000	None	0	1	0	False	False	7	0	0	0
Áo Khoác Jean Thời Trang Nam	Nước ngoài	False	None	False	3	False	0.0	[0, 0, 0, 0, 0, 0]	None	None	46760000000	-1	46760000000	-1	46760000000	0	None	0	0	0	False	False	8	0	0	0
áo khoác nhẹ thời trang nam kiểu dáng rộng hàng bigsize	Hà Nội	False	25%	False	7	False	0.0	[0, 0, 0, 0, 0, 0]	None	None	48900000000	65000000000	48900000000	65000000000	48900000000	65000000000	None	1	4	0	False	True	9	0	0	0
✉Quần áo chống nắng mỏng năm 2020 mới xuân hè thu khoác hàn quốc hợp thời trang nam trẻ trung đẹp trai	Hà Nội	False	None	False	6	False	0.0	[0, 0, 0, 0, 0, 0]	None	None	37300000000	-1	37300000000	-1	37300000000	0	None	0	3	0	False	False	3	0	0	0
Áo Hoodies Có Nón Dài Tay Thời Trang Nam	Nước ngoài	False	40%	False	7	False	0.0	[0, 0, 0, 0, 0, 0]	None	None	19699800000	32833000000	19699800000	32833000000	19699800000	32833000000	None	0	0	0	False	False	9	0	0	0
Áo Hoodies Có Nón Dài Tay In Hình 3d Thời Trang Nam	Nước ngoài	False	50%	False	7	False	0.0	[0, 0, 0, 0, 0, 0]	None	None	30540000000	60760000000	30540000000	60760000000	30540000000	60760000000	None	0	0	0	False	False	6	0	0	0
áo hoodie Mobile Legends in hình đẹp ⚡ FREESHIP ⚡Áo Game đẹp giá rẻ thời trang nam	Hà Nội	False	None	False	5	False	0.0	[0, 0, 0, 0, 0, 0]	None	None	21740700000	-1	21740700000	-1	21740700000	0	None	0	0	0	False	False	1	0	0	0
[ Giảm 28% ] [Thời trang nam 2020] ÁO GIÓ CHỐNG NƯỚC 2 LỚP LÓT LƯỚI TRÁNG GƯƠNG [HOT] V09 *	Hải Phòng	False	None	False	4	False	0.0	[0, 0, 0, 0, 0, 0]	None	None	50681700000	-1	50681700000	-1	50681700000	0	None	0	0	0	False	False	6	0	0	0
Áo Khoác Denim Phối Màu Thời Trang Nam	Nước ngoài	False	None	False	5	False	0.0	[0, 0, 0, 0, 0, 0]	None	None	38500000000	-1	38500000000	-1	38500000000	0	None	0	0	0	False	False	8	0	0	0
Áo Hoodie Màu Sắc Thời Trang Nam	Nước ngoài	False	None	False	4	False	0.0	[0, 0, 0, 0, 0, 0]	None	None	57070000000	-1	57070000000	-1	57070000000	0	None	0	0	0	False	False	8	0	0	0
thời trang nam áo khoác nhung lông chồn xu hướng nam phiên bản hàn quốc thu đông 2020 !	Quảng Ninh	False	None	False	5	False	0.0	[0, 0, 0, 0, 0, 0]	None	None	175000000000	-1	175000000000	-1	175000000000	0	None	0	5	0	False	False	4	0	0	0
Áo Khoác Thời Trang Nam Phong Cách Hàn Quốc Cá Tính	Nước ngoài	False	49%	False	4	False	0.0	[0, 0, 0, 0, 0, 0]	None	None	33070000000	64410000000	33070000000	64410000000	33070000000	64410000000	None	0	0	0	False	False	8	0	0	0
Áo Khoác Khóa Kéo Chéo Thời Trang Nam	Nước ngoài	False	50%	False	4	False	0.0	[0, 0, 0, 0, 0, 0]	None	None	26440000000	52620000000	26440000000	52620000000	26440000000	52620000000	None	0	1	0	False	False	8	0	0	0
Sẵn hàng - [Thời trang nam 2020] ÁO GIÓ CHỐNG NƯỚC 2 LỚP LÓT LƯỚI TRÁNG GƯƠNG [HOT] - Acx23 . - Sẵn Hàng	Quảng Ninh	False	20%	False	4	False	0.0	[0, 0, 0, 0, 0, 0]	None	None	50462400000	63078000000	50462400000	63078000000	50462400000	63078000000	None	0	0	0	False	False	6	0	0	0
Áo khoác thể thao Adidas bằng Polyester thoáng khí thời trang nam	Nước ngoài	False	None	False	6	False	0.0	[0, 0, 0, 0, 0, 0]	None	None	96060000000	-1	96060000000	-1	96060000000	0	None	1	1	0	False	False	9	0	0	0
🔥HOT🔥 Mẫu áo Hoodie Law One Piece in hình đẹp ⚡ FREESHIP ⚡Áo Anime đẹp giá rẻ thời trang nam	Hà Nội	False	None	False	5	False	0.0	[0, 0, 0, 0, 0, 0]	None	None	20900000000	-1	20900000000	-1	20900000000	0	None	1	0	0	False	False	1	0	0	0
Order Áo khoác kaki thời trang nam có mũ nỉ	Hà Nội	False	None	False	15	False	0.0	[0, 0, 0, 0, 0, 0]	None	None	32700000000	-1	32700000000	-1	32700000000	0	None	2	17	0	False	False	5	0	0	0
Áo Hoodies Có Nón Dài Tay Thời Trang Nam	Nước ngoài	False	30%	False	0	False	0.0	[0, 0, 0, 0, 0, 0]	None	None	11829900000	16900000000	12739900000	18200000000	11829900000	16900000000	None	0	0	0	False	False	9	0	0	0
ÁO KHOÁC KAKI HỘP THỜI TRANG NAM	TP. Hồ Chí Minh	False	22%	False	1	False	0.0	[0, 0, 0, 0, 0, 0]	None	None	13800000000	17800000000	13800000000	17800000000	13800000000	17800000000	None	1	0	0	False	False	2	0	0	0
Áo Hoodies Có Nón Dài Tay Thời Trang Nam	Nước ngoài	False	50%	False	5	False	0.0	[0, 0, 0, 0, 0, 0]	None	None	10930000000	21750000000	10930000000	21750000000	10930000000	21750000000	None	0	0	0	False	False	7	0	0	0
Áo khoác thời trang nam (phong cách 2 mặt) giá rẻ	An Giang	False	5%	False	1	False	0.0	[0, 0, 0, 0, 0, 0]	None	None	24700000000	26000000000	24700000000	26000000000	24700000000	26000000000	None	0	0	0	False	False	4	0	0	0
[THỜI TRANG NAM] Áo Khoác Dù Nam Có Nón HCM AKD119 + Tặng Ví Nam (Xanh đen)	TP. Hồ Chí Minh	False	37%	False	7	False	0.0	[0, 0, 0, 0, 0, 0]	None	None	16900000000	26900000000	16900000000	26900000000	16900000000	26900000000	None	0	38	0	False	False	5	0	0	0
Áo khoác thời trang nam màu trơn	Nước ngoài	False	12%	False	18	False	0.0	[0, 0, 0, 0, 0, 0]	None	None	23120300000	26273100000	23120300000	26273100000	23120300000	26273100000	None	1	3	0	False	False	9	0	0	0
Áo Khoác Gió Thời Trang Nam Phong Cách Hàn Quốc	Hà Nội	False	None	False	4	False	0.0	[0, 0, 0, 0, 0, 0]	None	None	39800000000	-1	39800000000	-1	39800000000	0	None	0	0	0	False	False	9	0	0	0
Áo Hoodies Có Nón Dài Tay Thời Trang Nam Cỡ Lớn Q5	Nước ngoài	False	25%	False	5	False	0.0	[0, 0, 0, 0, 0, 0]	None	None	24000000000	32000000000	24000000000	32000000000	24000000000	32000000000	None	0	0	0	False	False	4	0	0	0
Áo Hoodie Cotton Thời Trang Nam	Nước ngoài	False	45%	False	6	False	0.0	[0, 0, 0, 0, 0, 0]	None	None	31700000000	57730000000	31700000000	57730000000	31700000000	57730000000	None	0	0	0	False	False	9	0	0	0
Áo Khoác Dù Có Nón Thời Trang Nam	Nước ngoài	False	None	False	7	False	0.0	[0, 0, 0, 0, 0, 0]	None	None	23710000000	-1	33150000000	-1	23710000000	0	None	0	0	0	False	False	8	0	0	0
Áo Khoác Có Nón Khóa Kéo Thời Trang Nam	Nước ngoài	False	None	False	6	False	0.0	[0, 0, 0, 0, 0, 0]	None	None	22900000000	-1	22900000000	-1	22900000000	0	None	1	14	0	False	False	9	0	0	0
HOT- áo phông Dota 2 in hình đẹp ⚡ FREESHIP ⚡Áo Game đẹp giá rẻ thời trang nam - ÁO GAME CHẤT	Hà Nội	False	None	False	1	False	0.0	[0, 0, 0, 0, 0, 0]	None	None	11915600000	-1	11915600000	-1	11915600000	0	None	0	0	0	False	False	1	0	0	0
Áo Khoác Túi Hộp Thời Trang Nam Cao Cấp M65	Nước ngoài	False	46%	False	7	False	0.0	[0, 0, 0, 0, 0, 0]	None	None	47570000000	88100000000	47570000000	88100000000	47570000000	88100000000	None	0	8	0	False	False	9	0	0	0
áo hoodie Mobile Legends in hình đẹp ⚡ FREESHIP ⚡Áo Game đẹp giá rẻ thời trang nam	Hà Nội	False	None	False	5	False	0.0	[0, 0, 0, 0, 0, 0]	None	None	22487000000	-1	22487000000	-1	22487000000	0	None	0	0	0	False	False	1	0	0	0
Áo khoác không tay thời trang nam trẻ trung	Nước ngoài	False	50%	False	5	False	0.0	[0, 0, 0, 0, 0, 0]	None	None	32560000000	64790000000	32560000000	64790000000	32560000000	64790000000	None	0	0	0	False	True	5	0	0	0
Áo Khoác Da Pu Thời Trang Nam 2018	Nước ngoài	False	None	False	7	False	0.0	[0, 0, 0, 0, 0, 0]	None	None	66517800000	-1	66517800000	-1	66517800000	0	None	0	0	0	False	False	9	0	0	0
Quần Dài Dây Rút Trẻ Trung Thời Trang Nam	Nước ngoài	False	None	False	21	False	0.0	[0, 0, 0, 0, 0, 0]	None	None	75600000000	-1	75600000000	-1	75600000000	0	None	0	2	0	False	False	2	0	0	0
Áo Khoác Khóa Kéo Thời Trang Nam 2019	Nước ngoài	False	50%	False	4	False	0.0	[0, 0, 0, 0, 0, 0]	None	None	37380000000	74380000000	38470000000	76550000000	37380000000	74380000000	None	0	0	0	False	False	5	0	0	0
Quần Dài Ống Đứng Thời Trang Nam	Nước ngoài	False	None	False	14	False	0.0	[0, 0, 0, 0, 0, 0]	None	None	82800000000	-1	82800000000	-1	82800000000	0	None	0	0	0	False	False	3	0	0	0
Set Áo Thun Ngắn Tay Cổ Tròn + Quần Short Lưng Thun Thời Trang Nam	Nước ngoài	False	50%	False	5	False	0.0	[0, 0, 0, 0, 0, 0]	None	None	28590000000	56890000000	28590000000	56890000000	28590000000	56890000000	None	0	0	0	False	False	5	0	0	0
Áo Hoodies Cổ Tròn Dài Tay + Quần Dài Thể Thao Thời Trang Nam	Nước ngoài	False	38%	False	6	False	0.0	[0, 0, 0, 0, 0, 0]	None	None	31160000000	49750000000	36440000000	58640000000	31160000000	49750000000	None	0	0	0	False	False	8	0	0	0
Áo Khoác Phao Cổ Đứng Giữ Ấm Thời Trang Nam Trung Niên 2020	Nước ngoài	False	None	False	5	False	0.0	[0, 0, 0, 0, 0, 0]	None	None	72886100000	-1	72886100000	-1	72886100000	0	None	0	8	0	False	True	9	0	0	0
Jeep Áo Khoác Jeans Thời Trang Nam Cá Tính	Nước ngoài	False	None	False	8	False	0.0	[0, 0, 0, 0, 0, 0]	None	None	97300000000	-1	97300000000	-1	97300000000	0	None	0	0	0	False	False	7	0	0	0
Áo Khoác Phao Không Tay Thời Trang Nam	Nước ngoài	False	37%	False	8	False	0.0	[0, 0, 0, 0, 0, 0]	None	None	49660000000	78560000000	49660000000	78560000000	49660000000	78560000000	None	0	0	0	False	False	9	0	0	0
Áo Khoác Da Pu Thời Trang Nam Cá Tính	Nước ngoài	False	None	False	6	False	0.0	[0, 0, 0, 0, 0, 0]	None	None	75157300000	-1	75157300000	-1	75157300000	0	None	0	0	0	False	False	9	0	0	0
Set Áo Thun Ngắn Tay Cổ Tròn + Quần Dài Lưng Thun Thời Trang Nam 083.12	Nước ngoài	False	None	False	5	False	0.0	[0, 0, 0, 0, 0, 0]	None	None	23180000000	-1	23180000000	-1	23180000000	0	None	0	0	0	False	False	5	0	0	0
Áo Hoodie màu Xám thời trang Nam chất liệu  vải Cotton dày giữ ấm tốt Hàng VNXK (Hàng Sẵn / Giá Thấp)	Đắk Lắk	False	None	False	4	False	0.0	[0, 0, 0, 0, 0, 0]	None	None	25000000000	-1	25000000000	-1	25000000000	0	None	0	14	0	False	False	2	0	0	0
Áo Hoodies Có Nón Dài Tay Thời Trang Nam	Nước ngoài	False	None	False	6	False	0.0	[0, 0, 0, 0, 0, 0]	None	None	19600000000	-1	21700000000	-1	19600000000	0	None	0	1	0	False	False	9	0	0	0
áo khoác phao có mũ thời trang nam boy London	Hà Nội	False	20%	False	3	False	0.0	[0, 0, 0, 0, 0, 0]	None	None	150400000000	188000000000	150400000000	188000000000	150400000000	188000000000	None	0	5	0	False	False	7	0	0	0
Áo Khoác Bóng Chày Thời Trang Nam Cá Tính	Nước ngoài	False	38%	False	6	False	0.0	[0, 0, 0, 0, 0, 0]	None	None	29990000000	48140000000	29990000000	48140000000	29990000000	48140000000	None	0	0	0	False	False	9	0	0	0
Áo Khoác Thời Trang Nam Họa Tiết Sọc Ngang	Nước ngoài	False	20%	False	6	False	0.0	[0, 0, 0, 0, 0, 0]	None	None	23400000000	29230000000	23400000000	29230000000	23400000000	29230000000	None	0	0	0	False	False	9	0	0	0
Áo Khoác Phao Không Tay Thời Trang Nam	Nước ngoài	False	49%	False	8	False	0.0	[0, 0, 0, 0, 0, 0]	None	None	46870000000	92240000000	49510000000	97530000000	46870000000	92240000000	None	0	0	0	False	False	9	0	0	0
Áo Khoác Bóng Chày Thời Trang Nam	Nước ngoài	False	46%	False	15	False	0.0	[0, 0, 0, 0, 0, 0]	None	None	47020000000	86440000000	47020000000	86440000000	47020000000	86440000000	None	0	0	0	False	False	8	0	0	0
Áo Khoác Da Dày Dáng Rộng Thời Trang Nam 1211	Nước ngoài	False	None	False	5	False	0.0	[0, 0, 0, 0, 0, 0]	None	None	57250000000	-1	76200000000	-1	57250000000	0	None	0	0	0	False	False	9	0	0	0
Áo Khoác Khóa Kéo Có Nón Thời Trang Nam	Nước ngoài	False	50%	False	6	False	0.0	[0, 0, 0, 0, 0, 0]	None	None	30000000000	60000000000	30000000000	60000000000	30000000000	60000000000	None	0	0	0	False	False	9	0	0	0
Áo Khoác Thời Trang Nam Màu Xanh Lơ	Nước ngoài	False	24%	False	5	False	0.0	[0, 0, 0, 0, 0, 0]	None	None	61690000000	81070000000	61690000000	81070000000	61690000000	81070000000	None	0	0	0	False	False	9	0	0	0
Áo Khoác Bomber Thời Trang Nam	Nước ngoài	False	None	False	7	False	0.0	[0, 0, 0, 0, 0, 0]	None	None	72910000000	-1	72910000000	-1	72910000000	0	None	0	0	0	False	False	9	0	0	0
Áo Khoác Sơ Mi Caro Thời Trang Nam Hàn Quốc	Nước ngoài	False	10%	False	4	False	0.0	[0, 0, 0, 0, 0, 0]	None	None	56790000000	63230000000	56790000000	63230000000	56790000000	63230000000	None	0	4	0	False	False	9	0	0	0
(Bán giá nhập) [XẢ KHO GIÁ HUỶ DIỆT] _ Áo gió cao cấp trong lót lưới thời trang nam One 4, phom 50-75kg -BI9721 *	TP. Hồ Chí Minh	False	None	False	2	False	0.0	[0, 0, 0, 0, 0, 0]	None	None	28707000000	-1	28707000000	-1	28707000000	0	None	0	0	0	False	False	8	0	0	0
Set Áo Ghi Lê + Áo Vest + Quần Dài Thời Trang Nam Lịch Lãm	Nước ngoài	False	16%	False	15	False	0.0	[0, 0, 0, 0, 0, 0]	None	None	31590000000	37620000000	31590000000	37620000000	31590000000	37620000000	None	0	0	0	False	False	9	0	0	0
Áo Khoác Bóng Chày Phản Quang Thời Trang Nam	Nước ngoài	False	None	False	1	False	0.0	[0, 0, 0, 0, 0, 0]	None	None	124600000000	-1	124600000000	-1	124600000000	0	None	0	0	0	False	False	6	0	0	0
