name	shop_location	shopee_verified	discount	is_adult	options	show_official_shop_label_in_title	rating_star	rating_count	flash_sale	upcoming_flash_sale	price_min	price_min_before_discoun	price_max	price_max_before_discount	price	price_before_discount	coin_earn_label	liked_count	view_count	cmt_count	is_preferred_plus_seller	show_free_shipping	images	video_info_list	sold	historical_sold
Áo Hoodies Có Nón Dài Tay Thời Trang Nam	Nước ngoài	False	33%	False	0	False	0.0	[0, 0, 0, 0, 0, 0]	None	None	12261000000	18300000000	12261000000	18300000000	12261000000	18300000000	None	0	1	0	False	True	9	0	0	0
Áo Khoác Bóng Chày Thời Trang Nam	Nước ngoài	False	50%	False	4	False	0.0	[0, 0, 0, 0, 0, 0]	None	None	17900000000	35800000000	17900000000	35800000000	17900000000	35800000000	None	0	0	0	False	False	8	0	0	0
Áo khoác jeans thời trang cao cấp nam King168 , áo khoác loại xịn thời trang nam được yêu thích M47	TP. Hồ Chí Minh	False	21%	False	3	False	0.0	[0, 0, 0, 0, 0, 0]	None	None	19750000000	25000000000	19750000000	25000000000	19750000000	25000000000	None	0	2	0	False	False	5	0	0	0
Áo Hoodies Có Nón Dài Tay Thời Trang Nam	Nước ngoài	False	35%	False	0	False	0.0	[0, 0, 0, 0, 0, 0]	None	None	12805000000	19700000000	12805000000	19700000000	12805000000	19700000000	None	0	0	0	False	True	8	0	0	0
Áo Hoodies Có Nón Dài Tay Thời Trang Nam	Nước ngoài	False	27%	False	0	False	0.0	[0, 0, 0, 0, 0, 0]	None	None	12390000000	16900000000	12390000000	16900000000	12390000000	16900000000	None	0	0	0	False	True	8	0	0	0
Áo Khoác Thời Trang Nam Màu Gradient	Nước ngoài	False	12%	False	0	False	0.0	[0, 0, 0, 0, 0, 0]	None	None	20580000000	23000000000	21560000000	24400000000	20580000000	23000000000	None	0	0	0	False	True	9	0	0	0
Áo Khoác Bóng Chày Thời Trang Nam Năng Động	Nước ngoài	False	22%	False	5	False	0.0	[0, 0, 0, 0, 0, 0]	None	None	15030000000	19260000000	24900000000	31950000000	15030000000	19260000000	None	0	0	0	False	False	2	0	0	0
Bộ Quần Áo 2 Món Thời Trang Nam	Nước ngoài	False	33%	False	5	False	0.0	[0, 0, 0, 0, 0, 0]	None	None	42880000000	63960000000	42880000000	63960000000	42880000000	63960000000	None	0	0	0	False	False	9	0	0	0
Áo Khoác Da Khóa Kéo Thời Trang Nam	Nước ngoài	False	36%	False	4	False	0.0	[0, 0, 0, 0, 0, 0]	None	None	45200000000	70840000000	57640000000	89980000000	45200000000	70840000000	None	0	0	0	False	False	9	0	0	0
Quần Dài Có Túi Thời Trang Nam Năng Động	Nước ngoài	False	None	False	12	False	0.0	[0, 0, 0, 0, 0, 0]	None	None	99000000000	-1	99000000000	-1	99000000000	0	None	0	1	0	False	False	3	0	0	0
Áo khoác gió, Áo khoác cặp vải dù Around Corner Unisex Form rộng thời trang nam 2020	TP. Hồ Chí Minh	False	None	False	3	False	0.0	[0, 0, 0, 0, 0, 0]	None	None	30500000000	-1	30500000000	-1	30500000000	0	None	15	3	0	False	False	4	0	0	0
Áo Khoác Bóng Chày Thời Trang Nam	Nước ngoài	False	50%	False	6	False	0.0	[0, 0, 0, 0, 0, 0]	None	None	28510000000	56740000000	28510000000	56740000000	28510000000	56740000000	None	0	0	0	False	False	8	0	0	0
Áo khoác thời trang nam	TP. Hồ Chí Minh	False	None	False	1	False	0.0	[0, 0, 0, 0, 0, 0]	None	None	129000000000	-1	129000000000	-1	129000000000	0	None	0	0	0	False	False	2	0	0	0
Áo Khoác Phao Không Tay Thời Trang Nam	Nước ngoài	False	1%	False	6	False	0.0	[0, 0, 0, 0, 0, 0]	None	None	58300000000	58920000000	58300000000	58920000000	58300000000	58920000000	None	0	0	0	False	False	9	0	0	0
Áo Hoodies Có Nón Dài Tay Thời Trang Nam	Nước ngoài	False	50%	False	5	False	0.0	[0, 0, 0, 0, 0, 0]	None	None	31567200000	63134300000	31567200000	63134300000	31567200000	63134300000	None	0	0	0	False	False	9	0	0	0
Áo Khoác Phao Không Tay Cổ Đứng Thời Trang Nam	Nước ngoài	False	49%	False	8	False	0.0	[0, 0, 0, 0, 0, 0]	None	None	50400000000	99740000000	50400000000	99740000000	50400000000	99740000000	None	0	0	0	False	False	5	0	0	0
Áo Bóng Rổ Cộc Tay Thời Trang Nam	Nước ngoài	False	None	False	5	False	0.0	[0, 0, 0, 0, 0, 0]	None	None	37680000000	-1	37680000000	-1	37680000000	0	None	0	0	0	False	False	5	0	0	0
Áo khoác phao không tay thời trang nam kiểu dáng đơn giản	Nước ngoài	False	47%	False	6	False	0.0	[0, 0, 0, 0, 0, 0]	None	None	33350000000	62720000000	33350000000	62720000000	33350000000	62720000000	None	0	0	0	False	False	9	0	0	0
Áo Khoác Denim Thời Trang Nam	Nước ngoài	False	12%	False	4	False	0.0	[0, 0, 0, 0, 0, 0]	None	None	41020000000	46870000000	41020000000	46870000000	41020000000	46870000000	None	0	0	0	False	False	9	0	0	0
áo phông Dota 2 in hình đẹp ⚡ FREESHIP ⚡Áo Game đẹp giá rẻ thời trang nam	Hà Nội	False	None	False	1	False	0.0	[0, 0, 0, 0, 0, 0]	None	None	8910000000	-1	8910000000	-1	8910000000	0	None	0	0	0	False	False	1	0	0	0
Áo Khoác Bóng Chày Kẻ Sọc Dáng Ôm Thoáng Khí Thời Trang Nam Cao Cấp	Nước ngoài	False	None	False	5	False	0.0	[0, 0, 0, 0, 0, 0]	None	None	98630000000	-1	98630000000	-1	98630000000	0	None	0	0	0	False	False	9	0	0	0
Áo Khoác Bóng Chày Thời Trang Nam Năng Động	Nước ngoài	False	None	False	6	False	0.0	[0, 0, 0, 0, 0, 0]	None	None	66480000000	-1	73970000000	-1	66480000000	0	None	1	2	0	False	False	9	0	0	0
Áo Khoác Lót Nhung Dày Dáng Ôm Thời Trang Nam Trẻ Trung 24 Inch	Nước ngoài	False	None	False	6	False	0.0	[0, 0, 0, 0, 0, 0]	None	None	30650000000	-1	39100000000	-1	30650000000	0	None	0	0	0	False	False	9	0	0	0
Áo Khoác Dù Có Nón Dài Tay Thời Trang Nam	Nước ngoài	False	None	False	6	False	0.0	[0, 0, 0, 0, 0, 0]	None	None	16740000000	-1	25730000000	-1	16740000000	0	None	0	0	0	False	False	9	0	0	0
Áo khoác hoodie thời trang nam đi xe máy RV46	Nước ngoài	False	50%	False	5	False	0.0	[0, 0, 0, 0, 0, 0]	None	None	42000000000	84000000000	42000000000	84000000000	42000000000	84000000000	None	1	28	0	False	False	4	0	0	0
áo bóng rổ cộc tay cổ tròn in chữ hush thời trang nam	Nước ngoài	False	None	False	6	False	0.0	[0, 0, 0, 0, 0, 0]	None	None	21660000000	-1	21660000000	-1	21660000000	0	None	0	0	0	False	False	9	0	0	0
Áo Hoodies Có Nón Dài Tay Thời Trang Nam	Nước ngoài	False	50%	False	6	False	0.0	[0, 0, 0, 0, 0, 0]	None	None	20000000000	40000000000	20000000000	40000000000	20000000000	40000000000	None	0	0	0	False	False	9	0	0	0
Áo Hoodies Có Nón Dài Tay Thời Trang Nam	Nước ngoài	False	50%	False	6	False	0.0	[0, 0, 0, 0, 0, 0]	None	None	20000000000	40000000000	20000000000	40000000000	20000000000	40000000000	None	0	0	0	False	False	9	0	0	0
Áo Khoác Denim Phối Lớp Ngoài Thời Trang Nam Cá Tính	Nước ngoài	False	43%	False	6	False	0.0	[0, 0, 0, 0, 0, 0]	None	None	49360000000	86890000000	49360000000	86890000000	49360000000	86890000000	None	0	1	0	False	False	9	0	0	0
Áo Hoodies The North Face Thời Trang Nam	Nước ngoài	False	50%	False	3	False	0.0	[0, 0, 0, 0, 0, 0]	None	None	44440000000	88430000000	44440000000	88430000000	44440000000	88430000000	None	0	1	0	False	False	8	0	0	0
Áo len cổ lọ dày dặn thời trang nam	Nước ngoài	False	None	False	4	False	0.0	[0, 0, 0, 0, 0, 0]	None	None	57800000000	-1	57800000000	-1	57800000000	0	None	1	3	0	False	False	5	0	0	0
Áo Khoác Denim Thời Trang Nam	Nước ngoài	False	None	False	4	False	0.0	[0, 0, 0, 0, 0, 0]	None	None	41000000000	-1	41000000000	-1	41000000000	0	None	1	0	0	False	False	3	0	0	0
Áo khoác blazer công sở cổ đứng thời trang nam lịch lãm	Nước ngoài	False	1%	False	7	False	0.0	[0, 0, 0, 0, 0, 0]	None	None	57930000000	58540000000	57930000000	58540000000	57930000000	58540000000	None	0	0	0	False	False	8	0	0	0
Áo Khoác Sơ Mi Nhiều Túi Thời Trang Nam 2020	Nước ngoài	False	None	False	4	False	0.0	[0, 0, 0, 0, 0, 0]	None	None	52150000000	-1	52150000000	-1	52150000000	0	None	0	0	0	False	False	9	0	0	0
Áo Hoodies Có Nón Dài Tay Thời Trang Nam	Nước ngoài	False	50%	False	6	False	0.0	[0, 0, 0, 0, 0, 0]	None	None	20000000000	40000000000	20000000000	40000000000	20000000000	40000000000	None	0	0	0	False	False	9	0	0	0
Áo Khoác Phao Cổ Đứng Thời Trang Nam	Nước ngoài	False	None	False	6	False	0.0	[0, 0, 0, 0, 0, 0]	None	None	65030000000	-1	65030000000	-1	65030000000	0	None	0	0	0	False	False	9	0	0	0
Sẵn Hàng - [Thời trang nam 2020] ÁO GIÓ 2 LỚP LÓT LƯỚI [HOT] -Az12 . -Re111 !	Hà Nội	False	None	False	3	False	0.0	[0, 0, 0, 0, 0, 0]	None	None	76863000000	-1	76863000000	-1	76863000000	0	None	0	0	0	False	False	9	0	0	0
Sẵn hàng - [Thời trang nam 2020] ÁO GIÓ CHỐNG NƯỚC 2 LỚP LÓT LƯỚI TRÁNG GƯƠNG [HOT] - Acx23 . -Re111 !	Hà Nội	False	None	False	4	False	0.0	[0, 0, 0, 0, 0, 0]	None	None	63083000000	-1	63083000000	-1	63083000000	0	None	0	0	0	False	False	6	0	0	0
Áo Khoác Sơ Mi Caro Thời Trang Nam Hàn Quốc	Nước ngoài	False	None	False	4	False	0.0	[0, 0, 0, 0, 0, 0]	None	None	33660000000	-1	33660000000	-1	33660000000	0	None	0	0	0	False	False	8	0	0	0
Áo Khoác Da Bóng Chày Thời Trang Nam Cá Tính 2020	Nước ngoài	False	3%	False	5	False	0.0	[0, 0, 0, 0, 0, 0]	None	None	93900000000	96810000000	93900000000	96810000000	93900000000	96810000000	None	0	0	0	False	True	9	0	0	0
Áo Khoác Phao Cổ Đứng Thời Trang Nam 2020	Nước ngoài	False	50%	False	7	False	0.0	[0, 0, 0, 0, 0, 0]	None	None	48389200000	96778400000	48389200000	96778400000	48389200000	96778400000	None	0	0	0	False	False	9	0	0	0
Áo Hoodies Có Nón Dài Tay Thời Trang Nam	Nước ngoài	False	None	False	4	False	0.0	[0, 0, 0, 0, 0, 0]	None	None	143500000000	-1	143500000000	-1	143500000000	0	None	0	0	0	False	False	6	0	0	0
Áo Khoác Denim Có Nón Thời Trang Nam 2018	Nước ngoài	False	None	False	6	False	0.0	[0, 0, 0, 0, 0, 0]	None	None	87450000000	-1	87450000000	-1	87450000000	0	None	0	0	0	False	False	6	0	0	0
Quần Dài Thời Trang Nam Chất Liệu Thun	Nước ngoài	False	None	False	5	False	0.0	[0, 0, 0, 0, 0, 0]	None	None	81620000000	-1	81620000000	-1	81620000000	0	None	0	0	0	False	False	6	0	0	0
Áo khoác nỉ cao cấp nam , áo khoác loại nhất thời trang nam mẫu MS2134	TP. Hồ Chí Minh	True	33%	False	3	False	0.0	[0, 0, 0, 0, 0, 0]	None	None	12000000000	18000000000	12000000000	18000000000	12000000000	18000000000	None	0	0	0	False	False	5	0	0	0
Áo Khoác Dù Nam Chống Mưa,Nắng Cao Cấp,Thời Trang Nam-AKD01 -Hàng nhập khẩu	Hà Nội	False	None	False	12	False	0.0	[0, 0, 0, 0, 0, 0]	None	None	63900000000	-1	63900000000	-1	63900000000	0	None	0	25	0	False	False	9	0	0	0
ÁO KHOÁC JEAN IN HÌNH HỌA TIẾT THỜI TRANG NAM	Bình Dương	False	None	False	3	False	0.0	[0, 0, 0, 0, 0, 0]	None	None	16900000000	-1	16900000000	-1	16900000000	0	None	0	0	0	False	False	3	0	0	0
Áo Khoác Phao Không Tay Khóa Kéo Thời Trang Nam	Nước ngoài	True	30%	False	4	False	0.0	[0, 0, 0, 0, 0, 0]	None	None	24100000000	34400000000	24300000000	34700000000	24100000000	34400000000	None	0	7	0	False	False	9	0	0	0
Áo khoác bò cho nam[FREESHIP]_áo bò thời trang nam CAO CẤP	Hà Nội	False	13%	False	4	False	0.0	[0, 0, 0, 0, 0, 0]	None	None	65800000000	75800000000	65800000000	75800000000	65800000000	75800000000	None	1	5	0	False	False	2	0	0	0
Áo Vest - Hàn Quốc - Thời Trang - Nam	TP. Hồ Chí Minh	False	None	False	8	False	0.0	[0, 0, 0, 0, 0, 0]	None	None	49500000000	-1	49500000000	-1	49500000000	0	None	0	1	0	False	False	9	0	0	0
Áo Hoodies Có Nón Dài Tay Thời Trang Nam	Nước ngoài	False	35%	False	0	False	0.0	[0, 0, 0, 0, 0, 0]	None	None	14170000000	21800000000	14170000000	21800000000	14170000000	21800000000	None	0	0	0	False	True	9	0	0	0
Áo Thun Không Tay Khóa Kéo Thời Trang Nam	Nước ngoài	False	46%	False	4	False	0.0	[0, 0, 0, 0, 0, 0]	None	None	17940000000	33330000000	18490000000	34330000000	17940000000	33330000000	None	0	0	0	False	False	9	0	0	0
[ Giảm 38% ]  Áo khoác thời trang nam `	TP. Hồ Chí Minh	False	26%	False	4	False	0.0	[0, 0, 0, 0, 0, 0]	None	None	38695700000	52291400000	38695700000	52291400000	38695700000	52291400000	None	0	1	0	False	False	3	0	0	0
Áo Hoodies Có Nón Dài Tay In Hình 3d Thời Trang Nam	Nước ngoài	False	44%	False	8	False	0.0	[0, 0, 0, 0, 0, 0]	None	None	31160000000	56110000000	31160000000	56110000000	31160000000	56110000000	None	0	0	0	False	False	8	0	0	0
Áo Khoác Thời Trang Nam Chất Liệu Vải Denim	Nước ngoài	False	35%	False	0	False	0.0	[0, 0, 0, 0, 0, 0]	None	None	29510000000	45400000000	29510000000	45400000000	29510000000	45400000000	None	0	0	0	False	True	7	0	0	0
[sale đón têt ] Áo Khoác Thời Trang Nam ..!	Phú Thọ	False	None	False	6	False	0.0	[0, 0, 0, 0, 0, 0]	None	None	51180000000	-1	62780000000	-1	51180000000	0	None	0	1	0	False	False	5	0	0	0
Xả Lỗ [HÀNG MỚI VỀ] _ Áo gió cao cấp thời trang nam One 3 phom 40-85kg hot	TP. Hồ Chí Minh	False	None	False	4	False	0.0	[0, 0, 0, 0, 0, 0]	None	None	38870000000	-1	38870000000	-1	38870000000	0	None	0	1	0	False	False	8	0	0	0
Áo khoác thời trang nam phong cách Gothic	Nước ngoài	False	12%	False	15	False	0.0	[0, 0, 0, 0, 0, 0]	None	None	48085700000	54642900000	48085700000	54642900000	48085700000	54642900000	None	3	24	0	False	False	9	0	0	0
Áo Khoác Khóa Kéo In Hình 3d Thời Trang Nam	Nước ngoài	False	None	False	8	False	0.0	[0, 0, 0, 0, 0, 0]	None	None	35500000000	-1	35500000000	-1	35500000000	0	None	0	0	0	False	False	4	0	0	0
Áo khoác vest cổ đứng thời trang nam lịch lãm	Nước ngoài	False	None	False	7	False	0.0	[0, 0, 0, 0, 0, 0]	None	None	77460000000	-1	77460000000	-1	77460000000	0	None	0	3	0	False	False	5	0	0	0
Áo Khoác Phao Dày Có Nón Khóa Kéo Thời Trang Nam	Nước ngoài	False	None	False	6	False	0.0	[0, 0, 0, 0, 0, 0]	None	None	99731500000	-1	99731500000	-1	99731500000	0	None	0	0	0	False	True	9	0	0	0
Áo Hoodies Có Nón Dài Tay Thời Trang Nam	Nước ngoài	False	13%	False	6	False	0.0	[0, 0, 0, 0, 0, 0]	None	None	19808100000	22767900000	19808100000	22767900000	19808100000	22767900000	None	0	0	0	False	False	5	0	0	0
Áo Khoác Phao Cộc Tay Có Nón Thời Trang Nam	Nước ngoài	False	35%	False	0	False	0.0	[0, 0, 0, 0, 0, 0]	None	None	37900000000	58300000000	37900000000	58300000000	37900000000	58300000000	None	0	15	0	False	False	6	0	0	0
Mẫu áo Hoodie Law One Piece in hình đẹp ⚡ FREESHIP ⚡Áo Anime đẹp giá rẻ thời trang nam /uy tín chất lượng	Hà Nội	False	None	False	1	False	0.0	[0, 0, 0, 0, 0, 0]	None	None	21840500000	-1	21840500000	-1	21840500000	0	None	0	1	0	False	False	1	0	0	0
Quần Dài Ống Đứng Thời Trang Nam	Nước ngoài	False	None	False	9	False	0.0	[0, 0, 0, 0, 0, 0]	None	None	75600000000	-1	75600000000	-1	75600000000	0	None	0	0	0	False	False	4	0	0	0
11.11 Sẵn hàng - [HÀNG MỚI VỀ] _ Áo gió 2 lớp thời trang nam AG02, phom 45-80kg - Acx23 - AZ50	TP. Hồ Chí Minh	False	35%	False	3	False	0.0	[0, 0, 0, 0, 0, 0]	None	None	22357000000	34395300000	22357000000	34395300000	22357000000	34395300000	None	0	0	0	False	False	6	0	0	0
Áo Khoác Sơ Mi Dài Tay Thời Trang Nam 2020	Nước ngoài	False	None	False	5	False	0.0	[0, 0, 0, 0, 0, 0]	None	None	28690000000	-1	50400000000	-1	28690000000	0	None	0	0	0	False	False	5	0	0	0
Áo Khoác Da Dài Tay Cổ Đứng Thời Trang Nam	Nước ngoài	False	27%	False	5	False	0.0	[0, 0, 0, 0, 0, 0]	None	None	40910000000	55700000000	40910000000	55700000000	40910000000	55700000000	None	0	0	0	False	False	6	0	0	0
Áo Khoác Giữ Ấm Thời Trang Nam	Nước ngoài	False	1%	False	4	False	0.0	[0, 0, 0, 0, 0, 0]	None	None	71880300000	72606300000	71880300000	72606300000	71880300000	72606300000	None	0	1	0	False	False	9	0	0	0
Áo Hoodies Có Nón Dài Tay Thời Trang Nam	Nước ngoài	False	None	False	5	False	0.0	[0, 0, 0, 0, 0, 0]	None	None	16500000000	-1	16500000000	-1	16500000000	0	None	0	0	0	False	False	9	0	0	0
Áo Hoodies Có Nón Dài Tay Thời Trang Nam	Nước ngoài	False	None	False	4	False	0.0	[0, 0, 0, 0, 0, 0]	None	None	173600000000	-1	173600000000	-1	173600000000	0	None	0	0	0	False	False	9	0	0	0
Áo Khoác Phao Không Tay Thời Trang Nam	Nước ngoài	False	50%	False	6	False	0.0	[0, 0, 0, 0, 0, 0]	None	None	31700000000	63400000000	31700000000	63400000000	31700000000	63400000000	None	0	5	0	False	False	8	0	0	0
Áo khoác bóng chày chất liệu dày thời trang nam size M - 6 Xl	Nước ngoài	False	None	False	8	False	0.0	[0, 0, 0, 0, 0, 0]	None	None	53400000000	-1	53400000000	-1	53400000000	0	None	0	0	0	False	False	9	0	0	0
Áo Khoác Thời Trang Nam Phong Cách Hàn Quốc Cá Tính	Nước ngoài	False	49%	False	4	False	0.0	[0, 0, 0, 0, 0, 0]	None	None	42510000000	82920000000	42510000000	82920000000	42510000000	82920000000	None	0	0	0	False	False	8	0	0	0
Áo Hoodies Có Nón Dài Tay In Hình 3d Thời Trang Nam	Nước ngoài	False	None	False	6	False	0.0	[0, 0, 0, 0, 0, 0]	None	None	36950000000	-1	36950000000	-1	36950000000	0	None	0	0	0	False	False	5	0	0	0
[THỜI TRANG NAM] Áo khoác da lót lông nam thời trang cao cấp HCM AKD088 TẶNG VỚ	TP. Hồ Chí Minh	False	31%	False	4	False	0.0	[0, 0, 0, 0, 0, 0]	None	None	31000000000	45000000000	31000000000	45000000000	31000000000	45000000000	None	0	0	0	False	False	7	0	0	0
Áo Khoác Đệm Bông Thời Trang Nam Trung Niên	Nước ngoài	False	50%	False	5	False	0.0	[0, 0, 0, 0, 0, 0]	None	None	38445000000	76890000000	38445000000	76890000000	38445000000	76890000000	None	0	8	0	False	False	9	0	0	0
Áo Hoodies Có Nón Dài Tay Thời Trang Nam	Nước ngoài	False	50%	False	6	False	0.0	[0, 0, 0, 0, 0, 0]	None	None	20000000000	40000000000	20000000000	40000000000	20000000000	40000000000	None	0	0	0	False	False	9	0	0	0
Áo Hoodies Có Nón Dài Tay Thời Trang Nam	Nước ngoài	False	50%	False	6	False	0.0	[0, 0, 0, 0, 0, 0]	None	None	20000000000	40000000000	20000000000	40000000000	20000000000	40000000000	None	0	0	0	False	False	9	0	0	0
Áo Khoác Cardigan Dài Tay Có Mũ Thời Trang Nam	Nước ngoài	False	30%	False	5	False	0.0	[0, 0, 0, 0, 0, 0]	None	None	62710200000	89586100000	64485900000	92122800000	62710200000	89586100000	None	0	0	0	False	False	9	0	0	0
Áo hoodie in logo ADIDAS 3D thời trang nam mùa thu đông	Nước ngoài	False	50%	False	10	False	0.0	[0, 0, 0, 0, 0, 0]	None	None	24420000000	48580000000	24420000000	48580000000	24420000000	48580000000	None	0	33	0	False	False	4	0	0	0
11.11 Sẵn hàng - [HÀNG MỚI VỀ] _ Áo gió 2 lớp thời trang nam AG02, phom 45-80kg - Acx23 -Re111	TP. Hồ Chí Minh	False	20%	False	3	False	0.0	[0, 0, 0, 0, 0, 0]	None	None	23927200000	29909000000	23927200000	29909000000	23927200000	29909000000	None	0	0	0	False	False	9	0	0	0
(Bán giá nhập) Xả - [HÀNG MỚI VỀ] _ Áo gió 2 lớp thời trang nam AG02, phom 45-80kg - Acx23 -BI9721 *	TP. Hồ Chí Minh	False	None	False	3	False	0.0	[0, 0, 0, 0, 0, 0]	None	None	28715600000	-1	28715600000	-1	28715600000	0	None	0	0	0	False	False	9	0	0	0
-HÀNG NHẬP KHẨU Áo bò, Áo khoác jean nam in hình chữ thập  thời trang nam 2020 - màu đen  Liên hệ mua hàng 084.209.1989	Hà Nội	False	None	False	3	False	0.0	[0, 0, 0, 0, 0, 0]	None	None	69400000000	-1	69400000000	-1	69400000000	0	None	0	3	0	False	False	5	0	0	0
Áo khoác bóng chày có cổ dáng ôm họa tiết hoa thời trang nam	Nước ngoài	False	1%	False	8	False	0.0	[0, 0, 0, 0, 0, 0]	None	None	46340000000	46830000000	46340000000	46830000000	46340000000	46830000000	None	0	0	0	False	False	9	0	0	0
Áo thun Sweater dáng rộng thời trang nam Hàn Quốc	Nước ngoài	False	30%	False	6	False	0.0	[0, 0, 0, 0, 0, 0]	None	None	28690000000	41270000000	28690000000	41270000000	28690000000	41270000000	None	0	0	0	False	False	9	0	0	0
Áo Khoác Vest Phong Cách Trung Hoa Thời Trang Nam	Nước ngoài	False	None	False	6	False	0.0	[0, 0, 0, 0, 0, 0]	None	None	89000000000	-1	89000000000	-1	89000000000	0	None	0	0	0	False	False	9	0	0	0
Áo Khoác Phao Cổ Viền Lông Thời Trang Nam	Nước ngoài	False	12%	False	5	False	0.0	[0, 0, 0, 0, 0, 0]	None	None	83840000000	95030000000	83840000000	95030000000	83840000000	95030000000	None	0	5	0	False	False	9	0	0	0
Hot [Siêu Quà] Áo khoác phao đại hàn thời trang nam siêu dày ấm cao cấp APHA03-1827 . ⇹	Hà Nội	False	None	False	5	False	0.0	[0, 0, 0, 0, 0, 0]	None	None	46722700000	-1	46722700000	-1	46722700000	0	None	0	0	0	False	False	9	0	0	0
Set Áo Hoodies Có Nón Dài Tay + Quần Dài Họa Tiết Rằn Ri Thời Trang Nam	Nước ngoài	False	50%	False	5	False	0.0	[0, 0, 0, 0, 0, 0]	None	None	22000000000	44000000000	22000000000	44000000000	22000000000	44000000000	None	0	0	0	False	False	7	0	0	0
Túi Đeo Chéo Thời Trang Nam 2020	Nước ngoài	False	50%	False	6	False	0.0	[0, 0, 0, 0, 0, 0]	None	None	44702600000	89405200000	44702600000	89405200000	44702600000	89405200000	None	0	0	0	False	False	3	0	0	0
Áo Khoác Bóng Chày Dài Tay Có Mũ Thời Trang Nam	Nước ngoài	False	47%	False	6	False	0.0	[0, 0, 0, 0, 0, 0]	None	None	29620000000	56050000000	29620000000	56050000000	29620000000	56050000000	None	0	0	0	False	False	8	0	0	0
-HÀNG NHẬP KHẨU Áo khoác jean nam nữ in hình chữ LEVI'S thời trang nam 2020 - màu đen  Liên hệ mua hàng 084.209.1989	Hà Nội	False	None	False	3	False	0.0	[0, 0, 0, 0, 0, 0]	None	None	66850000000	-1	66850000000	-1	66850000000	0	None	0	0	0	False	False	9	0	0	0
Áo khoác dài tay thời trang nam tuổi trung niên	Nước ngoài	False	21%	False	5	False	0.0	[0, 0, 0, 0, 0, 0]	None	None	47050000000	59210000000	47050000000	59210000000	47050000000	59210000000	None	0	0	0	False	False	8	0	0	0
Áo khoác dù thời trang nam logo LÁ PHONG form 60kg 25D.M048	TP. Hồ Chí Minh	False	36%	False	3	False	0.0	[0, 0, 0, 0, 0, 0]	None	None	8900000000	13900000000	8900000000	13900000000	8900000000	13900000000	None	0	0	0	False	False	3	0	0	0
Áo Khoác Nam❤FREESHIP ❤áo chống nắng Dù Xịn-Áo khoác Cao Cấp,Thời Trang Nam Phái Mạnh-AKD124	TP. Hồ Chí Minh	False	None	False	13	False	0.0	[0, 0, 0, 0, 0, 0]	None	None	8900000000	-1	15000000000	-1	8900000000	0	None	0	1	0	False	False	9	0	0	0
Áo Khoác Jean Thời Trang Nam	Nước ngoài	False	10%	False	5	False	0.0	[0, 0, 0, 0, 0, 0]	None	None	26750000000	29722300000	26750000000	29722300000	26750000000	29722300000	None	0	0	0	False	False	9	0	0	0
🔥HOT🔥 Mẫu áo Hoodie in hình OVERLORD anime đẹp giá rẻ thời trang nam	Hà Nội	False	None	False	5	False	0.0	[0, 0, 0, 0, 0, 0]	None	None	16900000000	-1	16900000000	-1	16900000000	0	None	0	6	0	False	True	1	0	0	0
Áo Khoác Len Không Tay Trẻ Trung Thời Trang Nam	Nước ngoài	False	49%	False	4	False	0.0	[0, 0, 0, 0, 0, 0]	None	None	18200000000	35740000000	18200000000	35740000000	18200000000	35740000000	None	0	0	0	False	False	9	0	0	0
Áo Len Cổ Tròn Dài Tay Thời Trang Nam	Nước ngoài	False	50%	False	5	False	0.0	[0, 0, 0, 0, 0, 0]	None	None	39850000000	79290000000	39850000000	79290000000	39850000000	79290000000	None	0	0	0	False	False	8	0	0	0
[ Giảm 30% ] [HÀNG MỚI VỀ] _ Áo gió 2 lớp thời trang nam AG02, phom 45-80kg V09 *	Hải Phòng	False	None	False	3	False	0.0	[0, 0, 0, 0, 0, 0]	None	None	23618100000	-1	23618100000	-1	23618100000	0	None	0	0	0	False	False	9	0	0	0
Áo Khoác Bóng Chày Dài Tay Thời Trang Nam	Nước ngoài	False	None	False	20	False	0.0	[0, 0, 0, 0, 0, 0]	None	None	22350000000	-1	22350000000	-1	22350000000	0	None	0	0	0	False	False	9	0	0	0
Áo Khoác Dù Nam , Áo Thời Trang Nam Mẫu Mới 2020	Hà Nội	False	None	False	4	False	0.0	[0, 0, 0, 0, 0, 0]	None	None	31900000000	-1	31900000000	-1	31900000000	0	None	0	0	0	False	False	2	0	0	0
Áo Khoác Thời Trang Nam Màu Xanh/đen	Nước ngoài	True	18%	False	5	False	0.0	[0, 0, 0, 0, 0, 0]	None	None	35990000000	43820000000	35990000000	43820000000	35990000000	43820000000	None	0	0	0	False	False	8	1	0	0
Áo Len Cổ Tròn Dài Tay Thời Trang Nam	Nước ngoài	False	24%	False	5	False	0.0	[0, 0, 0, 0, 0, 0]	None	None	31490000000	41620000000	31490000000	41620000000	31490000000	41620000000	None	1	1	0	False	True	8	0	0	0
Áo khoác jean mang đậm cá tính thời trang nam NBN , áo khoác jean đẹp cao cấp nam V51	TP. Hồ Chí Minh	False	None	False	3	False	0.0	[0, 0, 0, 0, 0, 0]	None	None	19750000000	-1	19750000000	-1	19750000000	0	None	0	0	0	False	False	5	0	0	0
Áo Khoác Bóng Chày Khóa Kéo Thời Trang Nam	Nước ngoài	False	None	False	6	False	0.0	[0, 0, 0, 0, 0, 0]	None	None	58856100000	-1	86039300000	-1	58856100000	0	None	0	0	0	False	False	7	0	0	0
Áo Khoác Jean Rách Thời Trang Nam 2019	Nước ngoài	False	36%	False	3	False	0.0	[0, 0, 0, 0, 0, 0]	None	None	42280000000	66130000000	55700000000	86770000000	42280000000	66130000000	None	0	1	0	False	False	4	0	0	0
Hot [Siêu Quà] Áo khoác phao đại hàn thời trang nam siêu dày ấm cao cấp APHA03-1827 . !	Hà Nội	False	None	False	5	False	0.0	[0, 0, 0, 0, 0, 0]	None	None	46721700000	-1	46721700000	-1	46721700000	0	None	0	4	0	False	False	9	0	0	0
Áo Len Cổ Tròn Dài Tay Thời Trang Nam	Nước ngoài	False	None	False	15	False	0.0	[0, 0, 0, 0, 0, 0]	None	None	32860000000	-1	32860000000	-1	32860000000	0	None	0	0	0	False	False	9	0	0	0
Áo Khoác Thời Trang Nam Họa Tiết Ca Rô	Nước ngoài	False	50%	False	6	False	0.0	[0, 0, 0, 0, 0, 0]	None	None	32370000000	64410000000	32370000000	64410000000	32370000000	64410000000	None	0	0	0	False	False	7	0	0	0
Áo Khoác Dù Có Mũ Khóa Kéo Thời Trang Nam	Nước ngoài	False	50%	False	6	False	0.0	[0, 0, 0, 0, 0, 0]	None	None	36600000000	72840000000	36600000000	72840000000	36600000000	72840000000	None	0	0	0	False	False	8	0	0	0
Áo Khoác Sweater Thời Trang Nam Trẻ Trung Cá Tính	Nước ngoài	False	10%	False	5	False	0.0	[0, 0, 0, 0, 0, 0]	None	None	34380000000	38170000000	34380000000	38170000000	34380000000	38170000000	None	0	0	0	False	False	8	0	0	0
